smartctl 6.6 2017-11-05 r4594 [x86_64-linux-4.19.0-6-amd64] (local build)
Copyright (C) 2002-17, Bruce Allen, Christian Franke, www.smartmontools.org

=== START OF INFORMATION SECTION ===
Device Model:     SanDisk SD9TB8W256G1001
Serial Number:    19170C803859
LU WWN Device Id: 5 001b44 8b88f91e6
Firmware Version: X6107101
User Capacity:    256,060,514,304 bytes [256 GB]
Sector Size:      512 bytes logical/physical
Rotation Rate:    Solid State Device
Form Factor:      2.5 inches
Device is:        Not in smartctl database [for details use: -P showall]
ATA Version is:   ACS-4 T13/BSR INCITS 529 revision 5
SATA Version is:  SATA 3.3, 6.0 Gb/s (current: 3.0 Gb/s)
Local Time is:    Thu Nov 28 12:37:38 2019 CST
SMART support is: Available - device has SMART capability.
SMART support is: Enabled

=== START OF READ SMART DATA SECTION ===
SMART overall-health self-assessment test result: PASSED

General SMART Values:
Offline data collection status:  (0x00)	Offline data collection activity
					was never started.
					Auto Offline Data Collection: Disabled.
Self-test execution status:      (   0)	The previous self-test routine completed
					without error or no self-test has ever 
					been run.
Total time to complete Offline 
data collection: 		(    0) seconds.
Offline data collection
capabilities: 			 (0x11) SMART execute Offline immediate.
					No Auto Offline data collection support.
					Suspend Offline collection upon new
					command.
					No Offline surface scan supported.
					Self-test supported.
					No Conveyance Self-test supported.
					No Selective Self-test supported.
SMART capabilities:            (0x0003)	Saves SMART data before entering
					power-saving mode.
					Supports SMART auto save timer.
Error logging capability:        (0x01)	Error logging supported.
					General Purpose Logging supported.
Short self-test routine 
recommended polling time: 	 (   2) minutes.
Extended self-test routine
recommended polling time: 	 (  10) minutes.

SMART Attributes Data Structure revision number: 4
Vendor Specific SMART Attributes with Thresholds:
ID# ATTRIBUTE_NAME          FLAG     VALUE WORST THRESH TYPE      UPDATED  WHEN_FAILED RAW_VALUE
  5 Reallocated_Sector_Ct   0x0032   100   100   ---    Old_age   Always       -       0
  9 Power_On_Hours          0x0032   100   100   ---    Old_age   Always       -       926
 12 Power_Cycle_Count       0x0032   100   100   ---    Old_age   Always       -       23
170 Unknown_Attribute       0x0032   100   100   ---    Old_age   Always       -       0
171 Unknown_Attribute       0x0032   100   100   ---    Old_age   Always       -       0
172 Unknown_Attribute       0x0032   100   100   ---    Old_age   Always       -       0
173 Unknown_Attribute       0x0032   100   100   ---    Old_age   Always       -       0
174 Unknown_Attribute       0x0032   100   100   ---    Old_age   Always       -       11
178 Used_Rsvd_Blk_Cnt_Chip  0x0032   100   100   ---    Old_age   Always       -       0
180 Unused_Rsvd_Blk_Cnt_Tot 0x0033   100   100   010    Pre-fail  Always       -       100
184 End-to-End_Error        0x0033   100   100   097    Pre-fail  Always       -       0
187 Reported_Uncorrect      0x0032   100   100   ---    Old_age   Always       -       0
194 Temperature_Celsius     0x0022   073   040   ---    Old_age   Always       -       27 (Min/Max 21/40)
199 UDMA_CRC_Error_Count    0x0032   100   100   ---    Old_age   Always       -       0
233 Media_Wearout_Indicator 0x0033   100   100   000    Pre-fail  Always       -       16777215
234 Unknown_Attribute       0x0032   100   100   ---    Old_age   Always       -       0
236 Unknown_Attribute       0x0033   100   100   000    Pre-fail  Always       -       16762810
237 Unknown_Attribute       0x0032   100   100   ---    Old_age   Always       -       309
241 Total_LBAs_Written      0x0030   253   253   ---    Old_age   Offline      -       255
242 Total_LBAs_Read         0x0030   253   253   ---    Old_age   Offline      -       216
249 Unknown_Attribute       0x0032   100   100   ---    Old_age   Always       -       142

SMART Error Log Version: 1
No Errors Logged

SMART Self-test log structure revision number 1
No self-tests have been logged.  [To run self-tests, use: smartctl -t]

Selective Self-tests/Logging not supported

