
/dev/sdb
=== START OF INFORMATION SECTION ===
Model Family:     Seagate Barracuda 7200.10
Device Model:     ST380815AS
Serial Number:    --
Firmware Version: 3.AAD
User Capacity:    80,026,361,856 bytes [80.0 GB]
Sector Size:      512 bytes logical/physical
Device is:        In smartctl database [for details use: -P show]
ATA Version is:   ATA/ATAPI-7 (minor revision not indicated)
Local Time is:    Fri Sep 27 22:14:24 2019 MSK
SMART support is: Available - device has SMART capability.
SMART support is: Enabled
AAM feature is:   Unavailable
APM feature is:   Unavailable
Rd look-ahead is: Enabled
Write cache is:   Enabled
DSN feature is:   Unavailable
ATA Security is:  Disabled, frozen [SEC2]
Wt Cache Reorder: Unavailable

=== START OF READ SMART DATA SECTION ===
SMART overall-health self-assessment test result: PASSED

General SMART Values:
Offline data collection status:  (0x82) Offline data collection activity
          was completed without error.
          Auto Offline Data Collection: Enabled.
Self-test execution status:      (   0) The previous self-test routine completed
          without error or no self-test has ever 
          been run.
Total time to complete Offline 
data collection:    (  430) seconds.
Offline data collection
capabilities:        (0x5b) SMART execute Offline immediate.
          Auto Offline data collection on/off support.
          Suspend Offline collection upon new
          command.
          Offline surface scan supported.
          Self-test supported.
          No Conveyance Self-test supported.
          Selective Self-test supported.
SMART capabilities:            (0x0003) Saves SMART data before entering
          power-saving mode.
          Supports SMART auto save timer.
Error logging capability:        (0x01) Error logging supported.
          General Purpose Logging supported.
Short self-test routine 
recommended polling time:    (   1) minutes.
Extended self-test routine
recommended polling time:    (  27) minutes.

SMART Attributes Data Structure revision number: 10
Vendor Specific SMART Attributes with Thresholds:
ID# ATTRIBUTE_NAME          FLAGS    VALUE WORST THRESH FAIL RAW_VALUE
  1 Raw_Read_Error_Rate     POSR--   113   099   006    -    58558496
  3 Spin_Up_Time            PO----   097   097   000    -    0
  4 Start_Stop_Count        -O--CK   099   099   020    -    1090
  5 Reallocated_Sector_Ct   PO--CK   100   100   036    -    0
  7 Seek_Error_Rate         POSR--   082   060   030    -    180332569
  9 Power_On_Hours          -O--CK   036   036   000    -    56165
 10 Spin_Retry_Count        PO--C-   100   100   097    -    0
 12 Power_Cycle_Count       -O--CK   100   100   020    -    562
187 Reported_Uncorrect      -O--CK   100   100   000    -    0
189 High_Fly_Writes         -O-RCK   100   100   000    -    0
190 Airflow_Temperature_Cel -O---K   062   049   045    -    38 (Min/Max 37/40)
194 Temperature_Celsius     -O---K   038   051   000    -    38 (0 16 0 0 0)
195 Hardware_ECC_Recovered  -O-RC-   072   064   000    -    243269807
197 Current_Pending_Sector  -O--C-   100   100   000    -    0
198 Offline_Uncorrectable   ----C-   100   100   000    -    0
199 UDMA_CRC_Error_Count    -OSRCK   200   200   000    -    0
200 Multi_Zone_Error_Rate   ------   100   253   000    -    0
202 Data_Address_Mark_Errs  -O--CK   100   253   000    -    0
                            ||||||_ K auto-keep
                            |||||__ C event count
                            ||||___ R error rate
                            |||____ S speed/performance
                            ||_____ O updated online
                            |______ P prefailure warning

General Purpose Log Directory Version 1
SMART           Log Directory Version 1 [multi-sector log support]
Address    Access  R/W   Size  Description
0x00       GPL,SL  R/O      1  Log Directory
0x01       GPL,SL  R/O      1  Summary SMART error log
0x02       GPL,SL  R/O      5  Comprehensive SMART error log
0x03       GPL,SL  R/O      5  Ext. Comprehensive SMART error log
0x06       GPL,SL  R/O      1  SMART self-test log
0x07       GPL,SL  R/O      1  Extended self-test log
0x09       GPL,SL  R/W      1  Selective self-test log
0x10       GPL,SL  R/O      1  NCQ Command Error log
0x11       GPL,SL  R/O      1  SATA Phy Event Counters log
0x20       GPL,SL  R/O      1  Streaming performance log [OBS-8]
0x21       GPL,SL  R/O      1  Write stream error log
0x22       GPL,SL  R/O      1  Read stream error log
0x23       GPL,SL  R/O      1  Delayed sector log [OBS-8]
0x80-0x9f  GPL,SL  R/W     16  Host vendor specific log
0xa0       GPL,SL  VS       1  Device vendor specific log
0xa1       GPL,SL  VS      20  Device vendor specific log
0xa2       GPL,SL  VS     101  Device vendor specific log
0xa8       GPL,SL  VS      20  Device vendor specific log
0xa9       GPL,SL  VS       1  Device vendor specific log
0xe0       GPL,SL  R/W      1  SCT Command/Status
0xe1       GPL,SL  R/W      1  SCT Data Transfer
0xff       GPL     -    23040  Reserved

SMART Extended Comprehensive Error Log Version: 1 (5 sectors)
No Errors Logged

SMART Extended Self-test Log Version: 1 (1 sectors)

SMART Selective self-test log data structure revision number 1
 SPAN  MIN_LBA  MAX_LBA  CURRENT_TEST_STATUS
    1        0        0  Not_testing
    2        0        0  Not_testing
    3        0        0  Not_testing
    4        0        0  Not_testing
    5        0        0  Not_testing
Selective self-test flags (0x0):
  After scanning selected spans, do NOT read-scan remainder of disk.
If Selective self-test is pending on power-up, resume after 0 minute delay.

SCT Commands not supported

Device Statistics (GP/SMART Log 0x04) not supported

Pending Defects log (GP Log 0x0c) not supported

SATA Phy Event Counters (GP Log 0x11)
ID      Size     Value  Description
0x000a  2           80  Device-to-host register FISes sent due to a COMRESET
0x0001  2            0  Command failed due to ICRC error
0x0003  2            0  R_ERR response for device-to-host data FIS
0x0004  2            0  R_ERR response for host-to-device data FIS
0x0006  2            0  R_ERR response for device-to-host non-data FIS
0x0007  2            0  R_ERR response for host-to-device non-data FIS


/dev/sdc
=== START OF INFORMATION SECTION ===
Model Family:     Indilinx Barefoot 3 based SSDs
Device Model:     OCZ-VECTOR150
Serial Number:    --
LU WWN Device Id: 5 e83a97 ...
Firmware Version: 1.2
User Capacity:    120,034,123,776 bytes [120 GB]
Sector Size:      512 bytes logical/physical
Rotation Rate:    Solid State Device
Device is:        In smartctl database [for details use: -P show]
ATA Version is:   ATA8-ACS (minor revision not indicated)
SATA Version is:  SATA 3.1, 6.0 Gb/s (current: 6.0 Gb/s)
Local Time is:    Fri Sep 27 22:14:24 2019 MSK
SMART support is: Available - device has SMART capability.
SMART support is: Enabled
AAM feature is:   Unavailable
APM feature is:   Unavailable
Rd look-ahead is: Enabled
Write cache is:   Enabled
DSN feature is:   Unavailable
ATA Security is:  Disabled, frozen [SEC2]
Wt Cache Reorder: Unavailable

=== START OF READ SMART DATA SECTION ===
SMART overall-health self-assessment test result: PASSED

General SMART Values:
Offline data collection status:  (0x00) Offline data collection activity
          was never started.
          Auto Offline Data Collection: Disabled.
Self-test execution status:      (   0) The previous self-test routine completed
          without error or no self-test has ever 
          been run.
Total time to complete Offline 
data collection:    (    0) seconds.
Offline data collection
capabilities:        (0x1d) SMART execute Offline immediate.
          No Auto Offline data collection support.
          Abort Offline collection upon new
          command.
          Offline surface scan supported.
          Self-test supported.
          No Conveyance Self-test supported.
          No Selective Self-test supported.
SMART capabilities:            (0x0003) Saves SMART data before entering
          power-saving mode.
          Supports SMART auto save timer.
Error logging capability:        (0x00) Error logging NOT supported.
          General Purpose Logging supported.
Short self-test routine 
recommended polling time:    (   0) minutes.
Extended self-test routine
recommended polling time:    (   0) minutes.

SMART Attributes Data Structure revision number: 18
Vendor Specific SMART Attributes with Thresholds:
ID# ATTRIBUTE_NAME          FLAGS    VALUE WORST THRESH FAIL RAW_VALUE
  5 Runtime_Bad_Block       ------   000   000   000    -    0
  9 Power_On_Hours          ------   100   100   000    -    15005
 12 Power_Cycle_Count       ------   100   100   000    -    2438
171 Avail_OP_Block_Count    ------   080   080   000    -    40268880
174 Pwr_Cycle_Ct_Unplanned  ------   100   100   000    -    171
195 Total_Prog_Failures     ------   100   100   000    -    0
196 Total_Erase_Failures    ------   100   100   000    -    0
197 Total_Unc_Read_Failures ------   100   100   000    -    0
208 Average_Erase_Count     ------   100   100   000    -    241
210 SATA_CRC_Error_Count    ------   100   100   000    -    0
224 In_Warranty             ------   100   100   000    -    1
233 Remaining_Lifetime_Perc ------   092   092   000    -    92
241 Host_Writes_GiB         ------   100   100   000    -    9443
242 Host_Reads_GiB          ------   100   100   000    -    11397
249 Total_NAND_Prog_Ct_GiB  ------   100   100   000    -    474510098
                            ||||||_ K auto-keep
                            |||||__ C event count
                            ||||___ R error rate
                            |||____ S speed/performance
                            ||_____ O updated online
                            |______ P prefailure warning

General Purpose Log Directory Version 1
SMART           Log Directory Version 1 [multi-sector log support]
Address    Access  R/W   Size  Description
0x00       GPL,SL  R/O      1  Log Directory
0x01       GPL,SL  R/O      1  Summary SMART error log
0x02       GPL,SL  R/O     51  Comprehensive SMART error log
0x03       GPL,SL  R/O     77  Ext. Comprehensive SMART error log
0x06       GPL,SL  R/O      1  SMART self-test log
0x07       GPL,SL  R/O      1  Extended self-test log
0x09       GPL,SL  R/W      1  Selective self-test log
0x10       GPL,SL  R/O      1  NCQ Command Error log
0x11       GPL,SL  R/O      1  SATA Phy Event Counters log
0x80-0x9f  GPL,SL  R/W     16  Host vendor specific log
0xa0       GPL,SL  VS       1  Device vendor specific log

SMART Extended Comprehensive Error Log Version: 18 (77 sectors)
No Errors Logged

Warning! SMART Extended Self-test Log Structure error: invalid SMART checksum.
SMART Extended Self-test Log Version: 1 (1 sectors)
No self-tests have been logged.  [To run self-tests, use: smartctl -t]

Selective Self-tests/Logging not supported

SCT Commands not supported

Device Statistics (GP/SMART Log 0x04) not supported

Pending Defects log (GP Log 0x0c) not supported

SATA Phy Event Counters (GP Log 0x11)
[Reserved: 0x00 0x00 0x41 0x00]
ID      Size     Value  Description


/dev/sdd
=== START OF INFORMATION SECTION ===
Model Family:     Toshiba 3.5" DT01ACA... Desktop HDD
Device Model:     TOSHIBA DT01ACA050
Serial Number:    --
LU WWN Device Id: 5 000039 ...
Firmware Version: MS1OA750
User Capacity:    500,107,862,016 bytes [500 GB]
Sector Sizes:     512 bytes logical, 4096 bytes physical
Rotation Rate:    7200 rpm
Form Factor:      3.5 inches
Device is:        In smartctl database [for details use: -P show]
ATA Version is:   ATA8-ACS T13/1699-D revision 4
SATA Version is:  SATA 3.0, 6.0 Gb/s (current: 6.0 Gb/s)
Local Time is:    Fri Sep 27 22:14:24 2019 MSK
SMART support is: Available - device has SMART capability.
SMART support is: Enabled
AAM feature is:   Unavailable
APM feature is:   Disabled
Rd look-ahead is: Enabled
Write cache is:   Enabled
DSN feature is:   Unavailable
ATA Security is:  Disabled, frozen [SEC2]
Wt Cache Reorder: Enabled

=== START OF READ SMART DATA SECTION ===
SMART overall-health self-assessment test result: PASSED

General SMART Values:
Offline data collection status:  (0x84) Offline data collection activity
          was suspended by an interrupting command from host.
          Auto Offline Data Collection: Enabled.
Self-test execution status:      (   0) The previous self-test routine completed
          without error or no self-test has ever 
          been run.
Total time to complete Offline 
data collection:    ( 3668) seconds.
Offline data collection
capabilities:        (0x5b) SMART execute Offline immediate.
          Auto Offline data collection on/off support.
          Suspend Offline collection upon new
          command.
          Offline surface scan supported.
          Self-test supported.
          No Conveyance Self-test supported.
          Selective Self-test supported.
SMART capabilities:            (0x0003) Saves SMART data before entering
          power-saving mode.
          Supports SMART auto save timer.
Error logging capability:        (0x01) Error logging supported.
          General Purpose Logging supported.
Short self-test routine 
recommended polling time:    (   1) minutes.
Extended self-test routine
recommended polling time:    (  62) minutes.
SCT capabilities:          (0x003d) SCT Status supported.
          SCT Error Recovery Control supported.
          SCT Feature Control supported.
          SCT Data Table supported.

SMART Attributes Data Structure revision number: 16
Vendor Specific SMART Attributes with Thresholds:
ID# ATTRIBUTE_NAME          FLAGS    VALUE WORST THRESH FAIL RAW_VALUE
  1 Raw_Read_Error_Rate     PO-R--   100   100   016    -    0
  2 Throughput_Performance  P-S---   141   141   054    -    74
  3 Spin_Up_Time            POS---   127   127   024    -    179 (Average 181)
  4 Start_Stop_Count        -O--C-   099   099   000    -    4917
  5 Reallocated_Sector_Ct   PO--CK   100   100   005    -    0
  7 Seek_Error_Rate         PO-R--   100   100   067    -    0
  8 Seek_Time_Performance   P-S---   118   118   020    -    33
  9 Power_On_Hours          -O--C-   099   099   000    -    12270
 10 Spin_Retry_Count        PO--C-   100   100   060    -    0
 12 Power_Cycle_Count       -O--CK   100   100   000    -    1351
192 Power-Off_Retract_Count -O--CK   095   095   000    -    6282
193 Load_Cycle_Count        -O--C-   095   095   000    -    6282
194 Temperature_Celsius     -O----   181   181   000    -    33 (Min/Max 10/52)
196 Reallocated_Event_Count -O--CK   100   100   000    -    0
197 Current_Pending_Sector  -O---K   100   100   000    -    0
198 Offline_Uncorrectable   ---R--   100   100   000    -    0
199 UDMA_CRC_Error_Count    -O-R--   200   200   000    -    0
                            ||||||_ K auto-keep
                            |||||__ C event count
                            ||||___ R error rate
                            |||____ S speed/performance
                            ||_____ O updated online
                            |______ P prefailure warning

General Purpose Log Directory Version 1
SMART           Log Directory Version 1 [multi-sector log support]
Address    Access  R/W   Size  Description
0x00       GPL,SL  R/O      1  Log Directory
0x01           SL  R/O      1  Summary SMART error log
0x03       GPL     R/O      1  Ext. Comprehensive SMART error log
0x04       GPL     R/O      7  Device Statistics log
0x06           SL  R/O      1  SMART self-test log
0x07       GPL     R/O      1  Extended self-test log
0x08       GPL     R/O      2  Power Conditions log
0x09           SL  R/W      1  Selective self-test log
0x10       GPL     R/O      1  NCQ Command Error log
0x11       GPL     R/O      1  SATA Phy Event Counters log
0x20       GPL     R/O      1  Streaming performance log [OBS-8]
0x21       GPL     R/O      1  Write stream error log
0x22       GPL     R/O      1  Read stream error log
0x80-0x9f  GPL,SL  R/W     16  Host vendor specific log
0xe0       GPL,SL  R/W      1  SCT Command/Status
0xe1       GPL,SL  R/W      1  SCT Data Transfer

SMART Extended Comprehensive Error Log Version: 1 (1 sectors)
No Errors Logged

SMART Extended Self-test Log Version: 1 (1 sectors)
No self-tests have been logged.  [To run self-tests, use: smartctl -t]

SMART Selective self-test log data structure revision number 1
 SPAN  MIN_LBA  MAX_LBA  CURRENT_TEST_STATUS
    1        0        0  Not_testing
    2        0        0  Not_testing
    3        0        0  Not_testing
    4        0        0  Not_testing
    5        0        0  Not_testing
Selective self-test flags (0x0):
  After scanning selected spans, do NOT read-scan remainder of disk.
If Selective self-test is pending on power-up, resume after 0 minute delay.

SCT Status Version:                  3
SCT Version (vendor specific):       256 (0x0100)
SCT Support Level:                   1
Device State:                        SMART Off-line Data Collection executing in background (4)
Current Temperature:                    32 Celsius
Power Cycle Min/Max Temperature:     21/35 Celsius
Lifetime    Min/Max Temperature:     10/52 Celsius
Under/Over Temperature Limit Count:   0/0

SCT Temperature History Version:     2
Temperature Sampling Period:         1 minute
Temperature Logging Interval:        1 minute
Min/Max recommended Temperature:      0/60 Celsius
Min/Max Temperature Limit:           -40/70 Celsius
Temperature History Size (Index):    128 (37)

Index    Estimated Time   Temperature Celsius
  38    2019-09-27 20:07    33  **************
 ...    ..(  6 skipped).    ..  **************
  45    2019-09-27 20:14    33  **************
  46    2019-09-27 20:15    32  *************
  47    2019-09-27 20:16    33  **************
 ...    ..(  6 skipped).    ..  **************
  54    2019-09-27 20:23    33  **************
  55    2019-09-27 20:24    32  *************
  56    2019-09-27 20:25    32  *************
  57    2019-09-27 20:26    32  *************
  58    2019-09-27 20:27    33  **************
  59    2019-09-27 20:28    32  *************
 ...    ..(  3 skipped).    ..  *************
  63    2019-09-27 20:32    32  *************
  64    2019-09-27 20:33    33  **************
 ...    ..(  7 skipped).    ..  **************
  72    2019-09-27 20:41    33  **************
  73    2019-09-27 20:42    32  *************
 ...    ..( 14 skipped).    ..  *************
  88    2019-09-27 20:57    32  *************
  89    2019-09-27 20:58    33  **************
 ...    ..(  2 skipped).    ..  **************
  92    2019-09-27 21:01    33  **************
  93    2019-09-27 21:02    32  *************
 ...    ..( 64 skipped).    ..  *************
  30    2019-09-27 22:07    32  *************
  31    2019-09-27 22:08    33  **************
 ...    ..(  4 skipped).    ..  **************
  36    2019-09-27 22:13    33  **************
  37    2019-09-27 22:14    32  *************

SCT Error Recovery Control:
           Read: Disabled
          Write: Disabled

Device Statistics (GP Log 0x04)
Page  Offset Size        Value Flags Description
0x01  =====  =               =  ===  == General Statistics (rev 1) ==
0x01  0x008  4            1351  ---  Lifetime Power-On Resets
0x01  0x010  4           12270  ---  Power-on Hours
0x01  0x018  6     12128975518  ---  Logical Sectors Written
0x01  0x020  6        94287087  ---  Number of Write Commands
0x01  0x028  6     34706130829  ---  Logical Sectors Read
0x01  0x030  6       118633777  ---  Number of Read Commands
0x03  =====  =               =  ===  == Rotating Media Statistics (rev 1) ==
0x03  0x008  4            8837  ---  Spindle Motor Power-on Hours
0x03  0x010  4            8837  ---  Head Flying Hours
0x03  0x018  4            6282  ---  Head Load Events
0x03  0x020  4               0  ---  Number of Reallocated Logical Sectors
0x03  0x028  4               6  ---  Read Recovery Attempts
0x03  0x030  4               2  ---  Number of Mechanical Start Failures
0x04  =====  =               =  ===  == General Errors Statistics (rev 1) ==
0x04  0x008  4               0  ---  Number of Reported Uncorrectable Errors
0x04  0x010  4               0  ---  Resets Between Cmd Acceptance and Completion
0x05  =====  =               =  ===  == Temperature Statistics (rev 1) ==
0x05  0x008  1              33  ---  Current Temperature
0x05  0x010  1              32  N--  Average Short Term Temperature
0x05  0x018  1              32  N--  Average Long Term Temperature
0x05  0x020  1              52  ---  Highest Temperature
0x05  0x028  1              10  ---  Lowest Temperature
0x05  0x030  1              47  N--  Highest Average Short Term Temperature
0x05  0x038  1              22  N--  Lowest Average Short Term Temperature
0x05  0x040  1              44  N--  Highest Average Long Term Temperature
0x05  0x048  1              25  N--  Lowest Average Long Term Temperature
0x05  0x050  4               0  ---  Time in Over-Temperature
0x05  0x058  1              60  ---  Specified Maximum Operating Temperature
0x05  0x060  4               0  ---  Time in Under-Temperature
0x05  0x068  1               0  ---  Specified Minimum Operating Temperature
0x06  =====  =               =  ===  == Transport Statistics (rev 1) ==
0x06  0x008  4            4367  ---  Number of Hardware Resets
0x06  0x010  4            2917  ---  Number of ASR Events
0x06  0x018  4               0  ---  Number of Interface CRC Errors
                                |||_ C monitored condition met
                                ||__ D supports DSN
                                |___ N normalized value

Pending Defects log (GP Log 0x0c) not supported

SATA Phy Event Counters (GP Log 0x11)
ID      Size     Value  Description
0x0001  2            0  Command failed due to ICRC error
0x0002  2            0  R_ERR response for data FIS
0x0003  2            0  R_ERR response for device-to-host data FIS
0x0004  2            0  R_ERR response for host-to-device data FIS
0x0005  2            0  R_ERR response for non-data FIS
0x0006  2            0  R_ERR response for device-to-host non-data FIS
0x0007  2            0  R_ERR response for host-to-device non-data FIS
0x0009  2           59  Transition from drive PhyRdy to drive PhyNRdy
0x000a  2           59  Device-to-host register FISes sent due to a COMRESET
0x000b  2            0  CRC errors within host-to-device FIS
0x000d  2            0  Non-CRC errors within host-to-device FIS


/dev/sde
=== START OF INFORMATION SECTION ===
Model Family:     Western Digital Caviar Green
Device Model:     WDC WD7500AACS-00D6B1
Serial Number:    --
LU WWN Device Id: 5 0014ee ...
Firmware Version: 01.01A01
User Capacity:    750,156,374,016 bytes [750 GB]
Sector Size:      512 bytes logical/physical
Device is:        In smartctl database [for details use: -P show]
ATA Version is:   ATA8-ACS (minor revision not indicated)
SATA Version is:  SATA 2.5, 3.0 Gb/s
Local Time is:    Fri Sep 27 22:14:27 2019 MSK
SMART support is: Available - device has SMART capability.
SMART support is: Enabled
AAM level is:     254 (maximum performance), recommended: 128
APM feature is:   Unavailable
Rd look-ahead is: Enabled
Write cache is:   Enabled
DSN feature is:   Unavailable
ATA Security is:  Disabled, frozen [SEC2]
Wt Cache Reorder: Enabled

=== START OF READ SMART DATA SECTION ===
SMART overall-health self-assessment test result: PASSED

General SMART Values:
Offline data collection status:  (0x84) Offline data collection activity
          was suspended by an interrupting command from host.
          Auto Offline Data Collection: Enabled.
Self-test execution status:      (   0) The previous self-test routine completed
          without error or no self-test has ever 
          been run.
Total time to complete Offline 
data collection:    (19500) seconds.
Offline data collection
capabilities:        (0x7b) SMART execute Offline immediate.
          Auto Offline data collection on/off support.
          Suspend Offline collection upon new
          command.
          Offline surface scan supported.
          Self-test supported.
          Conveyance Self-test supported.
          Selective Self-test supported.
SMART capabilities:            (0x0003) Saves SMART data before entering
          power-saving mode.
          Supports SMART auto save timer.
Error logging capability:        (0x01) Error logging supported.
          General Purpose Logging supported.
Short self-test routine 
recommended polling time:    (   2) minutes.
Extended self-test routine
recommended polling time:    ( 225) minutes.
Conveyance self-test routine
recommended polling time:    (   5) minutes.
SCT capabilities:          (0x303f) SCT Status supported.
          SCT Error Recovery Control supported.
          SCT Feature Control supported.
          SCT Data Table supported.

SMART Attributes Data Structure revision number: 16
Vendor Specific SMART Attributes with Thresholds:
ID# ATTRIBUTE_NAME          FLAGS    VALUE WORST THRESH FAIL RAW_VALUE
  1 Raw_Read_Error_Rate     POSR-K   200   200   051    -    41
  3 Spin_Up_Time            POS--K   167   158   021    -    6616
  4 Start_Stop_Count        -O--CK   090   090   000    -    10051
  5 Reallocated_Sector_Ct   PO--CK   200   200   140    -    0
  7 Seek_Error_Rate         -OSR-K   100   253   000    -    0
  9 Power_On_Hours          -O--CK   061   061   000    -    28818
 10 Spin_Retry_Count        -O--CK   100   100   000    -    0
 11 Calibration_Retry_Count -O--CK   100   100   000    -    0
 12 Power_Cycle_Count       -O--CK   094   094   000    -    6124
192 Power-Off_Retract_Count -O--CK   200   200   000    -    436
193 Load_Cycle_Count        -O--CK   197   197   000    -    9756
194 Temperature_Celsius     -O---K   119   099   000    -    31
196 Reallocated_Event_Count -O--CK   200   200   000    -    0
197 Current_Pending_Sector  -O--CK   200   200   000    -    0
198 Offline_Uncorrectable   ----CK   200   200   000    -    0
199 UDMA_CRC_Error_Count    -O--CK   200   200   000    -    258
200 Multi_Zone_Error_Rate   ---R--   200   200   000    -    0
                            ||||||_ K auto-keep
                            |||||__ C event count
                            ||||___ R error rate
                            |||____ S speed/performance
                            ||_____ O updated online
                            |______ P prefailure warning

General Purpose Log Directory Version 1
SMART           Log Directory Version 1 [multi-sector log support]
Address    Access  R/W   Size  Description
0x00       GPL,SL  R/O      1  Log Directory
0x01           SL  R/O      1  Summary SMART error log
0x02           SL  R/O      5  Comprehensive SMART error log
0x03       GPL     R/O      6  Ext. Comprehensive SMART error log
0x06           SL  R/O      1  SMART self-test log
0x07       GPL     R/O      1  Extended self-test log
0x09           SL  R/W      1  Selective self-test log
0x10       GPL     R/O      1  NCQ Command Error log
0x11       GPL     R/O      1  SATA Phy Event Counters log
0x80-0x9f  GPL,SL  R/W     16  Host vendor specific log
0xa0-0xa7  GPL,SL  VS      16  Device vendor specific log
0xa8-0xb7  GPL,SL  VS       1  Device vendor specific log
0xc0       GPL,SL  VS       1  Device vendor specific log
0xc1       GPL     VS      24  Device vendor specific log
0xe0       GPL,SL  R/W      1  SCT Command/Status
0xe1       GPL,SL  R/W      1  SCT Data Transfer

SMART Extended Comprehensive Error Log Version: 1 (6 sectors)
Device Error Count: 3215 (device log contains only the most recent 24 errors)
  CR     = Command Register
  FEATR  = Features Register
  COUNT  = Count (was: Sector Count) Register
  LBA_48 = Upper bytes of LBA High/Mid/Low Registers ]  ATA-8
  LH     = LBA High (was: Cylinder High) Register    ]   LBA
  LM     = LBA Mid (was: Cylinder Low) Register      ] Register
  LL     = LBA Low (was: Sector Number) Register     ]
  DV     = Device (was: Device/Head) Register
  DC     = Device Control Register
  ER     = Error register
  ST     = Status register
Powered_Up_Time is measured from power on, and printed as
DDd+hh:mm:SS.sss where DD=days, hh=hours, mm=minutes,
SS=sec, and sss=millisec. It "wraps" after 49.710 days.

Error 3215 [22] occurred at disk power-on lifetime: 10748 hours (447 days + 20 hours)
  When the command that caused the error occurred, the device was active or idle.

  After command completion occurred, registers were:
  ER -- ST COUNT  LBA_48  LH LM LL DV DC
  -- -- -- == -- == == == -- -- -- -- --
  40 -- 51 00 00 00 00 00 62 02 e9 40 00  Error: WP at LBA = 0x006202e9 = 6423273

  Commands leading to the command that caused the error were:
  CR FEATR COUNT  LBA_48  LH LM LL DV DC  Powered_Up_Time  Command/Feature_Name
  -- == -- == -- == == == -- -- -- -- --  ---------------  --------------------
  61 00 08 00 60 00 61 00 15 00 a0 40 00     04:07:53.948  WRITE FPDMA QUEUED
  61 00 18 00 58 00 50 00 70 0c d0 40 00     04:07:53.888  WRITE FPDMA QUEUED
  61 00 08 00 50 00 50 00 70 0c 60 40 00     04:07:53.888  WRITE FPDMA QUEUED
  60 00 20 00 48 00 27 00 b9 09 c0 40 00     04:07:53.888  READ FPDMA QUEUED
  60 00 20 00 40 00 62 00 02 00 e0 40 00     04:07:53.888  READ FPDMA QUEUED

Error 3214 [21] occurred at disk power-on lifetime: 10748 hours (447 days + 20 hours)
  When the command that caused the error occurred, the device was active or idle.

  After command completion occurred, registers were:
  ER -- ST COUNT  LBA_48  LH LM LL DV DC
  -- -- -- == -- == == == -- -- -- -- --
  40 -- 51 00 00 00 00 00 62 02 e9 40 00  Error: UNC at LBA = 0x006202e9 = 6423273

  Commands leading to the command that caused the error were:
  CR FEATR COUNT  LBA_48  LH LM LL DV DC  Powered_Up_Time  Command/Feature_Name
  -- == -- == -- == == == -- -- -- -- --  ---------------  --------------------
  60 00 20 00 30 00 62 00 02 00 e0 40 00     04:07:50.991  READ FPDMA QUEUED
  2f 00 00 00 01 00 00 00 00 00 10 40 00     04:07:50.991  READ LOG EXT
  61 00 08 00 18 00 4e 00 64 0c e0 40 00     04:07:48.102  WRITE FPDMA QUEUED
  61 00 20 00 10 00 5c 00 be 2d 80 40 00     04:07:48.101  WRITE FPDMA QUEUED
  61 00 08 00 08 00 4e 00 64 0c f0 40 00     04:07:48.101  WRITE FPDMA QUEUED

Error 3213 [20] occurred at disk power-on lifetime: 10748 hours (447 days + 20 hours)
  When the command that caused the error occurred, the device was active or idle.

  After command completion occurred, registers were:
  ER -- ST COUNT  LBA_48  LH LM LL DV DC
  -- -- -- == -- == == == -- -- -- -- --
  40 -- 51 00 00 00 00 00 62 02 e9 40 00  Error: WP at LBA = 0x006202e9 = 6423273

  Commands leading to the command that caused the error were:
  CR FEATR COUNT  LBA_48  LH LM LL DV DC  Powered_Up_Time  Command/Feature_Name
  -- == -- == -- == == == -- -- -- -- --  ---------------  --------------------
  61 00 08 00 18 00 4e 00 64 0c e0 40 00     04:07:48.102  WRITE FPDMA QUEUED
  61 00 20 00 10 00 5c 00 be 2d 80 40 00     04:07:48.101  WRITE FPDMA QUEUED
  61 00 08 00 08 00 4e 00 64 0c f0 40 00     04:07:48.101  WRITE FPDMA QUEUED
  61 00 10 00 00 00 50 00 6f 0c 40 40 00     04:07:48.101  WRITE FPDMA QUEUED
  60 00 20 00 f8 00 62 00 02 00 e0 40 00     04:07:48.101  READ FPDMA QUEUED

Error 3212 [19] occurred at disk power-on lifetime: 10748 hours (447 days + 20 hours)
  When the command that caused the error occurred, the device was active or idle.

  After command completion occurred, registers were:
  ER -- ST COUNT  LBA_48  LH LM LL DV DC
  -- -- -- == -- == == == -- -- -- -- --
  40 -- 51 00 00 00 00 00 62 02 e9 40 00  Error: UNC at LBA = 0x006202e9 = 6423273

  Commands leading to the command that caused the error were:
  CR FEATR COUNT  LBA_48  LH LM LL DV DC  Powered_Up_Time  Command/Feature_Name
  -- == -- == -- == == == -- -- -- -- --  ---------------  --------------------
  60 00 20 00 d8 00 62 00 02 00 e0 40 00     04:07:45.085  READ FPDMA QUEUED
  2f 00 00 00 01 00 00 00 00 00 10 40 00     04:07:45.084  READ LOG EXT
  61 00 20 00 c8 00 50 00 6e 0c a8 40 00     04:07:42.197  WRITE FPDMA QUEUED
  61 00 08 00 c0 00 50 00 6e 0c 90 40 00     04:07:42.195  WRITE FPDMA QUEUED
  61 00 08 00 b8 00 50 00 6e 0c 80 40 00     04:07:42.195  WRITE FPDMA QUEUED

Error 3211 [18] occurred at disk power-on lifetime: 10748 hours (447 days + 20 hours)
  When the command that caused the error occurred, the device was active or idle.

  After command completion occurred, registers were:
  ER -- ST COUNT  LBA_48  LH LM LL DV DC
  -- -- -- == -- == == == -- -- -- -- --
  40 -- 51 00 00 00 00 00 62 02 e9 40 00  Error: WP at LBA = 0x006202e9 = 6423273

  Commands leading to the command that caused the error were:
  CR FEATR COUNT  LBA_48  LH LM LL DV DC  Powered_Up_Time  Command/Feature_Name
  -- == -- == -- == == == -- -- -- -- --  ---------------  --------------------
  61 00 20 00 c8 00 50 00 6e 0c a8 40 00     04:07:42.197  WRITE FPDMA QUEUED
  61 00 08 00 c0 00 50 00 6e 0c 90 40 00     04:07:42.195  WRITE FPDMA QUEUED
  61 00 08 00 b8 00 50 00 6e 0c 80 40 00     04:07:42.195  WRITE FPDMA QUEUED
  61 00 10 00 b0 00 50 00 6e 0c 68 40 00     04:07:42.195  WRITE FPDMA QUEUED
  61 00 10 00 a8 00 50 00 6e 0c 00 40 00     04:07:42.195  WRITE FPDMA QUEUED

Error 3210 [17] occurred at disk power-on lifetime: 10748 hours (447 days + 20 hours)
  When the command that caused the error occurred, the device was active or idle.

  After command completion occurred, registers were:
  ER -- ST COUNT  LBA_48  LH LM LL DV DC
  -- -- -- == -- == == == -- -- -- -- --
  40 -- 51 00 00 00 00 00 62 02 e9 40 00  Error: UNC at LBA = 0x006202e9 = 6423273

  Commands leading to the command that caused the error were:
  CR FEATR COUNT  LBA_48  LH LM LL DV DC  Powered_Up_Time  Command/Feature_Name
  -- == -- == -- == == == -- -- -- -- --  ---------------  --------------------
  60 00 20 00 50 00 62 00 02 00 e0 40 00     04:07:39.136  READ FPDMA QUEUED
  2f 00 00 00 01 00 00 00 00 00 10 40 00     04:07:39.135  READ LOG EXT
  61 00 10 00 40 00 50 00 6d 0c 30 40 00     04:07:36.247  WRITE FPDMA QUEUED
  61 00 08 00 38 00 50 00 6c 0c e8 40 00     04:07:36.247  WRITE FPDMA QUEUED
  61 00 08 00 30 00 50 00 6c 0c d8 40 00     04:07:36.247  WRITE FPDMA QUEUED

Error 3209 [16] occurred at disk power-on lifetime: 10748 hours (447 days + 20 hours)
  When the command that caused the error occurred, the device was active or idle.

  After command completion occurred, registers were:
  ER -- ST COUNT  LBA_48  LH LM LL DV DC
  -- -- -- == -- == == == -- -- -- -- --
  40 -- 51 00 00 00 00 00 62 02 e9 40 00  Error: WP at LBA = 0x006202e9 = 6423273

  Commands leading to the command that caused the error were:
  CR FEATR COUNT  LBA_48  LH LM LL DV DC  Powered_Up_Time  Command/Feature_Name
  -- == -- == -- == == == -- -- -- -- --  ---------------  --------------------
  61 00 10 00 40 00 50 00 6d 0c 30 40 00     04:07:36.247  WRITE FPDMA QUEUED
  61 00 08 00 38 00 50 00 6c 0c e8 40 00     04:07:36.247  WRITE FPDMA QUEUED
  61 00 08 00 30 00 50 00 6c 0c d8 40 00     04:07:36.247  WRITE FPDMA QUEUED
  61 00 08 00 28 00 50 00 6c 0c c0 40 00     04:07:36.247  WRITE FPDMA QUEUED
  61 00 10 00 20 00 50 00 6c 0c a8 40 00     04:07:36.246  WRITE FPDMA QUEUED

Error 3208 [15] occurred at disk power-on lifetime: 10748 hours (447 days + 20 hours)
  When the command that caused the error occurred, the device was active or idle.

  After command completion occurred, registers were:
  ER -- ST COUNT  LBA_48  LH LM LL DV DC
  -- -- -- == -- == == == -- -- -- -- --
  40 -- 51 00 00 00 00 00 62 02 e9 40 00  Error: UNC at LBA = 0x006202e9 = 6423273

  Commands leading to the command that caused the error were:
  CR FEATR COUNT  LBA_48  LH LM LL DV DC  Powered_Up_Time  Command/Feature_Name
  -- == -- == -- == == == -- -- -- -- --  ---------------  --------------------
  60 00 20 00 b0 00 62 00 02 00 e0 40 00     04:07:33.096  READ FPDMA QUEUED
  2f 00 00 00 01 00 00 00 00 00 10 40 00     04:07:33.095  READ LOG EXT
  60 00 20 00 98 00 62 00 02 00 e0 40 00     04:07:30.198  READ FPDMA QUEUED
  61 00 10 00 90 00 60 00 76 00 b0 40 00     04:07:30.197  WRITE FPDMA QUEUED
  60 00 10 00 88 00 5b 00 3f 03 30 40 00     04:07:30.197  READ FPDMA QUEUED

SMART Extended Self-test Log Version: 1 (1 sectors)
No self-tests have been logged.  [To run self-tests, use: smartctl -t]

SMART Selective self-test log data structure revision number 1
 SPAN  MIN_LBA  MAX_LBA  CURRENT_TEST_STATUS
    1        0        0  Not_testing
    2        0        0  Not_testing
    3        0        0  Not_testing
    4        0        0  Not_testing
    5        0        0  Not_testing
Selective self-test flags (0x0):
  After scanning selected spans, do NOT read-scan remainder of disk.
If Selective self-test is pending on power-up, resume after 0 minute delay.

SCT Status Version:                  2
SCT Version (vendor specific):       258 (0x0102)
SCT Support Level:                   1
Device State:                        SMART Off-line Data Collection executing in background (4)
Current Temperature:                    31 Celsius
Power Cycle Min/Max Temperature:     21/35 Celsius
Lifetime    Min/Max Temperature:     21/51 Celsius
Under/Over Temperature Limit Count:   0/0

SCT Temperature History Version:     2
Temperature Sampling Period:         1 minute
Temperature Logging Interval:        1 minute
Min/Max recommended Temperature:      0/60 Celsius
Min/Max Temperature Limit:           -41/85 Celsius
Temperature History Size (Index):    478 (425)

Index    Estimated Time   Temperature Celsius
 426    2019-09-27 14:17    32  *************
 ...    ..(  3 skipped).    ..  *************
 430    2019-09-27 14:21    32  *************
 431    2019-09-27 14:22    31  ************
 ...    ..(142 skipped).    ..  ************
  96    2019-09-27 16:45    31  ************
  97    2019-09-27 16:46    32  *************
 ...    ..( 42 skipped).    ..  *************
 140    2019-09-27 17:29    32  *************
 141    2019-09-27 17:30    33  **************
 142    2019-09-27 17:31    32  *************
 ...    ..(  4 skipped).    ..  *************
 147    2019-09-27 17:36    32  *************
 148    2019-09-27 17:37    33  **************
 149    2019-09-27 17:38    33  **************
 150    2019-09-27 17:39    33  **************
 151    2019-09-27 17:40    32  *************
 ...    ..( 32 skipped).    ..  *************
 184    2019-09-27 18:13    32  *************
 185    2019-09-27 18:14    31  ************
 ...    ..( 49 skipped).    ..  ************
 235    2019-09-27 19:04    31  ************
 236    2019-09-27 19:05    30  ***********
 237    2019-09-27 19:06    31  ************
 ...    ..( 54 skipped).    ..  ************
 292    2019-09-27 20:01    31  ************
 293    2019-09-27 20:02    32  *************
 ...    ..(131 skipped).    ..  *************
 425    2019-09-27 22:14    32  *************

SCT Error Recovery Control:
           Read: Disabled
          Write: Disabled

Device Statistics (GP/SMART Log 0x04) not supported

Pending Defects log (GP Log 0x0c) not supported

SATA Phy Event Counters (GP Log 0x11)
ID      Size     Value  Description
0x0001  2            0  Command failed due to ICRC error
0x0002  2            0  R_ERR response for data FIS
0x0003  2            0  R_ERR response for device-to-host data FIS
0x0004  2            0  R_ERR response for host-to-device data FIS
0x0005  2            0  R_ERR response for non-data FIS
0x0006  2            0  R_ERR response for device-to-host non-data FIS
0x0007  2            0  R_ERR response for host-to-device non-data FIS
0x000a  2           16  Device-to-host register FISes sent due to a COMRESET
0x8000  4        38580  Vendor specific


/dev/sdf
=== START OF INFORMATION SECTION ===
Model Family:     Samsung based SSDs
Device Model:     Samsung SSD 750 EVO 120GB
Serial Number:    --
LU WWN Device Id: 5 002538 ...
Firmware Version: MAT01B6Q
User Capacity:    120,034,123,776 bytes [120 GB]
Sector Size:      512 bytes logical/physical
Rotation Rate:    Solid State Device
Device is:        In smartctl database [for details use: -P show]
ATA Version is:   ACS-2, ATA8-ACS T13/1699-D revision 4c
SATA Version is:  SATA 3.1, 6.0 Gb/s (current: 6.0 Gb/s)
Local Time is:    Fri Sep 27 22:14:27 2019 MSK
SMART support is: Available - device has SMART capability.
SMART support is: Enabled
AAM feature is:   Unavailable
APM feature is:   Unavailable
Rd look-ahead is: Enabled
Write cache is:   Enabled
DSN feature is:   Unavailable
ATA Security is:  Disabled, frozen [SEC2]
Wt Cache Reorder: Enabled

=== START OF READ SMART DATA SECTION ===
SMART overall-health self-assessment test result: PASSED

General SMART Values:
Offline data collection status:  (0x80) Offline data collection activity
          was never started.
          Auto Offline Data Collection: Enabled.
Self-test execution status:      (   0) The previous self-test routine completed
          without error or no self-test has ever 
          been run.
Total time to complete Offline 
data collection:    (    0) seconds.
Offline data collection
capabilities:        (0x53) SMART execute Offline immediate.
          Auto Offline data collection on/off support.
          Suspend Offline collection upon new
          command.
          No Offline surface scan supported.
          Self-test supported.
          No Conveyance Self-test supported.
          Selective Self-test supported.
SMART capabilities:            (0x0003) Saves SMART data before entering
          power-saving mode.
          Supports SMART auto save timer.
Error logging capability:        (0x01) Error logging supported.
          General Purpose Logging supported.
Short self-test routine 
recommended polling time:    (   2) minutes.
Extended self-test routine
recommended polling time:    (  64) minutes.
SCT capabilities:          (0x003d) SCT Status supported.
          SCT Error Recovery Control supported.
          SCT Feature Control supported.
          SCT Data Table supported.

SMART Attributes Data Structure revision number: 1
Vendor Specific SMART Attributes with Thresholds:
ID# ATTRIBUTE_NAME          FLAGS    VALUE WORST THRESH FAIL RAW_VALUE
  5 Reallocated_Sector_Ct   PO--CK   100   100   010    -    0
  9 Power_On_Hours          -O--CK   098   098   000    -    9053
 12 Power_Cycle_Count       -O--CK   098   098   000    -    1188
177 Wear_Leveling_Count     PO--C-   076   076   000    -    121
179 Used_Rsvd_Blk_Cnt_Tot   PO--C-   100   100   010    -    0
181 Program_Fail_Cnt_Total  -O--CK   100   100   010    -    0
182 Erase_Fail_Count_Total  -O--CK   100   100   010    -    0
183 Runtime_Bad_Block       PO--C-   100   100   010    -    0
187 Uncorrectable_Error_Cnt -O--CK   100   100   000    -    0
190 Airflow_Temperature_Cel -O--CK   070   038   000    -    30
195 ECC_Error_Rate          -O-RC-   200   200   000    -    0
199 CRC_Error_Count         -OSRCK   100   100   000    -    0
235 POR_Recovery_Count      -O--C-   099   099   000    -    61
241 Total_LBAs_Written      -O--CK   099   099   000    -    22192680187
                            ||||||_ K auto-keep
                            |||||__ C event count
                            ||||___ R error rate
                            |||____ S speed/performance
                            ||_____ O updated online
                            |______ P prefailure warning

General Purpose Log Directory Version 1
SMART           Log Directory Version 1 [multi-sector log support]
Address    Access  R/W   Size  Description
0x00       GPL,SL  R/O      1  Log Directory
0x01           SL  R/O      1  Summary SMART error log
0x02           SL  R/O      1  Comprehensive SMART error log
0x03       GPL     R/O      1  Ext. Comprehensive SMART error log
0x06           SL  R/O      1  SMART self-test log
0x07       GPL     R/O      1  Extended self-test log
0x09           SL  R/W      1  Selective self-test log
0x10       GPL     R/O      1  NCQ Command Error log
0x11       GPL     R/O      1  SATA Phy Event Counters log
0x13       GPL     R/O      1  SATA NCQ Send and Receive log
0x30       GPL,SL  R/O      9  IDENTIFY DEVICE data log
0x80-0x9f  GPL,SL  R/W     16  Host vendor specific log
0xa1           SL  VS      16  Device vendor specific log
0xa5           SL  VS      16  Device vendor specific log
0xce           SL  VS      16  Device vendor specific log
0xe0       GPL,SL  R/W      1  SCT Command/Status
0xe1       GPL,SL  R/W      1  SCT Data Transfer

SMART Extended Comprehensive Error Log Version: 1 (1 sectors)
No Errors Logged

SMART Extended Self-test Log Version: 1 (1 sectors)
No self-tests have been logged.  [To run self-tests, use: smartctl -t]

SMART Selective self-test log data structure revision number 1
 SPAN  MIN_LBA  MAX_LBA  CURRENT_TEST_STATUS
    1        0        0  Not_testing
    2        0        0  Not_testing
    3        0        0  Not_testing
    4        0        0  Not_testing
    5        0        0  Not_testing
  255        0    65535  Read_scanning was never started
Selective self-test flags (0x0):
  After scanning selected spans, do NOT read-scan remainder of disk.
If Selective self-test is pending on power-up, resume after 0 minute delay.

SCT Status Version:                  3
SCT Version (vendor specific):       256 (0x0100)
SCT Support Level:                   1
Device State:                        SCT command executing in background (5)
Current Temperature:                    30 Celsius
Power Cycle Min/Max Temperature:     26/40 Celsius
Lifetime    Min/Max Temperature:      0/70 Celsius
Under/Over Temperature Limit Count:  4294967039/4294901760
SMART Status:                        0xffff (Reserved)

SCT Temperature History Version:     2
Temperature Sampling Period:         1 minute
Temperature Logging Interval:        10 minutes
Min/Max recommended Temperature:      0/70 Celsius
Min/Max Temperature Limit:            0/70 Celsius
Temperature History Size (Index):    128 (64)

Index    Estimated Time   Temperature Celsius
  65    2019-09-27 01:00     ?  -
 ...    ..( 61 skipped).    ..  -
 127    2019-09-27 11:20     ?  -
   0    2019-09-27 11:30    40  *********************
   1    2019-09-27 11:40    26  *******
   2    2019-09-27 11:50    34  ***************
   3    2019-09-27 12:00    35  ****************
   4    2019-09-27 12:10    29  **********
   5    2019-09-27 12:20    29  **********
   6    2019-09-27 12:30    30  ***********
   7    2019-09-27 12:40    29  **********
   8    2019-09-27 12:50    30  ***********
 ...    ..(  2 skipped).    ..  ***********
  11    2019-09-27 13:20    30  ***********
  12    2019-09-27 13:30    29  **********
  13    2019-09-27 13:40    30  ***********
  14    2019-09-27 13:50    29  **********
  15    2019-09-27 14:00    29  **********
  16    2019-09-27 14:10    30  ***********
  17    2019-09-27 14:20    29  **********
  18    2019-09-27 14:30    30  ***********
  19    2019-09-27 14:40    29  **********
 ...    ..(  2 skipped).    ..  **********
  22    2019-09-27 15:10    29  **********
  23    2019-09-27 15:20    30  ***********
 ...    ..(  7 skipped).    ..  ***********
  31    2019-09-27 16:40    30  ***********
  32    2019-09-27 16:50    29  **********
  33    2019-09-27 17:00    30  ***********
 ...    ..( 21 skipped).    ..  ***********
  55    2019-09-27 20:40    30  ***********
  56    2019-09-27 20:50    29  **********
 ...    ..(  4 skipped).    ..  **********
  61    2019-09-27 21:40    29  **********
  62    2019-09-27 21:50    30  ***********
  63    2019-09-27 22:00    30  ***********
  64    2019-09-27 22:10    30  ***********

SCT Error Recovery Control:
           Read: Disabled
          Write: Disabled

Device Statistics (GP/SMART Log 0x04) not supported

Pending Defects log (GP Log 0x0c) not supported

SATA Phy Event Counters (GP Log 0x11)
ID      Size     Value  Description
0x0001  2            0  Command failed due to ICRC error
0x0002  2            0  R_ERR response for data FIS
0x0003  2            0  R_ERR response for device-to-host data FIS
0x0004  2            0  R_ERR response for host-to-device data FIS
0x0005  2            0  R_ERR response for non-data FIS
0x0006  2            0  R_ERR response for device-to-host non-data FIS
0x0007  2            0  R_ERR response for host-to-device non-data FIS
0x0008  2            0  Device-to-host non-data FIS retries
0x0009  2           60  Transition from drive PhyRdy to drive PhyNRdy
0x000a  2           60  Device-to-host register FISes sent due to a COMRESET
0x000b  2            0  CRC errors within host-to-device FIS
0x000d  2            0  Non-CRC errors within host-to-device FIS
0x000f  2            0  R_ERR response for host-to-device data FIS, CRC
0x0010  2            0  R_ERR response for host-to-device data FIS, non-CRC
0x0012  2            0  R_ERR response for host-to-device non-data FIS, CRC
0x0013  2            0  R_ERR response for host-to-device non-data FIS, non-CRC
