
/dev/sdb
=== START OF INFORMATION SECTION ===
Device Model:     ST4000VN0001-1SF178
Serial Number:    --
LU WWN Device Id: 5 000c50 ...
Firmware Version: AN02
User Capacity:    4,000,787,030,016 bytes [4.00 TB]
Sector Sizes:     512 bytes logical, 4096 bytes physical
Rotation Rate:    7200 rpm
Form Factor:      3.5 inches
Device is:        Not in smartctl database [for details use: -P showall]
ATA Version is:   ACS-3 T13/2161-D revision 3b
SATA Version is:  SATA 3.1, 6.0 Gb/s (current: 6.0 Gb/s)
Local Time is:    Tue Aug  6 10:30:20 2019 CEST
SMART support is: Available - device has SMART capability.
SMART support is: Enabled
AAM feature is:   Unavailable
APM feature is:   Unavailable
Rd look-ahead is: Enabled
Write cache is:   Enabled
ATA Security is:  Disabled, frozen [SEC2]
Wt Cache Reorder: Enabled

=== START OF READ SMART DATA SECTION ===
SMART overall-health self-assessment test result: PASSED

General SMART Values:
Offline data collection status:  (0x82)	Offline data collection activity
					was completed without error.
					Auto Offline Data Collection: Enabled.
Self-test execution status:      (   0)	The previous self-test routine completed
					without error or no self-test has ever 
					been run.
Total time to complete Offline 
data collection: 		(  584) seconds.
Offline data collection
capabilities: 			 (0x7b) SMART execute Offline immediate.
					Auto Offline data collection on/off support.
					Suspend Offline collection upon new
					command.
					Offline surface scan supported.
					Self-test supported.
					Conveyance Self-test supported.
					Selective Self-test supported.
SMART capabilities:            (0x0003)	Saves SMART data before entering
					power-saving mode.
					Supports SMART auto save timer.
Error logging capability:        (0x01)	Error logging supported.
					General Purpose Logging supported.
Short self-test routine 
recommended polling time: 	 (   1) minutes.
Extended self-test routine
recommended polling time: 	 ( 422) minutes.
Conveyance self-test routine
recommended polling time: 	 (   2) minutes.
SCT capabilities: 	       (0x10bd)	SCT Status supported.
					SCT Error Recovery Control supported.
					SCT Feature Control supported.
					SCT Data Table supported.

SMART Attributes Data Structure revision number: 10
Vendor Specific SMART Attributes with Thresholds:
ID# ATTRIBUTE_NAME          FLAGS    VALUE WORST THRESH FAIL RAW_VALUE
  1 Raw_Read_Error_Rate     POSR--   080   063   006    -    107188728
  3 Spin_Up_Time            PO----   092   091   000    -    0
  4 Start_Stop_Count        -O--CK   100   100   020    -    19
  5 Reallocated_Sector_Ct   PO--CK   100   100   010    -    0
  7 Seek_Error_Rate         POSR--   095   060   030    -    3531187361
  9 Power_On_Hours          -O--CK   066   066   000    -    30577
 10 Spin_Retry_Count        PO--C-   100   100   097    -    0
 12 Power_Cycle_Count       -O--CK   100   100   020    -    19
183 Runtime_Bad_Block       -O--CK   100   100   000    -    0
184 End-to-End_Error        -O--CK   100   100   099    -    0
187 Reported_Uncorrect      -O--CK   100   100   000    -    0
188 Command_Timeout         -O--CK   100   100   000    -    0
189 High_Fly_Writes         -O-RCK   100   100   000    -    0
190 Airflow_Temperature_Cel -O---K   072   060   040    -    28 (Min/Max 27/31)
191 G-Sense_Error_Rate      -O--CK   100   100   000    -    0
192 Power-Off_Retract_Count -O--CK   100   100   000    -    9
193 Load_Cycle_Count        -O--CK   100   100   000    -    1200
194 Temperature_Celsius     -O---K   028   040   000    -    28 (0 20 0 0 0)
195 Hardware_ECC_Recovered  -O-RC-   026   014   000    -    107188728
197 Current_Pending_Sector  -O--C-   100   100   000    -    0
198 Offline_Uncorrectable   ----C-   100   100   000    -    0
199 UDMA_CRC_Error_Count    -OSRCK   200   200   000    -    0
240 Head_Flying_Hours       ------   100   253   000    -    26095 (251 207 0)
241 Total_LBAs_Written      ------   100   253   000    -    376433680396
242 Total_LBAs_Read         ------   100   253   000    -    341845639992
                            ||||||_ K auto-keep
                            |||||__ C event count
                            ||||___ R error rate
                            |||____ S speed/performance
                            ||_____ O updated online
                            |______ P prefailure warning

General Purpose Log Directory Version 1
SMART           Log Directory Version 1 [multi-sector log support]
Address    Access  R/W   Size  Description
0x00       GPL,SL  R/O      1  Log Directory
0x01           SL  R/O      1  Summary SMART error log
0x02           SL  R/O      5  Comprehensive SMART error log
0x03       GPL     R/O      5  Ext. Comprehensive SMART error log
0x06           SL  R/O      1  SMART self-test log
0x07       GPL     R/O      1  Extended self-test log
0x08       GPL,SL  R/O      2  Power Conditions log
0x09           SL  R/W      1  Selective self-test log
0x10       GPL     R/O      1  SATA NCQ Queued Error log
0x11       GPL     R/O      1  SATA Phy Event Counters log
0x15       GPL     R/W      1  SATA Rebuild Assist log
0x21       GPL     R/O      1  Write stream error log
0x22       GPL     R/O      1  Read stream error log
0x24       GPL     R/O    512  Current Device Internal Status Data log
0x30       GPL,SL  R/O      9  IDENTIFY DEVICE data log
0x80-0x9f  GPL,SL  R/W     16  Host vendor specific log
0xa1       GPL,SL  VS      20  Device vendor specific log
0xa2       GPL     VS    8160  Device vendor specific log
0xa8-0xa9  GPL,SL  VS     136  Device vendor specific log
0xab       GPL     VS       1  Device vendor specific log
0xb0       GPL     VS    8982  Device vendor specific log
0xbe-0xbf  GPL     VS   65535  Device vendor specific log
0xc0       GPL,SL  VS       1  Device vendor specific log
0xc1       GPL,SL  VS      10  Device vendor specific log
0xd1       GPL     VS      78  Device vendor specific log
0xd2       GPL     VS   10000  Device vendor specific log
0xd3       GPL     VS    1918  Device vendor specific log
0xe0       GPL,SL  R/W      1  SCT Command/Status
0xe1       GPL,SL  R/W      1  SCT Data Transfer

SMART Extended Comprehensive Error Log Version: 1 (5 sectors)
No Errors Logged

SMART Extended Self-test Log Version: 1 (1 sectors)
No self-tests have been logged.  [To run self-tests, use: smartctl -t]

SMART Selective self-test log data structure revision number 1
 SPAN  MIN_LBA  MAX_LBA  CURRENT_TEST_STATUS
    1        0        0  Not_testing
    2        0        0  Not_testing
    3        0        0  Not_testing
    4        0        0  Not_testing
    5        0        0  Not_testing
Selective self-test flags (0x0):
  After scanning selected spans, do NOT read-scan remainder of disk.
If Selective self-test is pending on power-up, resume after 0 minute delay.

SCT Status Version:                  3
SCT Version (vendor specific):       522 (0x020a)
SCT Support Level:                   1
Device State:                        Active (0)
Current Temperature:                    28 Celsius
Power Cycle Min/Max Temperature:     27/31 Celsius
Lifetime    Min/Max Temperature:     20/40 Celsius
Under/Over Temperature Limit Count:   0/0

SCT Temperature History Version:     2
Temperature Sampling Period:         3 minutes
Temperature Logging Interval:        59 minutes
Min/Max recommended Temperature:     14/55 Celsius
Min/Max Temperature Limit:           10/60 Celsius
Temperature History Size (Index):    128 (56)

Index    Estimated Time   Temperature Celsius
  57    2019-08-01 05:34    24  *****
  58    2019-08-01 06:33     ?  -
  59    2019-08-01 07:32    23  ****
  60    2019-08-01 08:31    33  **************
 ...    ..(  6 skipped).    ..  **************
  67    2019-08-01 15:24    33  **************
  68    2019-08-01 16:23    32  *************
  69    2019-08-01 17:22     ?  -
  70    2019-08-01 18:21    23  ****
  71    2019-08-01 19:20     ?  -
  72    2019-08-01 20:19    24  *****
  73    2019-08-01 21:18     ?  -
  74    2019-08-01 22:17    28  *********
  75    2019-08-01 23:16     ?  -
  76    2019-08-02 00:15    31  ************
  77    2019-08-02 01:14    31  ************
  78    2019-08-02 02:13    30  ***********
  79    2019-08-02 03:12    30  ***********
  80    2019-08-02 04:11    30  ***********
  81    2019-08-02 05:10    31  ************
  82    2019-08-02 06:09    30  ***********
  83    2019-08-02 07:08    30  ***********
  84    2019-08-02 08:07    30  ***********
  85    2019-08-02 09:06    31  ************
  86    2019-08-02 10:05    31  ************
  87    2019-08-02 11:04    30  ***********
 ...    ..(  2 skipped).    ..  ***********
  90    2019-08-02 14:01    30  ***********
  91    2019-08-02 15:00    31  ************
  92    2019-08-02 15:59    30  ***********
  93    2019-08-02 16:58    28  *********
 ...    ..( 10 skipped).    ..  *********
 104    2019-08-03 03:47    28  *********
 105    2019-08-03 04:46    29  **********
 106    2019-08-03 05:45    28  *********
 ...    ..(  5 skipped).    ..  *********
 112    2019-08-03 11:39    28  *********
 113    2019-08-03 12:38    29  **********
 114    2019-08-03 13:37    28  *********
 ...    ..(  7 skipped).    ..  *********
 122    2019-08-03 21:29    28  *********
 123    2019-08-03 22:28    29  **********
 124    2019-08-03 23:27    28  *********
 ...    ..( 26 skipped).    ..  *********
  23    2019-08-05 02:00    28  *********
  24    2019-08-05 02:59    29  **********
  25    2019-08-05 03:58    29  **********
  26    2019-08-05 04:57    28  *********
  27    2019-08-05 05:56    28  *********
  28    2019-08-05 06:55    29  **********
  29    2019-08-05 07:54    28  *********
  30    2019-08-05 08:53    29  **********
  31    2019-08-05 09:52    29  **********
  32    2019-08-05 10:51    28  *********
 ...    ..(  6 skipped).    ..  *********
  39    2019-08-05 17:44    28  *********
  40    2019-08-05 18:43    29  **********
  41    2019-08-05 19:42    28  *********
  42    2019-08-05 20:41    28  *********
  43    2019-08-05 21:40    28  *********
  44    2019-08-05 22:39    29  **********
  45    2019-08-05 23:38    28  *********
 ...    ..( 10 skipped).    ..  *********
  56    2019-08-06 10:27    28  *********

SCT Error Recovery Control:
           Read:     70 (7.0 seconds)
          Write:     70 (7.0 seconds)

Device Statistics (GP/SMART Log 0x04) not supported

SATA Phy Event Counters (GP Log 0x11)
ID      Size     Value  Description
0x000a  2           12  Device-to-host register FISes sent due to a COMRESET
0x0001  2            0  Command failed due to ICRC error
0x0003  2            0  R_ERR response for device-to-host data FIS
0x0004  2            0  R_ERR response for host-to-device data FIS
0x0006  2            0  R_ERR response for device-to-host non-data FIS
0x0007  2            0  R_ERR response for host-to-device non-data FIS


/dev/sdc
=== START OF INFORMATION SECTION ===
Device Model:     ST4000VN0001-1SF178
Serial Number:    --
LU WWN Device Id: 5 000c50 ...
Firmware Version: AN02
User Capacity:    4,000,787,030,016 bytes [4.00 TB]
Sector Sizes:     512 bytes logical, 4096 bytes physical
Rotation Rate:    7200 rpm
Form Factor:      3.5 inches
Device is:        Not in smartctl database [for details use: -P showall]
ATA Version is:   ACS-3 T13/2161-D revision 3b
SATA Version is:  SATA 3.1, 6.0 Gb/s (current: 6.0 Gb/s)
Local Time is:    Tue Aug  6 10:30:20 2019 CEST
SMART support is: Available - device has SMART capability.
SMART support is: Enabled
AAM feature is:   Unavailable
APM feature is:   Unavailable
Rd look-ahead is: Enabled
Write cache is:   Enabled
ATA Security is:  Disabled, frozen [SEC2]
Wt Cache Reorder: Enabled

=== START OF READ SMART DATA SECTION ===
SMART overall-health self-assessment test result: PASSED

General SMART Values:
Offline data collection status:  (0x82)	Offline data collection activity
					was completed without error.
					Auto Offline Data Collection: Enabled.
Self-test execution status:      (   0)	The previous self-test routine completed
					without error or no self-test has ever 
					been run.
Total time to complete Offline 
data collection: 		(  575) seconds.
Offline data collection
capabilities: 			 (0x7b) SMART execute Offline immediate.
					Auto Offline data collection on/off support.
					Suspend Offline collection upon new
					command.
					Offline surface scan supported.
					Self-test supported.
					Conveyance Self-test supported.
					Selective Self-test supported.
SMART capabilities:            (0x0003)	Saves SMART data before entering
					power-saving mode.
					Supports SMART auto save timer.
Error logging capability:        (0x01)	Error logging supported.
					General Purpose Logging supported.
Short self-test routine 
recommended polling time: 	 (   1) minutes.
Extended self-test routine
recommended polling time: 	 ( 415) minutes.
Conveyance self-test routine
recommended polling time: 	 (   2) minutes.
SCT capabilities: 	       (0x10bd)	SCT Status supported.
					SCT Error Recovery Control supported.
					SCT Feature Control supported.
					SCT Data Table supported.

SMART Attributes Data Structure revision number: 10
Vendor Specific SMART Attributes with Thresholds:
ID# ATTRIBUTE_NAME          FLAGS    VALUE WORST THRESH FAIL RAW_VALUE
  1 Raw_Read_Error_Rate     POSR--   081   063   006    -    149075488
  3 Spin_Up_Time            PO----   092   091   000    -    0
  4 Start_Stop_Count        -O--CK   100   100   020    -    20
  5 Reallocated_Sector_Ct   PO--CK   100   100   010    -    0
  7 Seek_Error_Rate         POSR--   095   060   030    -    3461567600
  9 Power_On_Hours          -O--CK   066   066   000    -    30577
 10 Spin_Retry_Count        PO--C-   100   100   097    -    0
 12 Power_Cycle_Count       -O--CK   100   100   020    -    20
183 Runtime_Bad_Block       -O--CK   100   100   000    -    0
184 End-to-End_Error        -O--CK   100   100   099    -    0
187 Reported_Uncorrect      -O--CK   100   100   000    -    0
188 Command_Timeout         -O--CK   100   100   000    -    0
189 High_Fly_Writes         -O-RCK   100   100   000    -    0
190 Airflow_Temperature_Cel -O---K   070   056   040    -    30 (Min/Max 29/33)
191 G-Sense_Error_Rate      -O--CK   100   100   000    -    0
192 Power-Off_Retract_Count -O--CK   100   100   000    -    9
193 Load_Cycle_Count        -O--CK   100   100   000    -    1186
194 Temperature_Celsius     -O---K   030   044   000    -    30 (0 20 0 0 0)
195 Hardware_ECC_Recovered  -O-RC-   024   006   000    -    149075488
197 Current_Pending_Sector  -O--C-   100   100   000    -    0
198 Offline_Uncorrectable   ----C-   100   100   000    -    0
199 UDMA_CRC_Error_Count    -OSRCK   200   200   000    -    0
240 Head_Flying_Hours       ------   100   253   000    -    26229 (220 44 0)
241 Total_LBAs_Written      ------   100   253   000    -    384814935965
242 Total_LBAs_Read         ------   100   253   000    -    311388235710
                            ||||||_ K auto-keep
                            |||||__ C event count
                            ||||___ R error rate
                            |||____ S speed/performance
                            ||_____ O updated online
                            |______ P prefailure warning

General Purpose Log Directory Version 1
SMART           Log Directory Version 1 [multi-sector log support]
Address    Access  R/W   Size  Description
0x00       GPL,SL  R/O      1  Log Directory
0x01           SL  R/O      1  Summary SMART error log
0x02           SL  R/O      5  Comprehensive SMART error log
0x03       GPL     R/O      5  Ext. Comprehensive SMART error log
0x06           SL  R/O      1  SMART self-test log
0x07       GPL     R/O      1  Extended self-test log
0x08       GPL,SL  R/O      2  Power Conditions log
0x09           SL  R/W      1  Selective self-test log
0x10       GPL     R/O      1  SATA NCQ Queued Error log
0x11       GPL     R/O      1  SATA Phy Event Counters log
0x15       GPL     R/W      1  SATA Rebuild Assist log
0x21       GPL     R/O      1  Write stream error log
0x22       GPL     R/O      1  Read stream error log
0x24       GPL     R/O    512  Current Device Internal Status Data log
0x30       GPL,SL  R/O      9  IDENTIFY DEVICE data log
0x80-0x9f  GPL,SL  R/W     16  Host vendor specific log
0xa1       GPL,SL  VS      20  Device vendor specific log
0xa2       GPL     VS    8160  Device vendor specific log
0xa8-0xa9  GPL,SL  VS     136  Device vendor specific log
0xab       GPL     VS       1  Device vendor specific log
0xb0       GPL     VS    8982  Device vendor specific log
0xbe-0xbf  GPL     VS   65535  Device vendor specific log
0xc0       GPL,SL  VS       1  Device vendor specific log
0xc1       GPL,SL  VS      10  Device vendor specific log
0xd1       GPL     VS      78  Device vendor specific log
0xd2       GPL     VS   10000  Device vendor specific log
0xd3       GPL     VS    1918  Device vendor specific log
0xe0       GPL,SL  R/W      1  SCT Command/Status
0xe1       GPL,SL  R/W      1  SCT Data Transfer

SMART Extended Comprehensive Error Log Version: 1 (5 sectors)
No Errors Logged

SMART Extended Self-test Log Version: 1 (1 sectors)
No self-tests have been logged.  [To run self-tests, use: smartctl -t]

SMART Selective self-test log data structure revision number 1
 SPAN  MIN_LBA  MAX_LBA  CURRENT_TEST_STATUS
    1        0        0  Not_testing
    2        0        0  Not_testing
    3        0        0  Not_testing
    4        0        0  Not_testing
    5        0        0  Not_testing
Selective self-test flags (0x0):
  After scanning selected spans, do NOT read-scan remainder of disk.
If Selective self-test is pending on power-up, resume after 0 minute delay.

SCT Status Version:                  3
SCT Version (vendor specific):       522 (0x020a)
SCT Support Level:                   1
Device State:                        Active (0)
Current Temperature:                    29 Celsius
Power Cycle Min/Max Temperature:     29/33 Celsius
Lifetime    Min/Max Temperature:     20/44 Celsius
Under/Over Temperature Limit Count:   0/0

SCT Temperature History Version:     2
Temperature Sampling Period:         3 minutes
Temperature Logging Interval:        59 minutes
Min/Max recommended Temperature:     14/55 Celsius
Min/Max Temperature Limit:           10/60 Celsius
Temperature History Size (Index):    128 (58)

Index    Estimated Time   Temperature Celsius
  59    2019-08-01 05:34    35  ****************
  60    2019-08-01 06:33     ?  -
  61    2019-08-01 07:32    25  ******
  62    2019-08-01 08:31     ?  -
  63    2019-08-01 09:30    23  ****
  64    2019-08-01 10:29    34  ***************
 ...    ..(  3 skipped).    ..  ***************
  68    2019-08-01 14:25    34  ***************
  69    2019-08-01 15:24    33  **************
  70    2019-08-01 16:23    34  ***************
  71    2019-08-01 17:22    34  ***************
  72    2019-08-01 18:21     ?  -
  73    2019-08-01 19:20    24  *****
  74    2019-08-01 20:19     ?  -
  75    2019-08-01 21:18    24  *****
  76    2019-08-01 22:17     ?  -
  77    2019-08-01 23:16    29  **********
  78    2019-08-02 00:15     ?  -
  79    2019-08-02 01:14    32  *************
  80    2019-08-02 02:13    32  *************
  81    2019-08-02 03:12    32  *************
  82    2019-08-02 04:11    31  ************
  83    2019-08-02 05:10    32  *************
  84    2019-08-02 06:09    32  *************
  85    2019-08-02 07:08    31  ************
  86    2019-08-02 08:07    31  ************
  87    2019-08-02 09:06    32  *************
  88    2019-08-02 10:05    32  *************
  89    2019-08-02 11:04    32  *************
  90    2019-08-02 12:03    31  ************
  91    2019-08-02 13:02    32  *************
  92    2019-08-02 14:01    32  *************
  93    2019-08-02 15:00    33  **************
  94    2019-08-02 15:59    33  **************
  95    2019-08-02 16:58    31  ************
  96    2019-08-02 17:57    29  **********
  97    2019-08-02 18:56    29  **********
  98    2019-08-02 19:55    29  **********
  99    2019-08-02 20:54    30  ***********
 100    2019-08-02 21:53    29  **********
 101    2019-08-02 22:52    29  **********
 102    2019-08-02 23:51    29  **********
 103    2019-08-03 00:50    30  ***********
 ...    ..( 15 skipped).    ..  ***********
 119    2019-08-03 16:34    30  ***********
 120    2019-08-03 17:33    31  ************
 121    2019-08-03 18:32    30  ***********
 ...    ..( 31 skipped).    ..  ***********
  25    2019-08-05 02:00    30  ***********
  26    2019-08-05 02:59    31  ************
  27    2019-08-05 03:58    31  ************
  28    2019-08-05 04:57    30  ***********
 ...    ..(  3 skipped).    ..  ***********
  32    2019-08-05 08:53    30  ***********
  33    2019-08-05 09:52    31  ************
  34    2019-08-05 10:51    30  ***********
 ...    ..(  9 skipped).    ..  ***********
  44    2019-08-05 20:41    30  ***********
  45    2019-08-05 21:40    31  ************
  46    2019-08-05 22:39    30  ***********
 ...    ..( 11 skipped).    ..  ***********
  58    2019-08-06 10:27    30  ***********

SCT Error Recovery Control:
           Read:     70 (7.0 seconds)
          Write:     70 (7.0 seconds)

Device Statistics (GP/SMART Log 0x04) not supported

SATA Phy Event Counters (GP Log 0x11)
ID      Size     Value  Description
0x000a  2           12  Device-to-host register FISes sent due to a COMRESET
0x0001  2            0  Command failed due to ICRC error
0x0003  2            0  R_ERR response for device-to-host data FIS
0x0004  2            0  R_ERR response for host-to-device data FIS
0x0006  2            0  R_ERR response for device-to-host non-data FIS
0x0007  2            0  R_ERR response for host-to-device non-data FI