/dev/sda
=== START OF INFORMATION SECTION ===
Device Model:     Samsung SSD 860 PRO 512GB
Serial Number:    --
LU WWN Device Id: 5 002538 ...
Firmware Version: RVM01B6Q
User Capacity:    512,110,190,592 bytes [512 GB]
Sector Size:      512 bytes logical/physical
Rotation Rate:    Solid State Device
Form Factor:      2.5 inches
Device is:        Not in smartctl database [for details use: -P showall]
ATA Version is:   Unknown(0x09fc), ACS-4 T13/BSR INCITS 529 revision 5
SATA Version is:  SATA 3.1, 6.0 Gb/s (current: 6.0 Gb/s)
Local Time is:    Tue Aug  6 10:30:20 2019 CEST
SMART support is: Available - device has SMART capability.
SMART support is: Enabled
AAM feature is:   Unavailable
APM feature is:   Unavailable
Rd look-ahead is: Enabled
Write cache is:   Enabled
ATA Security is:  Disabled, frozen [SEC2]
Wt Cache Reorder: Enabled

=== START OF READ SMART DATA SECTION ===
SMART overall-health self-assessment test result: PASSED

General SMART Values:
Offline data collection status:  (0x00)	Offline data collection activity
					was never started.
					Auto Offline Data Collection: Disabled.
Self-test execution status:      (   0)	The previous self-test routine completed
					without error or no self-test has ever 
					been run.
Total time to complete Offline 
data collection: 		(    0) seconds.
Offline data collection
capabilities: 			 (0x53) SMART execute Offline immediate.
					Auto Offline data collection on/off support.
					Suspend Offline collection upon new
					command.
					No Offline surface scan supported.
					Self-test supported.
					No Conveyance Self-test supported.
					Selective Self-test supported.
SMART capabilities:            (0x0003)	Saves SMART data before entering
					power-saving mode.
					Supports SMART auto save timer.
Error logging capability:        (0x01)	Error logging supported.
					General Purpose Logging supported.
Short self-test routine 
recommended polling time: 	 (   2) minutes.
Extended self-test routine
recommended polling time: 	 (  85) minutes.
SCT capabilities: 	       (0x003d)	SCT Status supported.
					SCT Error Recovery Control supported.
					SCT Feature Control supported.
					SCT Data Table supported.

SMART Attributes Data Structure revision number: 1
Vendor Specific SMART Attributes with Thresholds:
ID# ATTRIBUTE_NAME          FLAGS    VALUE WORST THRESH FAIL RAW_VALUE
  5 Reallocated_Sector_Ct   PO--CK   100   100   010    -    0
  9 Power_On_Hours          -O--CK   099   099   000    -    4720
 12 Power_Cycle_Count       -O--CK   099   099   000    -    14
177 Wear_Leveling_Count     PO--C-   098   098   000    -    37
179 Used_Rsvd_Blk_Cnt_Tot   PO--C-   100   100   010    -    0
181 Program_Fail_Cnt_Total  -O--CK   100   100   010    -    0
182 Erase_Fail_Count_Total  -O--CK   100   100   010    -    0
183 Runtime_Bad_Block       PO--C-   100   100   010    -    0
187 Reported_Uncorrect      -O--CK   100   100   000    -    0
190 Airflow_Temperature_Cel -O--CK   075   062   000    -    25
195 Hardware_ECC_Recovered  -O-RC-   200   200   000    -    0
199 UDMA_CRC_Error_Count    -OSRCK   100   100   000    -    0
235 Unknown_Attribute       -O--C-   099   099   000    -    11
241 Total_LBAs_Written      -O--CK   099   099   000    -    11936075977
                            ||||||_ K auto-keep
                            |||||__ C event count
                            ||||___ R error rate
                            |||____ S speed/performance
                            ||_____ O updated online
                            |______ P prefailure warning

General Purpose Log Directory Version 1
SMART           Log Directory Version 1 [multi-sector log support]
Address    Access  R/W   Size  Description
0x00       GPL,SL  R/O      1  Log Directory
0x01           SL  R/O      1  Summary SMART error log
0x02           SL  R/O      1  Comprehensive SMART error log
0x03       GPL     R/O      1  Ext. Comprehensive SMART error log
0x04       GPL,SL  R/O      8  Device Statistics log
0x06           SL  R/O      1  SMART self-test log
0x07       GPL     R/O      1  Extended self-test log
0x09           SL  R/W      1  Selective self-test log
0x10       GPL     R/O      1  SATA NCQ Queued Error log
0x11       GPL     R/O      1  SATA Phy Event Counters log
0x13       GPL     R/O      1  SATA NCQ Send and Receive log
0x30       GPL,SL  R/O      9  IDENTIFY DEVICE data log
0x80-0x9f  GPL,SL  R/W     16  Host vendor specific log
0xa1           SL  VS      16  Device vendor specific log
0xa5           SL  VS      16  Device vendor specific log
0xce-0xcf      SL  VS      16  Device vendor specific log
0xe0       GPL,SL  R/W      1  SCT Command/Status
0xe1       GPL,SL  R/W      1  SCT Data Transfer

SMART Extended Comprehensive Error Log Version: 1 (1 sectors)
No Errors Logged

SMART Extended Self-test Log Version: 1 (1 sectors)
No self-tests have been logged.  [To run self-tests, use: smartctl -t]

SMART Selective self-test log data structure revision number 1
 SPAN  MIN_LBA  MAX_LBA  CURRENT_TEST_STATUS
    1        0        0  Not_testing
    2        0        0  Not_testing
    3        0        0  Not_testing
    4        0        0  Not_testing
    5        0        0  Not_testing
Selective self-test flags (0x0):
  After scanning selected spans, do NOT read-scan remainder of disk.
If Selective self-test is pending on power-up, resume after 0 minute delay.

SCT Status Version:                  3
SCT Version (vendor specific):       256 (0x0100)
SCT Support Level:                   1
Device State:                        Active (0)
Current Temperature:                    25 Celsius
Power Cycle Min/Max Temperature:     25/40 Celsius
Lifetime    Min/Max Temperature:     23/40 Celsius
Under/Over Temperature Limit Count:   0/0
SMART Status:                        0xc24f (PASSED)

SCT Temperature History Version:     2
Temperature Sampling Period:         1 minute
Temperature Logging Interval:        10 minutes
Min/Max recommended Temperature:      0/70 Celsius
Min/Max Temperature Limit:            0/70 Celsius
Temperature History Size (Index):    128 (60)

Index    Estimated Time   Temperature Celsius
  61    2019-08-05 13:20    26  *******
  62    2019-08-05 13:30    25  ******
  63    2019-08-05 13:40    25  ******
  64    2019-08-05 13:50    26  *******
  65    2019-08-05 14:00    25  ******
  66    2019-08-05 14:10    25  ******
  67    2019-08-05 14:20    26  *******
  68    2019-08-05 14:30    25  ******
  69    2019-08-05 14:40    26  *******
  70    2019-08-05 14:50    25  ******
  71    2019-08-05 15:00    26  *******
  72    2019-08-05 15:10    26  *******
  73    2019-08-05 15:20    25  ******
 ...    ..(  3 skipped).    ..  ******
  77    2019-08-05 16:00    25  ******
  78    2019-08-05 16:10    26  *******
 ...    ..(  4 skipped).    ..  *******
  83    2019-08-05 17:00    26  *******
  84    2019-08-05 17:10    25  ******
  85    2019-08-05 17:20    26  *******
 ...    ..(  6 skipped).    ..  *******
  92    2019-08-05 18:30    26  *******
  93    2019-08-05 18:40    25  ******
  94    2019-08-05 18:50    26  *******
 ...    ..(  9 skipped).    ..  *******
 104    2019-08-05 20:30    26  *******
 105    2019-08-05 20:40    25  ******
 106    2019-08-05 20:50    26  *******
 ...    ..( 18 skipped).    ..  *******
 125    2019-08-06 00:00    26  *******
 126    2019-08-06 00:10    25  ******
 127    2019-08-06 00:20    25  ******
   0    2019-08-06 00:30    25  ******
   1    2019-08-06 00:40    26  *******
   2    2019-08-06 00:50    25  ******
   3    2019-08-06 01:00    25  ******
   4    2019-08-06 01:10    26  *******
   5    2019-08-06 01:20    25  ******
   6    2019-08-06 01:30    25  ******
   7    2019-08-06 01:40    25  ******
   8    2019-08-06 01:50    26  *******
   9    2019-08-06 02:00    25  ******
  10    2019-08-06 02:10    26  *******
  11    2019-08-06 02:20    25  ******
  12    2019-08-06 02:30    26  *******
  13    2019-08-06 02:40    25  ******
  14    2019-08-06 02:50    26  *******
  15    2019-08-06 03:00    26  *******
  16    2019-08-06 03:10    25  ******
  17    2019-08-06 03:20    25  ******
  18    2019-08-06 03:30    26  *******
  19    2019-08-06 03:40    25  ******
  20    2019-08-06 03:50    26  *******
  21    2019-08-06 04:00    25  ******
  22    2019-08-06 04:10    26  *******
  23    2019-08-06 04:20    25  ******
  24    2019-08-06 04:30    26  *******
  25    2019-08-06 04:40    26  *******
  26    2019-08-06 04:50    26  *******
  27    2019-08-06 05:00    25  ******
  28    2019-08-06 05:10    25  ******
  29    2019-08-06 05:20    26  *******
  30    2019-08-06 05:30    25  ******
  31    2019-08-06 05:40    26  *******
  32    2019-08-06 05:50    25  ******
  33    2019-08-06 06:00    26  *******
  34    2019-08-06 06:10    26  *******
  35    2019-08-06 06:20    25  ******
  36    2019-08-06 06:30    26  *******
  37    2019-08-06 06:40    26  *******
  38    2019-08-06 06:50    25  ******
  39    2019-08-06 07:00    26  *******
  40    2019-08-06 07:10    25  ******
  41    2019-08-06 07:20    26  *******
  42    2019-08-06 07:30    26  *******
  43    2019-08-06 07:40    25  ******
  44    2019-08-06 07:50    25  ******
  45    2019-08-06 08:00    26  *******
  46    2019-08-06 08:10    25  ******
 ...    ..(  8 skipped).    ..  ******
  55    2019-08-06 09:40    25  ******
  56    2019-08-06 09:50    26  *******
  57    2019-08-06 10:00    25  ******
  58    2019-08-06 10:10    25  ******
  59    2019-08-06 10:20    25  ******
  60    2019-08-06 10:30    26  *******

SCT Error Recovery Control:
           Read: Disabled
          Write: Disabled

Device Statistics (GP Log 0x04)
Page  Offset Size        Value Flags Description
0x01  =====  =               =  ===  == General Statistics (rev 1) ==
0x01  0x008  4              14  ---  Lifetime Power-On Resets
0x01  0x010  4            4720  ---  Power-on Hours
0x01  0x018  6     11936075977  ---  Logical Sectors Written
0x01  0x020  6       135889754  ---  Number of Write Commands
0x01  0x028  6      1125657144  ---  Logical Sectors Read
0x01  0x030  6         9422547  ---  Number of Read Commands
0x01  0x038  6         2474000  ---  Date and Time TimeStamp
0x04  =====  =               =  ===  == General Errors Statistics (rev 1) ==
0x04  0x008  4               0  ---  Number of Reported Uncorrectable Errors
0x04  0x010  4               4  ---  Resets Between Cmd Acceptance and Completion
0x05  =====  =               =  ===  == Temperature Statistics (rev 1) ==
0x05  0x008  1              25  ---  Current Temperature
0x05  0x020  1              40  ---  Highest Temperature
0x05  0x028  1              23  ---  Lowest Temperature
0x05  0x058  1              70  ---  Specified Maximum Operating Temperature
0x06  =====  =               =  ===  == Transport Statistics (rev 1) ==
0x06  0x008  4              73  ---  Number of Hardware Resets
0x06  0x010  4               0  ---  Number of ASR Events
0x06  0x018  4               0  ---  Number of Interface CRC Errors
0x07  =====  =               =  ===  == Solid State Device Statistics (rev 1) ==
0x07  0x008  1               1  N--  Percentage Used Endurance Indicator
                                |||_ C monitored condition met
                                ||__ D supports DSN
                                |___ N normalized value

SATA Phy Event Counters (GP Log 0x11)
ID      Size     Value  Description
0x0001  2            0  Command failed due to ICRC error
0x0002  2            0  R_ERR response for data FIS
0x0003  2            0  R_ERR response for device-to-host data FIS
0x0004  2            0  R_ERR response for host-to-device data FIS
0x0005  2            0  R_ERR response for non-data FIS
0x0006  2            0  R_ERR response for device-to-host non-data FIS
0x0007  2            0  R_ERR response for host-to-device non-data FIS
0x0008  2            0  Device-to-host non-data FIS retries
0x0009  2           12  Transition from drive PhyRdy to drive PhyNRdy
0x000a  2           12  Device-to-host register FISes sent due to a COMRESET
0x000b  2            0  CRC errors within host-to-device FIS
0x000d  2            0  Non-CRC errors within host-to-device FIS
0x000f  2            0  R_ERR response for host-to-device data FIS, CRC
0x0010  2            0  R_ERR response for host-to-device data FIS, non-CRC
0x0012  2            0  R_ERR response for host-to-device non-data FIS, CRC
0x0013  2            0  R_ERR response for host-to-device non-data FIS, non-CRC

