/dev/sda
=== START OF INFORMATION SECTION ===
Model Family:     Western Digital Caviar Blue (SATA 6Gb/s)
Device Model:     WDC WD10EZEX-00UD2A0
Serial Number:    --
LU WWN Device Id: 5 0014ee ...
Firmware Version: 01.01A01
User Capacity:    1 000 204 886 016 bytes [1,00 TB]
Sector Sizes:     512 bytes logical, 4096 bytes physical
Device is:        In smartctl database [for details use: -P show]
ATA Version is:   ATA8-ACS (minor revision not indicated)
SATA Version is:  SATA 3.0, 6.0 Gb/s (current: 3.0 Gb/s)
Local Time is:    Mon Feb 29 12:35:41 2016 MSK
SMART support is: Available - device has SMART capability.
SMART support is: Enabled
AAM feature is:   Unavailable
APM feature is:   Unavailable
Rd look-ahead is: Enabled
Write cache is:   Enabled
ATA Security is:  Disabled, frozen [SEC2]
Wt Cache Reorder: Enabled

=== START OF READ SMART DATA SECTION ===
SMART overall-health self-assessment test result: PASSED

General SMART Values:
Offline data collection status:  (0x82)	Offline data collection activity
					was completed without error.
					Auto Offline Data Collection: Enabled.
Self-test execution status:      (   0)	The previous self-test routine completed
					without error or no self-test has ever 
					been run.
Total time to complete Offline 
data collection: 		(10260) seconds.
Offline data collection
capabilities: 			 (0x7b) SMART execute Offline immediate.
					Auto Offline data collection on/off support.
					Suspend Offline collection upon new
					command.
					Offline surface scan supported.
					Self-test supported.
					Conveyance Self-test supported.
					Selective Self-test supported.
SMART capabilities:            (0x0003)	Saves SMART data before entering
					power-saving mode.
					Supports SMART auto save timer.
Error logging capability:        (0x01)	Error logging supported.
					General Purpose Logging supported.
Short self-test routine 
recommended polling time: 	 (   2) minutes.
Extended self-test routine
recommended polling time: 	 ( 107) minutes.
Conveyance self-test routine
recommended polling time: 	 (   5) minutes.
SCT capabilities: 	       (0x3035)	SCT Status supported.
					SCT Feature Control supported.
					SCT Data Table supported.

SMART Attributes Data Structure revision number: 16
Vendor Specific SMART Attributes with Thresholds:
ID# ATTRIBUTE_NAME          FLAGS    VALUE WORST THRESH FAIL RAW_VALUE
  1 Raw_Read_Error_Rate     POSR-K   200   200   051    -    16
  3 Spin_Up_Time            POS--K   174   171   021    -    2291
  4 Start_Stop_Count        -O--CK   100   100   000    -    780
  5 Reallocated_Sector_Ct   PO--CK   200   200   140    -    0
  7 Seek_Error_Rate         -OSR-K   200   200   000    -    0
  9 Power_On_Hours          -O--CK   095   095   000    -    3904
 10 Spin_Retry_Count        -O--CK   100   100   000    -    0
 11 Calibration_Retry_Count -O--CK   100   100   000    -    0
 12 Power_Cycle_Count       -O--CK   100   100   000    -    771
192 Power-Off_Retract_Count -O--CK   200   200   000    -    100
193 Load_Cycle_Count        -O--CK   200   200   000    -    679
194 Temperature_Celsius     -O---K   108   099   000    -    35
196 Reallocated_Event_Count -O--CK   200   200   000    -    0
197 Current_Pending_Sector  -O--CK   200   200   000    -    0
198 Offline_Uncorrectable   ----CK   200   200   000    -    0
199 UDMA_CRC_Error_Count    -O--CK   200   200   000    -    0
200 Multi_Zone_Error_Rate   ---R--   200   200   000    -    0
                            ||||||_ K auto-keep
                            |||||__ C event count
                            ||||___ R error rate
                            |||____ S speed/performance
                            ||_____ O updated online
                            |______ P prefailure warning

General Purpose Log Directory Version 1
SMART           Log Directory Version 1 [multi-sector log support]
Address    Access  R/W   Size  Description
0x00       GPL,SL  R/O      1  Log Directory
0x01           SL  R/O      1  Summary SMART error log
0x02           SL  R/O      5  Comprehensive SMART error log
0x03       GPL     R/O      6  Ext. Comprehensive SMART error log
0x06           SL  R/O      1  SMART self-test log
0x07       GPL     R/O      1  Extended self-test log
0x09           SL  R/W      1  Selective self-test log
0x10       GPL     R/O      1  NCQ Command Error log
0x11       GPL     R/O      1  SATA Phy Event Counters
0x80-0x9f  GPL,SL  R/W     16  Host vendor specific log
0xa0-0xa7  GPL,SL  VS      16  Device vendor specific log
0xa8-0xb7  GPL,SL  VS       1  Device vendor specific log
0xbd       GPL,SL  VS       1  Device vendor specific log
0xc0       GPL,SL  VS       1  Device vendor specific log
0xc1       GPL     VS      93  Device vendor specific log
0xe0       GPL,SL  R/W      1  SCT Command/Status
0xe1       GPL,SL  R/W      1  SCT Data Transfer

SMART Extended Comprehensive Error Log Version: 1 (6 sectors)
Device Error Count: 10
	CR     = Command Register
	FEATR  = Features Register
	COUNT  = Count (was: Sector Count) Register
	LBA_48 = Upper bytes of LBA High/Mid/Low Registers ]  ATA-8
	LH     = LBA High (was: Cylinder High) Register    ]   LBA
	LM     = LBA Mid (was: Cylinder Low) Register      ] Register
	LL     = LBA Low (was: Sector Number) Register     ]
	DV     = Device (was: Device/Head) Register
	DC     = Device Control Register
	ER     = Error register
	ST     = Status register
Powered_Up_Time is measured from power on, and printed as
DDd+hh:mm:SS.sss where DD=days, hh=hours, mm=minutes,
SS=sec, and sss=millisec. It "wraps" after 49.710 days.

Error 10 [9] occurred at disk power-on lifetime: 3388 hours (141 days + 4 hours)
  When the command that caused the error occurred, the device was active or idle.

  After command completion occurred, registers were:
  ER -- ST COUNT  LBA_48  LH LM LL DV DC
  -- -- -- == -- == == == -- -- -- -- --
  40 -- 51 00 00 00 00 00 3f a2 48 40 00  Error: WP at LBA = 0x003fa248 = 4170312

  Commands leading to the command that caused the error were:
  CR FEATR COUNT  LBA_48  LH LM LL DV DC  Powered_Up_Time  Command/Feature_Name
  -- == -- == -- == == == -- -- -- -- --  ---------------  --------------------
  61 00 08 00 30 00 00 00 66 0f 20 40 00     00:00:35.116  WRITE FPDMA QUEUED
  61 00 08 00 30 00 00 00 66 0f 38 40 00     00:00:35.116  WRITE FPDMA QUEUED
  61 00 08 00 08 00 00 00 66 10 38 40 00     00:00:35.116  WRITE FPDMA QUEUED
  60 01 00 00 28 00 00 00 3f a3 58 40 00     00:00:35.116  READ FPDMA QUEUED
  60 01 00 00 20 00 00 00 3f a2 58 40 00     00:00:35.115  READ FPDMA QUEUED

Error 9 [8] occurred at disk power-on lifetime: 3388 hours (141 days + 4 hours)
  When the command that caused the error occurred, the device was active or idle.

  After command completion occurred, registers were:
  ER -- ST COUNT  LBA_48  LH LM LL DV DC
  -- -- -- == -- == == == -- -- -- -- --
  40 -- 51 00 00 00 00 00 3f a2 48 40 00  Error: WP at LBA = 0x003fa248 = 4170312

  Commands leading to the command that caused the error were:
  CR FEATR COUNT  LBA_48  LH LM LL DV DC  Powered_Up_Time  Command/Feature_Name
  -- == -- == -- == == == -- -- -- -- --  ---------------  --------------------
  61 00 08 00 10 00 00 00 03 75 28 40 00     00:00:32.615  WRITE FPDMA QUEUED
  60 01 00 00 08 00 00 00 3f a4 58 40 00     00:00:32.615  READ FPDMA QUEUED
  60 01 00 00 f8 00 00 00 3f a3 58 40 00     00:00:32.615  READ FPDMA QUEUED
  60 01 00 00 f0 00 00 00 3f a2 58 40 00     00:00:32.592  READ FPDMA QUEUED
  60 01 00 00 e8 00 00 00 3f a1 58 40 00     00:00:32.592  READ FPDMA QUEUED

Error 8 [7] occurred at disk power-on lifetime: 3388 hours (141 days + 4 hours)
  When the command that caused the error occurred, the device was active or idle.

  After command completion occurred, registers were:
  ER -- ST COUNT  LBA_48  LH LM LL DV DC
  -- -- -- == -- == == == -- -- -- -- --
  40 -- 51 00 00 00 00 00 3f a2 48 40 00  Error: UNC at LBA = 0x003fa248 = 4170312

  Commands leading to the command that caused the error were:
  CR FEATR COUNT  LBA_48  LH LM LL DV DC  Powered_Up_Time  Command/Feature_Name
  -- == -- == -- == == == -- -- -- -- --  ---------------  --------------------
  60 01 00 00 d8 00 00 00 3f bf 58 40 00     00:00:30.110  READ FPDMA QUEUED
  60 01 00 00 d0 00 00 00 3f be 58 40 00     00:00:30.109  READ FPDMA QUEUED
  60 01 00 00 c8 00 00 00 3f bd 58 40 00     00:00:30.109  READ FPDMA QUEUED
  60 01 00 00 c0 00 00 00 3f bc 58 40 00     00:00:30.109  READ FPDMA QUEUED
  60 01 00 00 b8 00 00 00 3f bb 58 40 00     00:00:30.109  READ FPDMA QUEUED

Error 7 [6] occurred at disk power-on lifetime: 3388 hours (141 days + 4 hours)
  When the command that caused the error occurred, the device was active or idle.

  After command completion occurred, registers were:
  ER -- ST COUNT  LBA_48  LH LM LL DV DC
  -- -- -- == -- == == == -- -- -- -- --
  40 -- 51 00 00 00 00 00 3f a2 48 40 00  Error: UNC at LBA = 0x003fa248 = 4170312

  Commands leading to the command that caused the error were:
  CR FEATR COUNT  LBA_48  LH LM LL DV DC  Powered_Up_Time  Command/Feature_Name
  -- == -- == -- == == == -- -- -- -- --  ---------------  --------------------
  60 01 00 00 68 00 00 00 3f bf 58 40 00     00:00:27.565  READ FPDMA QUEUED
  60 01 00 00 60 00 00 00 3f be 58 40 00     00:00:27.564  READ FPDMA QUEUED
  60 01 00 00 58 00 00 00 3f bd 58 40 00     00:00:27.564  READ FPDMA QUEUED
  60 01 00 00 50 00 00 00 3f bc 58 40 00     00:00:27.563  READ FPDMA QUEUED
  60 01 00 00 48 00 00 00 3f bb 58 40 00     00:00:27.562  READ FPDMA QUEUED

Error 6 [5] occurred at disk power-on lifetime: 3388 hours (141 days + 4 hours)
  When the command that caused the error occurred, the device was active or idle.

  After command completion occurred, registers were:
  ER -- ST COUNT  LBA_48  LH LM LL DV DC
  -- -- -- == -- == == == -- -- -- -- --
  40 -- 51 00 7f 00 00 00 3f a2 48 e0 00  Error: UNC 127 sectors at LBA = 0x003fa248 = 4170312

  Commands leading to the command that caused the error were:
  CR FEATR COUNT  LBA_48  LH LM LL DV DC  Powered_Up_Time  Command/Feature_Name
  -- == -- == -- == == == -- -- -- -- --  ---------------  --------------------
  25 00 00 00 7f 00 00 00 3f a2 44 e0 00     00:00:14.315  READ DMA EXT
  25 00 00 00 7f 00 00 00 3f a1 c5 e0 00     00:00:14.315  READ DMA EXT
  25 00 00 00 7f 00 00 00 3f a1 46 e0 00     00:00:14.314  READ DMA EXT
  25 00 00 00 7f 00 00 00 3f a0 c7 e0 00     00:00:14.314  READ DMA EXT
  25 00 00 00 7f 00 00 00 3f a0 48 e0 00     00:00:14.314  READ DMA EXT

Error 5 [4] occurred at disk power-on lifetime: 3388 hours (141 days + 4 hours)
  When the command that caused the error occurred, the device was active or idle.

  After command completion occurred, registers were:
  ER -- ST COUNT  LBA_48  LH LM LL DV DC
  -- -- -- == -- == == == -- -- -- -- --
  40 -- 51 00 7f 00 00 00 3f a2 48 e0 00  Error: UNC 127 sectors at LBA = 0x003fa248 = 4170312

  Commands leading to the command that caused the error were:
  CR FEATR COUNT  LBA_48  LH LM LL DV DC  Powered_Up_Time  Command/Feature_Name
  -- == -- == -- == == == -- -- -- -- --  ---------------  --------------------
  25 00 00 00 7f 00 00 00 3f a2 44 e0 00     00:00:11.956  READ DMA EXT
  25 00 00 00 7f 00 00 00 3f a1 c5 e0 00     00:00:11.928  READ DMA EXT
  25 00 00 00 7f 00 00 00 3f a1 46 e0 00     00:00:11.928  READ DMA EXT
  25 00 00 00 7f 00 00 00 3f a0 c7 e0 00     00:00:11.928  READ DMA EXT
  25 00 00 00 7f 00 00 00 3f a0 48 e0 00     00:00:11.927  READ DMA EXT

Error 4 [3] occurred at disk power-on lifetime: 3388 hours (141 days + 4 hours)
  When the command that caused the error occurred, the device was active or idle.

  After command completion occurred, registers were:
  ER -- ST COUNT  LBA_48  LH LM LL DV DC
  -- -- -- == -- == == == -- -- -- -- --
  40 -- 51 00 7f 00 00 00 3f a2 48 e0 00  Error: UNC 127 sectors at LBA = 0x003fa248 = 4170312

  Commands leading to the command that caused the error were:
  CR FEATR COUNT  LBA_48  LH LM LL DV DC  Powered_Up_Time  Command/Feature_Name
  -- == -- == -- == == == -- -- -- -- --  ---------------  --------------------
  25 00 00 00 7f 00 00 00 3f a2 44 e0 00     00:00:09.518  READ DMA EXT
  25 00 00 00 7f 00 00 00 3f a1 c5 e0 00     00:00:09.518  READ DMA EXT
  25 00 00 00 7f 00 00 00 3f a1 46 e0 00     00:00:09.517  READ DMA EXT
  25 00 00 00 7f 00 00 00 3f a0 c7 e0 00     00:00:09.517  READ DMA EXT
  25 00 00 00 7f 00 00 00 3f a0 48 e0 00     00:00:09.516  READ DMA EXT

Error 3 [2] occurred at disk power-on lifetime: 3388 hours (141 days + 4 hours)
  When the command that caused the error occurred, the device was active or idle.

  After command completion occurred, registers were:
  ER -- ST COUNT  LBA_48  LH LM LL DV DC
  -- -- -- == -- == == == -- -- -- -- --
  40 -- 51 00 7f 00 00 00 3f a2 48 e0 00  Error: UNC 127 sectors at LBA = 0x003fa248 = 4170312

  Commands leading to the command that caused the error were:
  CR FEATR COUNT  LBA_48  LH LM LL DV DC  Powered_Up_Time  Command/Feature_Name
  -- == -- == -- == == == -- -- -- -- --  ---------------  --------------------
  25 00 00 00 7f 00 00 00 3f a2 44 e0 00     00:00:11.823  READ DMA EXT
  25 00 00 00 7f 00 00 00 3f a1 c5 e0 00     00:00:11.795  READ DMA EXT
  25 00 00 00 7f 00 00 00 3f a1 46 e0 00     00:00:11.795  READ DMA EXT
  25 00 00 00 7f 00 00 00 3f a0 c7 e0 00     00:00:11.795  READ DMA EXT
  25 00 00 00 7f 00 00 00 3f a0 48 e0 00     00:00:11.794  READ DMA EXT

SMART Extended Self-test Log Version: 1 (1 sectors)
No self-tests have been logged.  [To run self-tests, use: smartctl -t]

SMART Selective self-test log data structure revision number 1
 SPAN  MIN_LBA  MAX_LBA  CURRENT_TEST_STATUS
    1        0        0  Not_testing
    2        0        0  Not_testing
    3        0        0  Not_testing
    4        0        0  Not_testing
    5        0        0  Not_testing
Selective self-test flags (0x0):
  After scanning selected spans, do NOT read-scan remainder of disk.
If Selective self-test is pending on power-up, resume after 0 minute delay.

SCT Status Version:                  3
SCT Version (vendor specific):       258 (0x0102)
SCT Support Level:                   1
Device State:                        Active (0)
Current Temperature:                    35 Celsius
Power Cycle Min/Max Temperature:     34/35 Celsius
Lifetime    Min/Max Temperature:      0/44 Celsius
Under/Over Temperature Limit Count:   0/0

SCT Temperature History Version:     2
Temperature Sampling Period:         1 minute
Temperature Logging Interval:        1 minute
Min/Max recommended Temperature:      0/60 Celsius
Min/Max Temperature Limit:           -41/85 Celsius
Temperature History Size (Index):    478 (387)

Index    Estimated Time   Temperature Celsius
 388    2016-02-29 04:38    38  *******************
 ...    ..( 14 skipped).    ..  *******************
 403    2016-02-29 04:53    38  *******************
 404    2016-02-29 04:54    37  ******************
 ...    ..(  8 skipped).    ..  ******************
 413    2016-02-29 05:03    37  ******************
 414    2016-02-29 05:04     ?  -
 415    2016-02-29 05:05    18  -
 416    2016-02-29 05:06    18  -
 417    2016-02-29 05:07    19  -
 418    2016-02-29 05:08    20  *
 419    2016-02-29 05:09    20  *
 420    2016-02-29 05:10    21  **
 421    2016-02-29 05:11    22  ***
 422    2016-02-29 05:12    23  ****
 423    2016-02-29 05:13    23  ****
 424    2016-02-29 05:14    23  ****
 425    2016-02-29 05:15    24  *****
 426    2016-02-29 05:16    24  *****
 427    2016-02-29 05:17    25  ******
 428    2016-02-29 05:18    26  *******
 ...    ..(  2 skipped).    ..  *******
 431    2016-02-29 05:21    26  *******
 432    2016-02-29 05:22    27  ********
 ...    ..(  2 skipped).    ..  ********
 435    2016-02-29 05:25    27  ********
 436    2016-02-29 05:26    28  *********
 ...    ..(  2 skipped).    ..  *********
 439    2016-02-29 05:29    28  *********
 440    2016-02-29 05:30    29  **********
 ...    ..(  3 skipped).    ..  **********
 444    2016-02-29 05:34    29  **********
 445    2016-02-29 05:35    30  ***********
 ...    ..( 15 skipped).    ..  ***********
 461    2016-02-29 05:51    30  ***********
 462    2016-02-29 05:52    31  ************
 ...    ..( 21 skipped).    ..  ************
   6    2016-02-29 06:14    31  ************
   7    2016-02-29 06:15    32  *************
 ...    ..(  9 skipped).    ..  *************
  17    2016-02-29 06:25    32  *************
  18    2016-02-29 06:26    33  **************
  19    2016-02-29 06:27    33  **************
  20    2016-02-29 06:28    33  **************
  21    2016-02-29 06:29     ?  -
  22    2016-02-29 06:30    34  ***************
 ...    ..( 31 skipped).    ..  ***************
  54    2016-02-29 07:02    34  ***************
  55    2016-02-29 07:03    35  ****************
 ...    ..(  3 skipped).    ..  ****************
  59    2016-02-29 07:07    35  ****************
  60    2016-02-29 07:08    38  *******************
 ...    ..( 47 skipped).    ..  *******************
 108    2016-02-29 07:56    38  *******************
 109    2016-02-29 07:57    37  ******************
 ...    ..( 14 skipped).    ..  ******************
 124    2016-02-29 08:12    37  ******************
 125    2016-02-29 08:13    36  *****************
 ...    ..(119 skipped).    ..  *****************
 245    2016-02-29 10:13    36  *****************
 246    2016-02-29 10:14    37  ******************
 ...    ..( 14 skipped).    ..  ******************
 261    2016-02-29 10:29    37  ******************
 262    2016-02-29 10:30    38  *******************
 ...    ..(124 skipped).    ..  *******************
 387    2016-02-29 12:35    38  *******************

SCT Error Recovery Control command not supported

Device Statistics (GP Log 0x04) not supported

SATA Phy Event Counters (GP Log 0x11)
ID      Size     Value  Description
0x0001  2            0  Command failed due to ICRC error
0x0002  2            0  R_ERR response for data FIS
0x0003  2            0  R_ERR response for device-to-host data FIS
0x0004  2            0  R_ERR response for host-to-device data FIS
0x0005  2            0  R_ERR response for non-data FIS
0x0006  2            0  R_ERR response for device-to-host non-data FIS
0x0007  2            0  R_ERR response for host-to-device non-data FIS
0x0008  2            0  Device-to-host non-data FIS retries
0x0009  2            9  Transition from drive PhyRdy to drive PhyNRdy
0x000a  2            7  Device-to-host register FISes sent due to a COMRESET
0x000b  2            0  CRC errors within host-to-device FIS
0x000f  2            0  R_ERR response for host-to-device data FIS, CRC
0x0012  2            0  R_ERR response for host-to-device non-data FIS, CRC
0x8000  4         2321  Vendor specific