/dev/sda
=== START OF INFORMATION SECTION ===
Model Family:     Western Digital Blue
Device Model:     WDC WD5000AAKX-001CA0
Serial Number:    --
LU WWN Device Id: 5 0014ee ...
Firmware Version: 15.01H15
User Capacity:    500 107 862 016 bytes [500 GB]
Sector Size:      512 bytes logical/physical
Device is:        In smartctl database [for details use: -P show]
ATA Version is:   ATA8-ACS (minor revision not indicated)
SATA Version is:  SATA 3.0, 6.0 Gb/s (current: 3.0 Gb/s)
Local Time is:    Fri Aug 19 15:18:27 2016 CEST
SMART support is: Available - device has SMART capability.
SMART support is: Enabled
AAM feature is:   Unavailable
APM feature is:   Unavailable
Rd look-ahead is: Enabled
Write cache is:   Enabled
ATA Security is:  Disabled, frozen [SEC2]
Wt Cache Reorder: Enabled

=== START OF READ SMART DATA SECTION ===
SMART overall-health self-assessment test result: PASSED

General SMART Values:
Offline data collection status:  (0x82)	Offline data collection activity
					was completed without error.
					Auto Offline Data Collection: Enabled.
Self-test execution status:      (   0)	The previous self-test routine completed
					without error or no self-test has ever 
					been run.
Total time to complete Offline 
data collection: 		( 9060) seconds.
Offline data collection
capabilities: 			 (0x7b) SMART execute Offline immediate.
					Auto Offline data collection on/off support.
					Suspend Offline collection upon new
					command.
					Offline surface scan supported.
					Self-test supported.
					Conveyance Self-test supported.
					Selective Self-test supported.
SMART capabilities:            (0x0003)	Saves SMART data before entering
					power-saving mode.
					Supports SMART auto save timer.
Error logging capability:        (0x01)	Error logging supported.
					General Purpose Logging supported.
Short self-test routine 
recommended polling time: 	 (   2) minutes.
Extended self-test routine
recommended polling time: 	 (  92) minutes.
Conveyance self-test routine
recommended polling time: 	 (   5) minutes.
SCT capabilities: 	       (0x3037)	SCT Status supported.
					SCT Feature Control supported.
					SCT Data Table supported.

SMART Attributes Data Structure revision number: 16
Vendor Specific SMART Attributes with Thresholds:
ID# ATTRIBUTE_NAME          FLAGS    VALUE WORST THRESH FAIL RAW_VALUE
  1 Raw_Read_Error_Rate     POSR-K   200   200   051    -    2128
  3 Spin_Up_Time            POS--K   139   137   021    -    4041
  4 Start_Stop_Count        -O--CK   097   097   000    -    3192
  5 Reallocated_Sector_Ct   PO--CK   200   200   140    -    0
  7 Seek_Error_Rate         -OSR-K   100   253   000    -    0
  9 Power_On_Hours          -O--CK   066   066   000    -    25182
 10 Spin_Retry_Count        -O--CK   100   100   000    -    0
 11 Calibration_Retry_Count -O--CK   100   100   000    -    0
 12 Power_Cycle_Count       -O--CK   098   098   000    -    2156
192 Power-Off_Retract_Count -O--CK   200   200   000    -    202
193 Load_Cycle_Count        -O--CK   200   200   000    -    2989
194 Temperature_Celsius     -O---K   107   098   000    -    36
196 Reallocated_Event_Count -O--CK   200   200   000    -    0
197 Current_Pending_Sector  -O--CK   200   200   000    -    1
198 Offline_Uncorrectable   ----CK   200   200   000    -    1
199 UDMA_CRC_Error_Count    -O--CK   200   200   000    -    0
200 Multi_Zone_Error_Rate   ---R--   199   199   000    -    210
                            ||||||_ K auto-keep
                            |||||__ C event count
                            ||||___ R error rate
                            |||____ S speed/performance
                            ||_____ O updated online
                            |______ P prefailure warning

General Purpose Log Directory Version 1
SMART           Log Directory Version 1 [multi-sector log support]
Address    Access  R/W   Size  Description
0x00       GPL,SL  R/O      1  Log Directory
0x01           SL  R/O      1  Summary SMART error log
0x02           SL  R/O      5  Comprehensive SMART error log
0x03       GPL     R/O      6  Ext. Comprehensive SMART error log
0x06           SL  R/O      1  SMART self-test log
0x07       GPL     R/O      1  Extended self-test log
0x09           SL  R/W      1  Selective self-test log
0x10       GPL     R/O      1  SATA NCQ Queued Error log
0x11       GPL     R/O      1  SATA Phy Event Counters log
0x80-0x9f  GPL,SL  R/W     16  Host vendor specific log
0xa0-0xa7  GPL,SL  VS      16  Device vendor specific log
0xa8-0xb5  GPL,SL  VS       1  Device vendor specific log
0xb6       GPL     VS       1  Device vendor specific log
0xb7       GPL,SL  VS       1  Device vendor specific log
0xbd       GPL,SL  VS       1  Device vendor specific log
0xc0       GPL,SL  VS       1  Device vendor specific log
0xc1       GPL     VS      24  Device vendor specific log
0xe0       GPL,SL  R/W      1  SCT Command/Status
0xe1       GPL,SL  R/W      1  SCT Data Transfer

SMART Extended Comprehensive Error Log Version: 1 (6 sectors)
Device Error Count: 234 (device log contains only the most recent 24 errors)
	CR     = Command Register
	FEATR  = Features Register
	COUNT  = Count (was: Sector Count) Register
	LBA_48 = Upper bytes of LBA High/Mid/Low Registers ]  ATA-8
	LH     = LBA High (was: Cylinder High) Register    ]   LBA
	LM     = LBA Mid (was: Cylinder Low) Register      ] Register
	LL     = LBA Low (was: Sector Number) Register     ]
	DV     = Device (was: Device/Head) Register
	DC     = Device Control Register
	ER     = Error register
	ST     = Status register
Powered_Up_Time is measured from power on, and printed as
DDd+hh:mm:SS.sss where DD=days, hh=hours, mm=minutes,
SS=sec, and sss=millisec. It "wraps" after 49.710 days.

Error 234 [17] occurred at disk power-on lifetime: 24784 hours (1032 days + 16 hours)
  When the command that caused the error occurred, the device was active or idle.

  After command completion occurred, registers were:
  ER -- ST COUNT  LBA_48  LH LM LL DV DC
  -- -- -- == -- == == == -- -- -- -- --
  40 -- 51 00 08 00 00 0e 0d b3 6f ee 00  Error: UNC 8 sectors at LBA = 0x0e0db36f = 235778927

  Commands leading to the command that caused the error were:
  CR FEATR COUNT  LBA_48  LH LM LL DV DC  Powered_Up_Time  Command/Feature_Name
  -- == -- == -- == == == -- -- -- -- --  ---------------  --------------------
  c8 00 00 00 08 00 00 0e 0d b3 68 ee 08     07:20:05.656  READ DMA
  35 00 00 04 00 00 00 0e 0a d3 c0 e0 08     07:20:05.654  WRITE DMA EXT
  27 00 00 00 00 00 00 00 00 00 00 e0 08     07:20:05.639  READ NATIVE MAX ADDRESS EXT [OBS-ACS-3]
  ec 00 00 00 00 00 00 00 00 00 00 a0 08     07:20:05.632  IDENTIFY DEVICE
  ef 00 03 00 46 00 00 00 00 00 00 a0 08     07:20:05.632  SET FEATURES [Set transfer mode]

Error 233 [16] occurred at disk power-on lifetime: 24784 hours (1032 days + 16 hours)
  When the command that caused the error occurred, the device was active or idle.

  After command completion occurred, registers were:
  ER -- ST COUNT  LBA_48  LH LM LL DV DC
  -- -- -- == -- == == == -- -- -- -- --
  40 -- 51 00 08 00 00 0e 0d b3 6f ee 00  Error: UNC 8 sectors at LBA = 0x0e0db36f = 235778927

  Commands leading to the command that caused the error were:
  CR FEATR COUNT  LBA_48  LH LM LL DV DC  Powered_Up_Time  Command/Feature_Name
  -- == -- == -- == == == -- -- -- -- --  ---------------  --------------------
  c8 00 00 00 08 00 00 0e 0d b3 68 ee 08     07:20:03.986  READ DMA
  c8 00 00 00 08 00 00 0e 0d b3 60 ee 08     07:20:03.985  READ DMA
  c8 00 00 00 08 00 00 0e 0d b3 58 ee 08     07:20:03.985  READ DMA
  c8 00 00 00 08 00 00 0e 0d b3 50 ee 08     07:20:03.985  READ DMA
  c8 00 00 00 08 00 00 0e 0d b3 48 ee 08     07:20:03.985  READ DMA

Error 232 [15] occurred at disk power-on lifetime: 24784 hours (1032 days + 16 hours)
  When the command that caused the error occurred, the device was active or idle.

  After command completion occurred, registers were:
  ER -- ST COUNT  LBA_48  LH LM LL DV DC
  -- -- -- == -- == == == -- -- -- -- --
  40 -- 51 00 00 00 00 0e 0d b3 6f ee 00  Error: UNC at LBA = 0x0e0db36f = 235778927

  Commands leading to the command that caused the error were:
  CR FEATR COUNT  LBA_48  LH LM LL DV DC  Powered_Up_Time  Command/Feature_Name
  -- == -- == -- == == == -- -- -- -- --  ---------------  --------------------
  c8 00 00 00 00 00 00 0e 0d b2 70 ee 08     07:20:01.623  READ DMA
  c8 00 00 00 00 00 00 0e 0d b1 70 ee 08     07:20:01.622  READ DMA
  c8 00 00 00 00 00 00 0e 0d b0 70 ee 08     07:20:01.621  READ DMA
  c8 00 00 00 00 00 00 0e 0d af 70 ee 08     07:20:01.620  READ DMA
  25 00 00 02 00 00 00 0e 0d ad 70 e0 08     07:20:01.583  READ DMA EXT

Error 231 [14] occurred at disk power-on lifetime: 21905 hours (912 days + 17 hours)
  When the command that caused the error occurred, the device was active or idle.

  After command completion occurred, registers were:
  ER -- ST COUNT  LBA_48  LH LM LL DV DC
  -- -- -- == -- == == == -- -- -- -- --
  40 -- 51 00 08 00 00 1b 55 ce ec e0 00  Error: UNC 8 sectors at LBA = 0x1b55ceec = 458608364

  Commands leading to the command that caused the error were:
  CR FEATR COUNT  LBA_48  LH LM LL DV DC  Powered_Up_Time  Command/Feature_Name
  -- == -- == -- == == == -- -- -- -- --  ---------------  --------------------
  25 00 00 00 08 00 00 1b 55 ce e8 e0 08     12:53:53.575  READ DMA EXT
  ca 00 00 00 18 00 00 01 c4 1f c8 e1 08     12:53:53.575  WRITE DMA
  27 00 00 00 00 00 00 00 00 00 00 e0 08     12:53:53.559  READ NATIVE MAX ADDRESS EXT [OBS-ACS-3]
  ec 00 00 00 00 00 00 00 00 00 00 a0 08     12:53:53.551  IDENTIFY DEVICE
  ef 00 03 00 46 00 00 00 00 00 00 a0 08     12:53:53.551  SET FEATURES [Set transfer mode]

Error 230 [13] occurred at disk power-on lifetime: 21905 hours (912 days + 17 hours)
  When the command that caused the error occurred, the device was active or idle.

  After command completion occurred, registers were:
  ER -- ST COUNT  LBA_48  LH LM LL DV DC
  -- -- -- == -- == == == -- -- -- -- --
  40 -- 51 00 08 00 00 1b 55 ce ec e0 00  Error: UNC 8 sectors at LBA = 0x1b55ceec = 458608364

  Commands leading to the command that caused the error were:
  CR FEATR COUNT  LBA_48  LH LM LL DV DC  Powered_Up_Time  Command/Feature_Name
  -- == -- == -- == == == -- -- -- -- --  ---------------  --------------------
  25 00 00 00 08 00 00 1b 55 ce e8 e0 08     12:53:51.902  READ DMA EXT
  27 00 00 00 00 00 00 00 00 00 00 e0 08     12:53:51.885  READ NATIVE MAX ADDRESS EXT [OBS-ACS-3]
  ec 00 00 00 00 00 00 00 00 00 00 a0 08     12:53:51.877  IDENTIFY DEVICE
  ef 00 03 00 46 00 00 00 00 00 00 a0 08     12:53:51.877  SET FEATURES [Set transfer mode]
  27 00 00 00 00 00 00 00 00 00 00 e0 08     12:53:51.877  READ NATIVE MAX ADDRESS EXT [OBS-ACS-3]

Error 229 [12] occurred at disk power-on lifetime: 21905 hours (912 days + 17 hours)
  When the command that caused the error occurred, the device was active or idle.

  After command completion occurred, registers were:
  ER -- ST COUNT  LBA_48  LH LM LL DV DC
  -- -- -- == -- == == == -- -- -- -- --
  40 -- 51 00 08 00 00 1b 55 ce ec e0 00  Error: UNC 8 sectors at LBA = 0x1b55ceec = 458608364

  Commands leading to the command that caused the error were:
  CR FEATR COUNT  LBA_48  LH LM LL DV DC  Powered_Up_Time  Command/Feature_Name
  -- == -- == -- == == == -- -- -- -- --  ---------------  --------------------
  25 00 00 00 08 00 00 1b 55 ce e8 e0 08     12:53:50.226  READ DMA EXT
  27 00 00 00 00 00 00 00 00 00 00 e0 08     12:53:50.211  READ NATIVE MAX ADDRESS EXT [OBS-ACS-3]
  ec 00 00 00 00 00 00 00 00 00 00 a0 08     12:53:50.203  IDENTIFY DEVICE
  ef 00 03 00 46 00 00 00 00 00 00 a0 08     12:53:50.203  SET FEATURES [Set transfer mode]
  27 00 00 00 00 00 00 00 00 00 00 e0 08     12:53:50.203  READ NATIVE MAX ADDRESS EXT [OBS-ACS-3]

Error 228 [11] occurred at disk power-on lifetime: 21905 hours (912 days + 17 hours)
  When the command that caused the error occurred, the device was active or idle.

  After command completion occurred, registers were:
  ER -- ST COUNT  LBA_48  LH LM LL DV DC
  -- -- -- == -- == == == -- -- -- -- --
  40 -- 51 00 08 00 00 1b 55 ce ec e0 00  Error: UNC 8 sectors at LBA = 0x1b55ceec = 458608364

  Commands leading to the command that caused the error were:
  CR FEATR COUNT  LBA_48  LH LM LL DV DC  Powered_Up_Time  Command/Feature_Name
  -- == -- == -- == == == -- -- -- -- --  ---------------  --------------------
  25 00 00 00 08 00 00 1b 55 ce e8 e0 08     12:53:48.543  READ DMA EXT
  25 00 00 00 08 00 00 1b 55 ce e0 e0 08     12:53:48.542  READ DMA EXT
  25 00 00 00 08 00 00 1b 55 ce d8 e0 08     12:53:48.542  READ DMA EXT
  25 00 00 00 08 00 00 1b 55 ce d0 e0 08     12:53:48.542  READ DMA EXT
  25 00 00 00 08 00 00 1b 55 ce c8 e0 08     12:53:48.541  READ DMA EXT

Error 227 [10] occurred at disk power-on lifetime: 21905 hours (912 days + 17 hours)
  When the command that caused the error occurred, the device was active or idle.

  After command completion occurred, registers were:
  ER -- ST COUNT  LBA_48  LH LM LL DV DC
  -- -- -- == -- == == == -- -- -- -- --
  40 -- 51 01 00 00 00 1b 55 ce ec e0 00  Error: UNC 256 sectors at LBA = 0x1b55ceec = 458608364

  Commands leading to the command that caused the error were:
  CR FEATR COUNT  LBA_48  LH LM LL DV DC  Powered_Up_Time  Command/Feature_Name
  -- == -- == -- == == == -- -- -- -- --  ---------------  --------------------
  25 00 00 01 00 00 00 1b 55 ce 50 e0 08     12:53:46.306  READ DMA EXT
  25 00 00 01 00 00 00 1b 55 cd 50 e0 08     12:53:45.140  READ DMA EXT
  25 00 00 01 00 00 00 1b 55 cc 50 e0 08     12:53:44.061  READ DMA EXT
  25 00 00 01 00 00 00 1b 55 cb 50 e0 08     12:53:43.186  READ DMA EXT
  25 00 00 01 00 00 00 1b 55 ca 50 e0 08     12:53:42.102  READ DMA EXT

SMART Extended Self-test Log Version: 1 (1 sectors)
Num  Test_Description    Status                  Remaining  LifeTime(hours)  LBA_of_first_error
# 1  Short offline       Completed: read failure       90%     21234         441890121
# 2  Conveyance offline  Completed: read failure       90%     21059         441890121
# 3  Short offline       Completed: read failure       90%     21059         441890133
# 4  Short offline       Completed without error       00%     20264         -
# 5  Short offline       Aborted by host               90%     20056         -
# 6  Short offline       Completed: read failure       90%     19852         67005434
# 7  Short offline       Completed: read failure       90%     19852         255726819
# 8  Conveyance offline  Completed: read failure       90%     19852         67005434
# 9  Extended offline    Completed: read failure       90%     19852         255726819
#10  Short offline       Completed: read failure       90%     19852         67005434
#11  Short offline       Completed: read failure       90%     19852         255726819

SMART Selective self-test log data structure revision number 1
 SPAN  MIN_LBA  MAX_LBA  CURRENT_TEST_STATUS
    1        0        0  Not_testing
    2        0        0  Not_testing
    3        0        0  Not_testing
    4        0        0  Not_testing
    5        0        0  Not_testing
Selective self-test flags (0x0):
  After scanning selected spans, do NOT read-scan remainder of disk.
If Selective self-test is pending on power-up, resume after 0 minute delay.

SCT Status Version:                  3
SCT Version (vendor specific):       258 (0x0102)
SCT Support Level:                   1
Device State:                        Active (0)
Current Temperature:                    36 Celsius
Power Cycle Min/Max Temperature:     23/36 Celsius
Lifetime    Min/Max Temperature:      0/45 Celsius
Under/Over Temperature Limit Count:   0/0

SCT Temperature History Version:     2
Temperature Sampling Period:         1 minute
Temperature Logging Interval:        1 minute
Min/Max recommended Temperature:      0/60 Celsius
Min/Max Temperature Limit:           -41/85 Celsius
Temperature History Size (Index):    478 (365)

Index    Estimated Time   Temperature Celsius
 366    2016-08-19 07:21    35  ****************
 ...    ..( 30 skipped).    ..  ****************
 397    2016-08-19 07:52    35  ****************
 398    2016-08-19 07:53    34  ***************
 399    2016-08-19 07:54    35  ****************
 400    2016-08-19 07:55    34  ***************
 401    2016-08-19 07:56    35  ****************
 402    2016-08-19 07:57    34  ***************
 ...    ..( 18 skipped).    ..  ***************
 421    2016-08-19 08:16    34  ***************
 422    2016-08-19 08:17    35  ****************
 423    2016-08-19 08:18    35  ****************
 424    2016-08-19 08:19    35  ****************
 425    2016-08-19 08:20    34  ***************
 426    2016-08-19 08:21    34  ***************
 427    2016-08-19 08:22    34  ***************
 428    2016-08-19 08:23    35  ****************
 429    2016-08-19 08:24    34  ***************
 430    2016-08-19 08:25    34  ***************
 431    2016-08-19 08:26    35  ****************
 432    2016-08-19 08:27    35  ****************
 433    2016-08-19 08:28    34  ***************
 434    2016-08-19 08:29    35  ****************
 ...    ..(101 skipped).    ..  ****************
  58    2016-08-19 10:11    35  ****************
  59    2016-08-19 10:12    36  *****************
 ...    ..( 21 skipped).    ..  *****************
  81    2016-08-19 10:34    36  *****************
  82    2016-08-19 10:35    34  ***************
 ...    ..( 10 skipped).    ..  ***************
  93    2016-08-19 10:46    34  ***************
  94    2016-08-19 10:47    33  **************
 ...    ..( 43 skipped).    ..  **************
 138    2016-08-19 11:31    33  **************
 139    2016-08-19 11:32    34  ***************
 140    2016-08-19 11:33    34  ***************
 141    2016-08-19 11:34    33  **************
 142    2016-08-19 11:35    34  ***************
 143    2016-08-19 11:36    34  ***************
 144    2016-08-19 11:37    33  **************
 ...    ..(  5 skipped).    ..  **************
 150    2016-08-19 11:43    33  **************
 151    2016-08-19 11:44     ?  -
 152    2016-08-19 11:45    23  ****
 153    2016-08-19 11:46    24  *****
 154    2016-08-19 11:47    25  ******
 155    2016-08-19 11:48    25  ******
 156    2016-08-19 11:49    26  *******
 157    2016-08-19 11:50    26  *******
 158    2016-08-19 11:51    27  ********
 159    2016-08-19 11:52    28  *********
 160    2016-08-19 11:53    29  **********
 ...    ..(  3 skipped).    ..  **********
 164    2016-08-19 11:57    29  **********
 165    2016-08-19 11:58    30  ***********
 166    2016-08-19 11:59    30  ***********
 167    2016-08-19 12:00    31  ************
 ...    ..(  2 skipped).    ..  ************
 170    2016-08-19 12:03    31  ************
 171    2016-08-19 12:04    32  *************
 ...    ..(  9 skipped).    ..  *************
 181    2016-08-19 12:14    32  *************
 182    2016-08-19 12:15    33  **************
 ...    ..(  8 skipped).    ..  **************
 191    2016-08-19 12:24    33  **************
 192    2016-08-19 12:25    34  ***************
 193    2016-08-19 12:26    34  ***************
 194    2016-08-19 12:27    33  **************
 195    2016-08-19 12:28    34  ***************
 ...    ..(  8 skipped).    ..  ***************
 204    2016-08-19 12:37    34  ***************
 205    2016-08-19 12:38    33  **************
 ...    ..( 64 skipped).    ..  **************
 270    2016-08-19 13:43    33  **************
 271    2016-08-19 13:44    34  ***************
 272    2016-08-19 13:45    33  **************
 273    2016-08-19 13:46    34  ***************
 274    2016-08-19 13:47    33  **************
 275    2016-08-19 13:48    33  **************
 276    2016-08-19 13:49    34  ***************
 ...    ..( 30 skipped).    ..  ***************
 307    2016-08-19 14:20    34  ***************
 308    2016-08-19 14:21    35  ****************
 309    2016-08-19 14:22    34  ***************
 ...    ..( 17 skipped).    ..  ***************
 327    2016-08-19 14:40    34  ***************
 328    2016-08-19 14:41    35  ****************
 329    2016-08-19 14:42    34  ***************
 ...    ..(  4 skipped).    ..  ***************
 334    2016-08-19 14:47    34  ***************
 335    2016-08-19 14:48    35  ****************
 336    2016-08-19 14:49    35  ****************
 337    2016-08-19 14:50    34  ***************
 338    2016-08-19 14:51    35  ****************
 339    2016-08-19 14:52    35  ****************
 340    2016-08-19 14:53    34  ***************
 ...    ..(  2 skipped).    ..  ***************
 343    2016-08-19 14:56    34  ***************
 344    2016-08-19 14:57    35  ****************
 ...    ..( 20 skipped).    ..  ****************
 365    2016-08-19 15:18    35  ****************

SCT Error Recovery Control command not supported

Device Statistics (GP/SMART Log 0x04) not supported

SATA Phy Event Counters (GP Log 0x11)
ID      Size     Value  Description
0x0001  2            0  Command failed due to ICRC error
0x0002  2            0  R_ERR response for data FIS
0x0003  2            0  R_ERR response for device-to-host data FIS
0x0004  2            0  R_ERR response for host-to-device data FIS
0x0005  2            0  R_ERR response for non-data FIS
0x0006  2            0  R_ERR response for device-to-host non-data FIS
0x0007  2            0  R_ERR response for host-to-device non-data FIS
0x000a  2            8  Device-to-host register FISes sent due to a COMRESET
0x000b  2            0  CRC errors within host-to-device FIS
0x8000  4        24729  Vendor specific