/dev/sda
=== START OF INFORMATION SECTION ===
Device Model:     HDS721025CLA382      39M4511 42C0463IBM
Serial Number:    --
LU WWN Device Id: 5 000cca ...
Firmware Version: JP1OA3GE
User Capacity:    160,041,885,696 bytes [160 GB]
Sector Size:      512 bytes logical/physical
Rotation Rate:    7200 rpm
Form Factor:      3.5 inches
Device is:        Not in smartctl database [for details use: -P showall]
ATA Version is:   ATA8-ACS T13/1699-D revision 4
SATA Version is:  SATA 2.6, 3.0 Gb/s
Local Time is:    Sat Oct 26 17:01:57 2019 MSK
SMART support is: Available - device has SMART capability.
SMART support is: Enabled
AAM feature is:   Unavailable
APM feature is:   Disabled
Rd look-ahead is: Enabled
Write cache is:   Enabled
DSN feature is:   Unavailable
ATA Security is:  Disabled, NOT FROZEN [SEC1]
Wt Cache Reorder: Enabled

=== START OF READ SMART DATA SECTION ===
SMART overall-health self-assessment test result: PASSED

General SMART Values:
Offline data collection status:  (0x80)	Offline data collection activity
					was never started.
					Auto Offline Data Collection: Enabled.
Self-test execution status:      (   0)	The previous self-test routine completed
					without error or no self-test has ever 
					been run.
Total time to complete Offline 
data collection: 		( 1485) seconds.
Offline data collection
capabilities: 			 (0x5b) SMART execute Offline immediate.
					Auto Offline data collection on/off support.
					Suspend Offline collection upon new
					command.
					Offline surface scan supported.
					Self-test supported.
					No Conveyance Self-test supported.
					Selective Self-test supported.
SMART capabilities:            (0x0003)	Saves SMART data before entering
					power-saving mode.
					Supports SMART auto save timer.
Error logging capability:        (0x01)	Error logging supported.
					General Purpose Logging supported.
Short self-test routine 
recommended polling time: 	 (   1) minutes.
Extended self-test routine
recommended polling time: 	 (  25) minutes.
SCT capabilities: 	       (0x003d)	SCT Status supported.
					SCT Error Recovery Control supported.
					SCT Feature Control supported.
					SCT Data Table supported.

SMART Attributes Data Structure revision number: 16
Vendor Specific SMART Attributes with Thresholds:
ID# ATTRIBUTE_NAME          FLAGS    VALUE WORST THRESH FAIL RAW_VALUE
  1 Raw_Read_Error_Rate     PO-R--   084   084   016    -    19267689
  2 Throughput_Performance  P-S---   136   136   054    -    94
  3 Spin_Up_Time            POS---   120   120   024    -    190 (Average 192)
  4 Start_Stop_Count        -O--C-   100   100   000    -    355
  5 Reallocated_Sector_Ct   PO--CK   100   100   005    -    108
  7 Seek_Error_Rate         PO-R--   100   100   067    -    0
  8 Seek_Time_Performance   P-S---   138   138   020    -    31
  9 Power_On_Hours          -O--C-   092   092   000    -    62758
 10 Spin_Retry_Count        PO--C-   100   100   060    -    0
 12 Power_Cycle_Count       -O--CK   100   100   000    -    352
187 Reported_Uncorrect      -O--CK   100   100   000    -    0
192 Power-Off_Retract_Count -O--CK   100   100   000    -    1007
193 Load_Cycle_Count        -O--C-   100   100   000    -    1007
194 Temperature_Celsius     -O----   130   130   000    -    46 (Min/Max 15/49)
196 Reallocated_Event_Count -O--CK   100   100   000    -    129
197 Current_Pending_Sector  -O---K   100   100   000    -    0
198 Offline_Uncorrectable   ---R--   100   100   000    -    0
199 UDMA_CRC_Error_Count    -O-R--   200   200   000    -    0
200 Multi_Zone_Error_Rate   -O--CK   100   100   000    -    0
201 Soft_Read_Error_Rate    -O-R--   100   100   000    -    0
202 Data_Address_Mark_Errs  -O-R--   100   100   000    -    0
220 Disk_Shift              -O----   100   100   000    -    3575
                            ||||||_ K auto-keep
                            |||||__ C event count
                            ||||___ R error rate
                            |||____ S speed/performance
                            ||_____ O updated online
                            |______ P prefailure warning

General Purpose Log Directory Version 1
SMART           Log Directory Version 1 [multi-sector log support]
Address    Access  R/W   Size  Description
0x00       GPL,SL  R/O      1  Log Directory
0x01           SL  R/O      1  Summary SMART error log
0x03       GPL     R/O     25  Ext. Comprehensive SMART error log
0x04       GPL     R/O      7  Device Statistics log
0x06           SL  R/O      1  SMART self-test log
0x07       GPL     R/O      1  Extended self-test log
0x09           SL  R/W      1  Selective self-test log
0x10       GPL     R/O      1  NCQ Command Error log
0x11       GPL     R/O      1  SATA Phy Event Counters log
0x20       GPL     R/O      1  Streaming performance log [OBS-8]
0x21       GPL     R/O      1  Write stream error log
0x22       GPL     R/O      1  Read stream error log
0x24       GPL     R/O     63  Current Device Internal Status Data log
0x80       GPL     R/W     63  Host vendor specific log
0x81-0x9f  GPL,SL  R/W     16  Host vendor specific log
0xb0       GPL,SL  VS       1  Device vendor specific log
0xb1       GPL     VS     256  Device vendor specific log
0xe0       GPL,SL  R/W      1  SCT Command/Status
0xe1       GPL,SL  R/W      1  SCT Data Transfer

Warning! SMART Extended Comprehensive Error Log Structure error: invalid SMART checksum.
SMART Extended Comprehensive Error Log Version: 2 (25 sectors)
No Errors Logged

SMART Extended Self-test Log Version: 1 (1 sectors)
Num  Test_Description    Status                  Remaining  LifeTime(hours)  LBA_of_first_error
# 1  Extended offline    Interrupted (host reset)      50%     62714         -

SMART Selective self-test log data structure revision number 1
 SPAN  MIN_LBA  MAX_LBA  CURRENT_TEST_STATUS
    1        0        0  Not_testing
    2        0        0  Not_testing
    3        0        0  Not_testing
    4        0        0  Not_testing
    5        0        0  Not_testing
Selective self-test flags (0x0):
  After scanning selected spans, do NOT read-scan remainder of disk.
If Selective self-test is pending on power-up, resume after 0 minute delay.

SCT Status Version:                  3
SCT Version (vendor specific):       256 (0x0100)
SCT Support Level:                   1
Device State:                        Active (0)
Current Temperature:                    46 Celsius
Power Cycle Min/Max Temperature:     39/46 Celsius
Lifetime    Min/Max Temperature:     15/49 Celsius
Under/Over Temperature Limit Count:   0/0

SCT Temperature History Version:     2
Temperature Sampling Period:         1 minute
Temperature Logging Interval:        1 minute
Min/Max recommended Temperature:      0/60 Celsius
Min/Max Temperature Limit:           -40/70 Celsius
Temperature History Size (Index):    128 (93)

Index    Estimated Time   Temperature Celsius
  94    2019-10-26 14:54    40  *********************
  95    2019-10-26 14:55    41  **********************
  96    2019-10-26 14:56    42  ***********************
  97    2019-10-26 14:57    42  ***********************
  98    2019-10-26 14:58    41  **********************
 ...    ..(  3 skipped).    ..  **********************
 102    2019-10-26 15:02    41  **********************
 103    2019-10-26 15:03    42  ***********************
 ...    ..(  2 skipped).    ..  ***********************
 106    2019-10-26 15:06    42  ***********************
 107    2019-10-26 15:07    43  ************************
 ...    ..(  5 skipped).    ..  ************************
 113    2019-10-26 15:13    43  ************************
 114    2019-10-26 15:14    44  *************************
 115    2019-10-26 15:15    44  *************************
 116    2019-10-26 15:16    44  *************************
 117    2019-10-26 15:17    45  **************************
 ...    ..(  5 skipped).    ..  **************************
 123    2019-10-26 15:23    45  **************************
 124    2019-10-26 15:24    46  ***************************
 125    2019-10-26 15:25    45  **************************
 126    2019-10-26 15:26    45  **************************
 127    2019-10-26 15:27    46  ***************************
 ...    ..( 11 skipped).    ..  ***************************
  11    2019-10-26 15:39    46  ***************************
  12    2019-10-26 15:40    45  **************************
 ...    ..(  3 skipped).    ..  **************************
  16    2019-10-26 15:44    45  **************************
  17    2019-10-26 15:45    44  *************************
 ...    ..(  6 skipped).    ..  *************************
  24    2019-10-26 15:52    44  *************************
  25    2019-10-26 15:53    43  ************************
 ...    ..( 16 skipped).    ..  ************************
  42    2019-10-26 16:10    43  ************************
  43    2019-10-26 16:11    42  ***********************
 ...    ..( 25 skipped).    ..  ***********************
  69    2019-10-26 16:37    42  ***********************
  70    2019-10-26 16:38    43  ************************
 ...    ..(  4 skipped).    ..  ************************
  75    2019-10-26 16:43    43  ************************
  76    2019-10-26 16:44    44  *************************
 ...    ..(  4 skipped).    ..  *************************
  81    2019-10-26 16:49    44  *************************
  82    2019-10-26 16:50    45  **************************
 ...    ..(  7 skipped).    ..  **************************
  90    2019-10-26 16:58    45  **************************
  91    2019-10-26 16:59    46  ***************************
  92    2019-10-26 17:00    46  ***************************
  93    2019-10-26 17:01    46  ***************************

SCT Error Recovery Control:
           Read: Disabled
          Write: Disabled

Device Statistics (GP Log 0x04)
Page  Offset Size        Value Flags Description
0x01  =====  =               =  ===  == General Statistics (rev 1) ==
0x01  0x008  4             352  ---  Lifetime Power-On Resets
0x01  0x010  4           62758  ---  Power-on Hours
0x01  0x018  6     16759399741  ---  Logical Sectors Written
0x01  0x020  6       707411478  ---  Number of Write Commands
0x01  0x028  6    121701457613  ---  Logical Sectors Read
0x01  0x030  6       416574967  ---  Number of Read Commands
0x03  =====  =               =  ===  == Rotating Media Statistics (rev 1) ==
0x03  0x008  4           62705  ---  Spindle Motor Power-on Hours
0x03  0x010  4           62705  ---  Head Flying Hours
0x03  0x018  4            1007  ---  Head Load Events
0x03  0x020  4             108  ---  Number of Reallocated Logical Sectors
0x03  0x028  4             388  ---  Read Recovery Attempts
0x03  0x030  4               2  ---  Number of Mechanical Start Failures
0x04  =====  =               =  ===  == General Errors Statistics (rev 1) ==
0x04  0x008  4               0  ---  Number of Reported Uncorrectable Errors
0x04  0x010  4            7689  ---  Resets Between Cmd Acceptance and Completion
0x05  =====  =               =  ===  == Temperature Statistics (rev 1) ==
0x05  0x008  1              46  ---  Current Temperature
0x05  0x010  1              41  N--  Average Short Term Temperature
0x05  0x018  1              36  N--  Average Long Term Temperature
0x05  0x020  1              49  ---  Highest Temperature
0x05  0x028  1              15  ---  Lowest Temperature
0x05  0x030  1              43  N--  Highest Average Short Term Temperature
0x05  0x038  1               0  N--  Lowest Average Short Term Temperature
0x05  0x040  1              40  N--  Highest Average Long Term Temperature
0x05  0x048  1               0  N--  Lowest Average Long Term Temperature
0x05  0x050  4               0  ---  Time in Over-Temperature
0x05  0x058  1              60  ---  Specified Maximum Operating Temperature
0x05  0x060  4               0  ---  Time in Under-Temperature
0x05  0x068  1               0  ---  Specified Minimum Operating Temperature
0x06  =====  =               =  ===  == Transport Statistics (rev 1) ==
0x06  0x008  4            7508  ---  Number of Hardware Resets
0x06  0x010  4            6643  ---  Number of ASR Events
0x06  0x018  4               0  ---  Number of Interface CRC Errors
                                |||_ C monitored condition met
                                ||__ D supports DSN
                                |___ N normalized value

Pending Defects log (GP Log 0x0c) not supported

SATA Phy Event Counters (GP Log 0x11)
ID      Size     Value  Description
0x0001  2            0  Command failed due to ICRC error
0x0002  2            0  R_ERR response for data FIS
0x0005  2            0  R_ERR response for non-data FIS
0x0009  2            3  Transition from drive PhyRdy to drive PhyNRdy
0x000a  2            3  Device-to-host register FISes sent due to a COMRESET
0x000b  2            0  CRC errors within host-to-device FIS
0x000d  2            0  Non-CRC errors within host-to-device FIS
