/dev/sda
=== START OF INFORMATION SECTION ===
Device Model:     SAMSUNG MZNTD256HAGL-00000
Serial Number:    --
LU WWN Device Id: 5 002538 ...
Firmware Version: DXT2400Q
User Capacity:    256,060,514,304 bytes [256 GB]
Sector Size:      512 bytes logical/physical
Rotation Rate:    Solid State Device
Device is:        Not in smartctl database [for details use: -P showall]
ATA Version is:   ACS-2, ATA8-ACS T13/1699-D revision 4c
SATA Version is:  SATA 3.1, 6.0 Gb/s (current: 6.0 Gb/s)
Local Time is:    Tue Sep 18 23:20:32 2018 -03
SMART support is: Available - device has SMART capability.
SMART support is: Enabled
AAM feature is:   Unavailable
APM feature is:   Unavailable
Rd look-ahead is: Enabled
Write cache is:   Enabled
DSN feature is:   Unavailable
ATA Security is:  Disabled, frozen [SEC2]
Wt Cache Reorder: Enabled

=== START OF READ SMART DATA SECTION ===
SMART overall-health self-assessment test result: PASSED

General SMART Values:
Offline data collection status:  (0x00) Offline data collection activity
          was never started.
          Auto Offline Data Collection: Disabled.
Self-test execution status:      (   0) The previous self-test routine completed
          without error or no self-test has ever 
          been run.
Total time to complete Offline 
data collection:    (53956) seconds.
Offline data collection
capabilities:        (0x53) SMART execute Offline immediate.
          Auto Offline data collection on/off support.
          Suspend Offline collection upon new
          command.
          No Offline surface scan supported.
          Self-test supported.
          No Conveyance Self-test supported.
          Selective Self-test supported.
SMART capabilities:            (0x0003) Saves SMART data before entering
          power-saving mode.
          Supports SMART auto save timer.
Error logging capability:        (0x01) Error logging supported.
          General Purpose Logging supported.
Short self-test routine 
recommended polling time:    (   2) minutes.
Extended self-test routine
recommended polling time:    (  40) minutes.
SCT capabilities:          (0x003d) SCT Status supported.
          SCT Error Recovery Control supported.
          SCT Feature Control supported.
          SCT Data Table supported.

SMART Attributes Data Structure revision number: 1
Vendor Specific SMART Attributes with Thresholds:
ID# ATTRIBUTE_NAME          FLAGS    VALUE WORST THRESH FAIL RAW_VALUE
  5 Reallocated_Sector_Ct   PO--CK   100   100   010    -    0
  9 Power_On_Hours          -O--CK   099   099   000    -    4704
 12 Power_Cycle_Count       -O--CK   096   096   000    -    3111
177 Wear_Leveling_Count     PO--C-   095   095   000    -    58
179 Used_Rsvd_Blk_Cnt_Tot   PO--C-   100   100   010    -    0
181 Program_Fail_Cnt_Total  -O--CK   100   100   010    -    0
182 Erase_Fail_Count_Total  -O--CK   100   100   010    -    0
183 Runtime_Bad_Block       PO--C-   100   100   010    -    0
187 Reported_Uncorrect      -O--CK   100   100   000    -    0
190 Airflow_Temperature_Cel -O--CK   066   044   000    -    34
195 Hardware_ECC_Recovered  -O-RC-   200   200   000    -    0
199 UDMA_CRC_Error_Count    -OSRCK   100   100   000    -    0
235 Unknown_Attribute       -O--C-   099   099   000    -    234
241 Total_LBAs_Written      -O--CK   099   099   000    -    14280680076
                            ||||||_ K auto-keep
                            |||||__ C event count
                            ||||___ R error rate
                            |||____ S speed/performance
                            ||_____ O updated online
                            |______ P prefailure warning

General Purpose Log Directory Version 1
SMART           Log Directory Version 1 [multi-sector log support]
Address    Access  R/W   Size  Description
0x00       GPL,SL  R/O      1  Log Directory
0x01       GPL,SL  R/O      1  Summary SMART error log
0x02       GPL,SL  R/O      1  Comprehensive SMART error log
0x03       GPL,SL  R/O      1  Ext. Comprehensive SMART error log
0x06       GPL,SL  R/O      1  SMART self-test log
0x07       GPL,SL  R/O      1  Extended self-test log
0x09       GPL,SL  R/W      1  Selective self-test log
0x10       GPL,SL  R/O      1  NCQ Command Error log
0x11       GPL,SL  R/O      1  SATA Phy Event Counters log
0x30       GPL,SL  R/O      1  IDENTIFY DEVICE data log
0x80-0x9f  GPL,SL  R/W     16  Host vendor specific log
0xa0       GPL,SL  VS      16  Device vendor specific log

SMART Extended Comprehensive Error Log Version: 1 (1 sectors)
No Errors Logged

SMART Extended Self-test Log Version: 1 (1 sectors)
No self-tests have been logged.  [To run self-tests, use: smartctl -t]

SMART Selective self-test log data structure revision number 1
 SPAN  MIN_LBA  MAX_LBA  CURRENT_TEST_STATUS
    1        0        0  Not_testing
    2        0        0  Not_testing
    3        0        0  Not_testing
    4        0        0  Not_testing
    5        0        0  Not_testing
  255        0    65535  Read_scanning was never started
Selective self-test flags (0x0):
  After scanning selected spans, do NOT read-scan remainder of disk.
If Selective self-test is pending on power-up, resume after 0 minute delay.

SCT Status Version:                  3
SCT Version (vendor specific):       256 (0x0100)
SCT Support Level:                   1
Device State:                        SCT command executing in background (5)
Current Temperature:                    35 Celsius
Power Cycle Min/Max Temperature:     33/40 Celsius
Lifetime    Min/Max Temperature:      0/70 Celsius
Under/Over Temperature Limit Count:   0/0

SCT Temperature History Version:     3 (Unknown, should be 2)
Temperature Sampling Period:         1 minute
Temperature Logging Interval:        1 minute
Min/Max recommended Temperature:      0/70 Celsius
Min/Max Temperature Limit:            0/70 Celsius
Temperature History Size (Index):    128 (23)

Index    Estimated Time   Temperature Celsius
  24    2018-09-18 21:13     ?  -
 ...    ..(102 skipped).    ..  -
 127    2018-09-18 22:56     ?  -
   0    2018-09-18 22:57    40  *********************
   1    2018-09-18 22:58    33  **************
   2    2018-09-18 22:59    33  **************
   3    2018-09-18 23:00    35  ****************
   4    2018-09-18 23:01    36  *****************
   5    2018-09-18 23:02    35  ****************
   6    2018-09-18 23:03    35  ****************
   7    2018-09-18 23:04    38  *******************
   8    2018-09-18 23:05    39  ********************
   9    2018-09-18 23:06    38  *******************
  10    2018-09-18 23:07    36  *****************
  11    2018-09-18 23:08    34  ***************
  12    2018-09-18 23:09    34  ***************
  13    2018-09-18 23:10    33  **************
  14    2018-09-18 23:11    35  ****************
  15    2018-09-18 23:12    36  *****************
  16    2018-09-18 23:13    36  *****************
  17    2018-09-18 23:14    36  *****************
  18    2018-09-18 23:15    37  ******************
  19    2018-09-18 23:16    36  *****************
  20    2018-09-18 23:17    37  ******************
  21    2018-09-18 23:18    34  ***************
  22    2018-09-18 23:19    34  ***************
  23    2018-09-18 23:20    35  ****************

SCT Error Recovery Control:
           Read: Disabled
          Write: Disabled

Device Statistics (GP/SMART Log 0x04) not supported

Pending Defects log (GP Log 0x0c) not supported

SATA Phy Event Counters (GP Log 0x11)
ID      Size     Value  Description
0x0001  2            0  Command failed due to ICRC error
0x0002  2            0  R_ERR response for data FIS
0x0003  2            0  R_ERR response for device-to-host data FIS
0x0004  2            0  R_ERR response for host-to-device data FIS
0x0005  2            0  R_ERR response for non-data FIS
0x0006  2            0  R_ERR response for device-to-host non-data FIS
0x0007  2            0  R_ERR response for host-to-device non-data FIS
0x0008  2            0  Device-to-host non-data FIS retries
0x0009  2        31283  Transition from drive PhyRdy to drive PhyNRdy
0x000a  2           18  Device-to-host register FISes sent due to a COMRESET
0x000b  2            0  CRC errors within host-to-device FIS
0x000d  2            0  Non-CRC errors within host-to-device FIS
0x000f  2            0  R_ERR response for host-to-device data FIS, CRC
0x0010  2            0  R_ERR response for host-to-device data FIS, non-CRC
0x0012  2            0  R_ERR response for host-to-device non-data FIS, CRC
0x0013  2            0  R_ERR response for host-to-device non-data FIS, non-CRC
