smartctl 6.6 2017-11-05 r4594 [x86_64-linux-4.19.0-6-amd64] (local build)
Copyright (C) 2002-17, Bruce Allen, Christian Franke, www.smartmontools.org

=== START OF INFORMATION SECTION ===
Device Model:     WDC WDS120G1G0A-00SS50
Serial Number:    172676440113
LU WWN Device Id: 5 001b44 4a9627200
Firmware Version: Z3311000
User Capacity:    120,034,123,776 bytes [120 GB]
Sector Size:      512 bytes logical/physical
Rotation Rate:    Solid State Device
Form Factor:      2.5 inches
Device is:        Not in smartctl database [for details use: -P showall]
ATA Version is:   ACS-2 T13/2015-D revision 3
SATA Version is:  SATA 3.2, 6.0 Gb/s (current: 6.0 Gb/s)
Local Time is:    Wed Dec  4 14:30:11 2019 CST
SMART support is: Available - device has SMART capability.
SMART support is: Enabled

=== START OF READ SMART DATA SECTION ===
SMART overall-health self-assessment test result: PASSED

General SMART Values:
Offline data collection status:  (0x00)	Offline data collection activity
					was never started.
					Auto Offline Data Collection: Disabled.
Self-test execution status:      (   0)	The previous self-test routine completed
					without error or no self-test has ever 
					been run.
Total time to complete Offline 
data collection: 		(  120) seconds.
Offline data collection
capabilities: 			 (0x11) SMART execute Offline immediate.
					No Auto Offline data collection support.
					Suspend Offline collection upon new
					command.
					No Offline surface scan supported.
					Self-test supported.
					No Conveyance Self-test supported.
					No Selective Self-test supported.
SMART capabilities:            (0x0003)	Saves SMART data before entering
					power-saving mode.
					Supports SMART auto save timer.
Error logging capability:        (0x01)	Error logging supported.
					General Purpose Logging supported.
Short self-test routine 
recommended polling time: 	 (   2) minutes.
Extended self-test routine
recommended polling time: 	 (  10) minutes.

SMART Attributes Data Structure revision number: 1
Vendor Specific SMART Attributes with Thresholds:
ID# ATTRIBUTE_NAME          FLAG     VALUE WORST THRESH TYPE      UPDATED  WHEN_FAILED RAW_VALUE
  5 Reallocated_Sector_Ct   0x0032   100   100   000    Old_age   Always       -       0
  9 Power_On_Hours          0x0032   000   100   000    Old_age   Always       -       1727
 12 Power_Cycle_Count       0x0032   100   100   000    Old_age   Always       -       383
165 Unknown_Attribute       0x0032   100   100   000    Old_age   Always       -       171839980016
166 Unknown_Attribute       0x0032   100   100   000    Old_age   Always       -       2
167 Unknown_Attribute       0x0032   100   100   000    Old_age   Always       -       0
168 Unknown_Attribute       0x0032   100   100   000    Old_age   Always       -       15
169 Unknown_Attribute       0x0032   100   100   000    Old_age   Always       -       0
170 Unknown_Attribute       0x0032   100   100   000    Old_age   Always       -       0
171 Unknown_Attribute       0x0032   100   100   000    Old_age   Always       -       0
172 Unknown_Attribute       0x0032   100   100   000    Old_age   Always       -       0
173 Unknown_Attribute       0x0032   100   100   000    Old_age   Always       -       7
174 Unknown_Attribute       0x0032   100   100   000    Old_age   Always       -       34
187 Reported_Uncorrect      0x0032   100   100   000    Old_age   Always       -       0
188 Command_Timeout         0x0032   100   100   000    Old_age   Always       -       0
194 Temperature_Celsius     0x0022   073   047   000    Old_age   Always       -       27 (Min/Max 0/53)
199 UDMA_CRC_Error_Count    0x0032   100   100   000    Old_age   Always       -       0
230 Unknown_SSD_Attribute   0x0032   100   100   000    Old_age   Always       -       708676354213
232 Available_Reservd_Space 0x0033   100   100   004    Pre-fail  Always       -       100
233 Media_Wearout_Indicator 0x0032   100   100   000    Old_age   Always       -       866
234 Unknown_Attribute       0x0032   100   100   000    Old_age   Always       -       2324
241 Total_LBAs_Written      0x0030   253   253   000    Old_age   Offline      -       1308
242 Total_LBAs_Read         0x0030   253   253   000    Old_age   Offline      -       1255
244 Unknown_Attribute       0x0032   000   100   000    Old_age   Always       -       0

SMART Error Log Version: 1
No Errors Logged

SMART Self-test log structure revision number 1
No self-tests have been logged.  [To run self-tests, use: smartctl -t]

Selective Self-tests/Logging not supported

