/dev/sda
=== START OF INFORMATION SECTION ===
Model Family:     Seagate Samsung SpinPoint M8 (AF)
Device Model:     ST1000LM024 HN-M101MBB
Serial Number:    --
LU WWN Device Id: 5 0004cf ...
Firmware Version: 2BA30001
User Capacity:    1,000,204,886,016 bytes [1.00 TB]
Sector Sizes:     512 bytes logical, 4096 bytes physical
Rotation Rate:    5400 rpm
Form Factor:      2.5 inches
Device is:        In smartctl database [for details use: -P show]
ATA Version is:   ATA8-ACS T13/1699-D revision 6
SATA Version is:  SATA 3.0, 6.0 Gb/s (current: 6.0 Gb/s)
Local Time is:    Sun Mar 31 15:08:41 2019 -03
SMART support is: Available - device has SMART capability.
SMART support is: Enabled
AAM feature is:   Disabled
APM feature is:   Disabled
Rd look-ahead is: Enabled
Write cache is:   Enabled
DSN feature is:   Unavailable
ATA Security is:  Disabled, NOT FROZEN [SEC1]
Wt Cache Reorder: Enabled

=== START OF READ SMART DATA SECTION ===
SMART overall-health self-assessment test result: PASSED

General SMART Values:
Offline data collection status:  (0x00)	Offline data collection activity
					was never started.
					Auto Offline Data Collection: Disabled.
Self-test execution status:      (   0)	The previous self-test routine completed
					without error or no self-test has ever 
					been run.
Total time to complete Offline 
data collection: 		(13500) seconds.
Offline data collection
capabilities: 			 (0x5b) SMART execute Offline immediate.
					Auto Offline data collection on/off support.
					Suspend Offline collection upon new
					command.
					Offline surface scan supported.
					Self-test supported.
					No Conveyance Self-test supported.
					Selective Self-test supported.
SMART capabilities:            (0x0003)	Saves SMART data before entering
					power-saving mode.
					Supports SMART auto save timer.
Error logging capability:        (0x01)	Error logging supported.
					General Purpose Logging supported.
Short self-test routine 
recommended polling time: 	 (   2) minutes.
Extended self-test routine
recommended polling time: 	 ( 225) minutes.
SCT capabilities: 	       (0x003f)	SCT Status supported.
					SCT Error Recovery Control supported.
					SCT Feature Control supported.
					SCT Data Table supported.

SMART Attributes Data Structure revision number: 16
Vendor Specific SMART Attributes with Thresholds:
ID# ATTRIBUTE_NAME          FLAGS    VALUE WORST THRESH FAIL RAW_VALUE
  1 Raw_Read_Error_Rate     POSR-K   100   100   051    -    4
  2 Throughput_Performance  -OS--K   252   252   000    -    0
  3 Spin_Up_Time            PO---K   092   087   025    -    2601
  4 Start_Stop_Count        -O--CK   097   097   000    -    3639
  5 Reallocated_Sector_Ct   PO--CK   252   252   010    -    0
  7 Seek_Error_Rate         -OSR-K   252   252   051    -    0
  8 Seek_Time_Performance   --S--K   252   252   015    -    0
  9 Power_On_Hours          -O--CK   100   100   000    -    8390
 10 Spin_Retry_Count        -O--CK   252   252   051    -    0
 11 Calibration_Retry_Count -O--CK   100   100   000    -    175
 12 Power_Cycle_Count       -O--CK   097   097   000    -    3494
191 G-Sense_Error_Rate      -O---K   100   100   000    -    13
192 Power-Off_Retract_Count -O---K   100   100   000    -    157
194 Temperature_Celsius     -O----   061   038   000    -    39 (Min/Max 13/62)
195 Hardware_ECC_Recovered  -O-RCK   100   100   000    -    0
196 Reallocated_Event_Count -O--CK   252   252   000    -    0
197 Current_Pending_Sector  -O--CK   252   252   000    -    0
198 Offline_Uncorrectable   ----CK   252   252   000    -    0
199 UDMA_CRC_Error_Count    -OS-CK   200   200   000    -    0
200 Multi_Zone_Error_Rate   -O-R-K   100   100   000    -    30440
223 Load_Retry_Count        -O--CK   100   100   000    -    175
225 Load_Cycle_Count        -O--CK   035   035   000    -    656630
                            ||||||_ K auto-keep
                            |||||__ C event count
                            ||||___ R error rate
                            |||____ S speed/performance
                            ||_____ O updated online
                            |______ P prefailure warning

General Purpose Log Directory Version 1
SMART           Log Directory Version 1 [multi-sector log support]
Address    Access  R/W   Size  Description
0x00       GPL,SL  R/O      1  Log Directory
0x01           SL  R/O      1  Summary SMART error log
0x02           SL  R/O      2  Comprehensive SMART error log
0x03       GPL     R/O      2  Ext. Comprehensive SMART error log
0x06           SL  R/O      1  SMART self-test log
0x07       GPL     R/O      2  Extended self-test log
0x08       GPL     R/O      2  Power Conditions log
0x09           SL  R/W      1  Selective self-test log
0x10       GPL     R/O      1  NCQ Command Error log
0x11       GPL     R/O      1  SATA Phy Event Counters log
0x80-0x9f  GPL,SL  R/W     16  Host vendor specific log
0xc0-0xdf  GPL,SL  VS      16  Device vendor specific log
0xe0       GPL,SL  R/W      1  SCT Command/Status
0xe1       GPL,SL  R/W      1  SCT Data Transfer

SMART Extended Comprehensive Error Log Version: 1 (2 sectors)
No Errors Logged

SMART Extended Self-test Log Version: 1 (2 sectors)
No self-tests have been logged.  [To run self-tests, use: smartctl -t]

SMART Selective self-test log data structure revision number 0
Note: revision number not 1 implies that no selective self-test has ever been run
 SPAN  MIN_LBA  MAX_LBA  CURRENT_TEST_STATUS
    1        0        0  Completed [00% left] (0-65535)
    2        0        0  Not_testing
    3        0        0  Not_testing
    4        0        0  Not_testing
    5        0        0  Not_testing
Selective self-test flags (0x0):
  After scanning selected spans, do NOT read-scan remainder of disk.
If Selective self-test is pending on power-up, resume after 0 minute delay.

SCT Status Version:                  2
SCT Version (vendor specific):       256 (0x0100)
SCT Support Level:                   1
Device State:                        Active (0)
Current Temperature:                    39 Celsius
Power Cycle Min/Max Temperature:     24/39 Celsius
Lifetime    Min/Max Temperature:     13/62 Celsius
Under/Over Temperature Limit Count:   0/0

SCT Temperature History Version:     2
Temperature Sampling Period:         5 minutes
Temperature Logging Interval:        5 minutes
Min/Max recommended Temperature:     -5/80 Celsius
Min/Max Temperature Limit:           -10/85 Celsius
Temperature History Size (Index):    128 (91)

Index    Estimated Time   Temperature Celsius
  92    2019-03-31 04:30    39  ********************
  93    2019-03-31 04:35    36  *****************
 ...    ..( 29 skipped).    ..  *****************
 123    2019-03-31 07:05    36  *****************
 124    2019-03-31 07:10    35  ****************
 125    2019-03-31 07:15    36  *****************
 ...    ..( 13 skipped).    ..  *****************
  11    2019-03-31 08:25    36  *****************
  12    2019-03-31 08:30    35  ****************
 ...    ..(  6 skipped).    ..  ****************
  19    2019-03-31 09:05    35  ****************
  20    2019-03-31 09:10    36  *****************
  21    2019-03-31 09:15    36  *****************
  22    2019-03-31 09:20    35  ****************
  23    2019-03-31 09:25    35  ****************
  24    2019-03-31 09:30    36  *****************
  25    2019-03-31 09:35    35  ****************
 ...    ..( 17 skipped).    ..  ****************
  43    2019-03-31 11:05    35  ****************
  44    2019-03-31 11:10    28  *********
  45    2019-03-31 11:15    31  ************
  46    2019-03-31 11:20    32  *************
  47    2019-03-31 11:25    33  **************
  48    2019-03-31 11:30    34  ***************
  49    2019-03-31 11:35    34  ***************
  50    2019-03-31 11:40    35  ****************
  51    2019-03-31 11:45    35  ****************
  52    2019-03-31 11:50    36  *****************
  53    2019-03-31 11:55    36  *****************
  54    2019-03-31 12:00    28  *********
  55    2019-03-31 12:05    31  ************
  56    2019-03-31 12:10    33  **************
  57    2019-03-31 12:15    34  ***************
  58    2019-03-31 12:20    34  ***************
  59    2019-03-31 12:25    28  *********
  60    2019-03-31 12:30    31  ************
  61    2019-03-31 12:35    32  *************
  62    2019-03-31 12:40    33  **************
  63    2019-03-31 12:45    34  ***************
  64    2019-03-31 12:50    28  *********
  65    2019-03-31 12:55    31  ************
  66    2019-03-31 13:00    32  *************
  67    2019-03-31 13:05    34  ***************
  68    2019-03-31 13:10    34  ***************
  69    2019-03-31 13:15    28  *********
  70    2019-03-31 13:20    30  ***********
  71    2019-03-31 13:25    32  *************
  72    2019-03-31 13:30    33  **************
  73    2019-03-31 13:35    34  ***************
  74    2019-03-31 13:40    35  ****************
  75    2019-03-31 13:45    35  ****************
  76    2019-03-31 13:50    36  *****************
  77    2019-03-31 13:55    36  *****************
  78    2019-03-31 14:00    37  ******************
  79    2019-03-31 14:05    37  ******************
  80    2019-03-31 14:10    38  *******************
  81    2019-03-31 14:15    38  *******************
  82    2019-03-31 14:20    38  *******************
  83    2019-03-31 14:25    39  ********************
 ...    ..(  7 skipped).    ..  ********************
  91    2019-03-31 15:05    39  ********************

SCT Error Recovery Control:
           Read: Disabled
          Write: Disabled

Device Statistics (GP/SMART Log 0x04) not supported

Pending Defects log (GP Log 0x0c) not supported

SATA Phy Event Counters (GP Log 0x11)
ID      Size     Value  Description
0x0001  4            0  Command failed due to ICRC error
0x0002  4            0  R_ERR response for data FIS
0x0003  4            0  R_ERR response for device-to-host data FIS
0x0004  4            0  R_ERR response for host-to-device data FIS
0x0005  4            0  R_ERR response for non-data FIS
0x0006  4            0  R_ERR response for device-to-host non-data FIS
0x0007  4            0  R_ERR response for host-to-device non-data FIS
0x0008  4            0  Device-to-host non-data FIS retries
0x0009  4         2585  Transition from drive PhyRdy to drive PhyNRdy
0x000a  4           12  Device-to-host register FISes sent due to a COMRESET
0x000b  4            0  CRC errors within host-to-device FIS
0x000d  4            0  Non-CRC errors within host-to-device FIS
0x000f  4            0  R_ERR response for host-to-device data FIS, CRC
0x0010  4            0  R_ERR response for host-to-device data FIS, non-CRC
0x0012  4            0  R_ERR response for host-to-device non-data FIS, CRC
0x0013  4            0  R_ERR response for host-to-device non-data FIS, non-CRC
0x8e00  4            0  Vendor specific
0x8e01  4            0  Vendor specific
0x8e02  4            0  Vendor specific
0x8e03  4            0  Vendor specific
0x8e04  4            0  Vendor specific
0x8e05  4            0  Vendor specific
0x8e06  4            0  Vendor specific
0x8e07  4            0  Vendor specific
0x8e08  4            0  Vendor specific
0x8e09  4            0  Vendor specific
0x8e0a  4            0  Vendor specific
0x8e0b  4            0  Vendor specific
0x8e0c  4            0  Vendor specific
0x8e0d  4            0  Vendor specific
0x8e0e  4            0  Vendor specific
0x8e0f  4            0  Vendor specific
0x8e10  4            0  Vendor specific
0x8e11  4            0  Vendor specific