/dev/sda
=== START OF INFORMATION SECTION ===
Model Family:     Western Digital Scorpio Blue Serial ATA
Device Model:     WDC WD2500BEVT-22A23T0
Serial Number:    --
LU WWN Device Id: 5 0014ee ...
Firmware Version: 01.01A01
User Capacity:    250 059 350 016 bytes [250 GB]
Sector Size:      512 bytes logical/physical
Rotation Rate:    5400 rpm
Device is:        In smartctl database [for details use: -P show]
ATA Version is:   ATA8-ACS (minor revision not indicated)
SATA Version is:  SATA 2.6, 3.0 Gb/s
Local Time is:    Thu Nov  2 17:56:07 2017 NOVT
SMART support is: Available - device has SMART capability.
SMART support is: Enabled
AAM feature is:   Disabled
APM level is:     96 (intermediate level with standby)
Rd look-ahead is: Enabled
Write cache is:   Enabled
ATA Security is:  Disabled, frozen [SEC2]
Wt Cache Reorder: Enabled

=== START OF READ SMART DATA SECTION ===
SMART overall-health self-assessment test result: PASSED

General SMART Values:
Offline data collection status:  (0x82)	Offline data collection activity
					was completed without error.
					Auto Offline Data Collection: Enabled.
Self-test execution status:      (   0)	The previous self-test routine completed
					without error or no self-test has ever 
					been run.
Total time to complete Offline 
data collection: 		( 7200) seconds.
Offline data collection
capabilities: 			 (0x7b) SMART execute Offline immediate.
					Auto Offline data collection on/off support.
					Suspend Offline collection upon new
					command.
					Offline surface scan supported.
					Self-test supported.
					Conveyance Self-test supported.
					Selective Self-test supported.
SMART capabilities:            (0x0003)	Saves SMART data before entering
					power-saving mode.
					Supports SMART auto save timer.
Error logging capability:        (0x01)	Error logging supported.
					General Purpose Logging supported.
Short self-test routine 
recommended polling time: 	 (   2) minutes.
Extended self-test routine
recommended polling time: 	 (  86) minutes.
Conveyance self-test routine
recommended polling time: 	 (   5) minutes.
SCT capabilities: 	       (0x7037)	SCT Status supported.
					SCT Feature Control supported.
					SCT Data Table supported.

SMART Attributes Data Structure revision number: 16
Vendor Specific SMART Attributes with Thresholds:
ID# ATTRIBUTE_NAME          FLAGS    VALUE WORST THRESH FAIL RAW_VALUE
  1 Raw_Read_Error_Rate     POSR-K   200   200   051    -    46
  3 Spin_Up_Time            POS--K   153   130   021    -    1333
  4 Start_Stop_Count        -O--CK   095   095   000    -    5868
  5 Reallocated_Sector_Ct   PO--CK   200   200   140    -    0
  7 Seek_Error_Rate         -OSR-K   200   200   000    -    0
  9 Power_On_Hours          -O--CK   082   082   000    -    13609
 10 Spin_Retry_Count        -O--CK   100   100   000    -    0
 11 Calibration_Retry_Count -O--CK   100   100   000    -    0
 12 Power_Cycle_Count       -O--CK   098   098   000    -    2189
191 G-Sense_Error_Rate      -O--CK   001   001   000    -    1522
192 Power-Off_Retract_Count -O--CK   200   200   000    -    126
193 Load_Cycle_Count        -O--CK   179   179   000    -    63114
194 Temperature_Celsius     -O---K   099   080   000    -    44
196 Reallocated_Event_Count -O--CK   200   200   000    -    0
197 Current_Pending_Sector  -O--CK   200   200   000    -    1
198 Offline_Uncorrectable   ----CK   200   200   000    -    1
199 UDMA_CRC_Error_Count    -O--CK   200   200   000    -    0
200 Multi_Zone_Error_Rate   ---R--   200   200   000    -    2
                            ||||||_ K auto-keep
                            |||||__ C event count
                            ||||___ R error rate
                            |||____ S speed/performance
                            ||_____ O updated online
                            |______ P prefailure warning

General Purpose Log Directory Version 1
SMART           Log Directory Version 1 [multi-sector log support]
Address    Access  R/W   Size  Description
0x00       GPL,SL  R/O      1  Log Directory
0x01           SL  R/O      1  Summary SMART error log
0x02           SL  R/O      5  Comprehensive SMART error log
0x03       GPL     R/O      6  Ext. Comprehensive SMART error log
0x06           SL  R/O      1  SMART self-test log
0x07       GPL     R/O      1  Extended self-test log
0x09           SL  R/W      1  Selective self-test log
0x10       GPL     R/O      1  SATA NCQ Queued Error log
0x11       GPL     R/O      1  SATA Phy Event Counters log
0x80-0x9f  GPL,SL  R/W     16  Host vendor specific log
0xa0-0xa7  GPL,SL  VS      16  Device vendor specific log
0xa8-0xb7  GPL,SL  VS       1  Device vendor specific log
0xc0       GPL,SL  VS       1  Device vendor specific log
0xc1       GPL     VS      24  Device vendor specific log
0xe0       GPL,SL  R/W      1  SCT Command/Status
0xe1       GPL,SL  R/W      1  SCT Data Transfer

SMART Extended Comprehensive Error Log Version: 1 (6 sectors)
Device Error Count: 23
	CR     = Command Register
	FEATR  = Features Register
	COUNT  = Count (was: Sector Count) Register
	LBA_48 = Upper bytes of LBA High/Mid/Low Registers ]  ATA-8
	LH     = LBA High (was: Cylinder High) Register    ]   LBA
	LM     = LBA Mid (was: Cylinder Low) Register      ] Register
	LL     = LBA Low (was: Sector Number) Register     ]
	DV     = Device (was: Device/Head) Register
	DC     = Device Control Register
	ER     = Error register
	ST     = Status register
Powered_Up_Time is measured from power on, and printed as
DDd+hh:mm:SS.sss where DD=days, hh=hours, mm=minutes,
SS=sec, and sss=millisec. It "wraps" after 49.710 days.

Error 23 [22] occurred at disk power-on lifetime: 13578 hours (565 days + 18 hours)
  When the command that caused the error occurred, the device was active or idle.

  After command completion occurred, registers were:
  ER -- ST COUNT  LBA_48  LH LM LL DV DC
  -- -- -- == -- == == == -- -- -- -- --
  40 -- 51 00 08 00 00 0b 69 96 7b 40 00  Error: UNC at LBA = 0x0b69967b = 191469179

  Commands leading to the command that caused the error were:
  CR FEATR COUNT  LBA_48  LH LM LL DV DC  Powered_Up_Time  Command/Feature_Name
  -- == -- == -- == == == -- -- -- -- --  ---------------  --------------------
  60 00 08 00 98 00 00 05 b2 51 88 40 00     00:50:45.043  READ FPDMA QUEUED
  60 00 08 00 90 00 00 0b 69 96 78 40 00     00:50:45.042  READ FPDMA QUEUED
  60 00 08 00 88 00 00 02 db d6 e0 40 00     00:50:45.042  READ FPDMA QUEUED
  61 00 08 00 80 00 00 02 03 6c e8 40 00     00:50:45.042  WRITE FPDMA QUEUED
  60 00 08 00 78 00 00 0c 9a 2d 40 40 00     00:50:45.022  READ FPDMA QUEUED

Error 22 [21] occurred at disk power-on lifetime: 13578 hours (565 days + 18 hours)
  When the command that caused the error occurred, the device was active or idle.

  After command completion occurred, registers were:
  ER -- ST COUNT  LBA_48  LH LM LL DV DC
  -- -- -- == -- == == == -- -- -- -- --
  40 -- 51 00 08 00 00 0b 69 96 7b 40 00  Error: UNC at LBA = 0x0b69967b = 191469179

  Commands leading to the command that caused the error were:
  CR FEATR COUNT  LBA_48  LH LM LL DV DC  Powered_Up_Time  Command/Feature_Name
  -- == -- == -- == == == -- -- -- -- --  ---------------  --------------------
  60 00 08 00 40 00 00 0b 69 96 78 40 00     00:50:41.933  READ FPDMA QUEUED
  61 00 08 00 38 00 00 02 01 28 00 40 00     00:50:41.933  WRITE FPDMA QUEUED
  60 00 70 00 30 00 00 14 ee 32 48 40 00     00:50:41.933  READ FPDMA QUEUED
  61 00 38 00 28 00 00 02 03 23 30 40 00     00:50:41.933  WRITE FPDMA QUEUED
  60 00 08 00 20 00 00 0c 9a 1e a0 40 00     00:50:41.913  READ FPDMA QUEUED

Error 21 [20] occurred at disk power-on lifetime: 13578 hours (565 days + 18 hours)
  When the command that caused the error occurred, the device was active or idle.

  After command completion occurred, registers were:
  ER -- ST COUNT  LBA_48  LH LM LL DV DC
  -- -- -- == -- == == == -- -- -- -- --
  40 -- 51 00 08 00 00 0b 69 96 7b 40 00  Error: UNC at LBA = 0x0b69967b = 191469179

  Commands leading to the command that caused the error were:
  CR FEATR COUNT  LBA_48  LH LM LL DV DC  Powered_Up_Time  Command/Feature_Name
  -- == -- == -- == == == -- -- -- -- --  ---------------  --------------------
  60 00 08 00 e0 00 00 04 11 76 20 40 00     00:50:38.792  READ FPDMA QUEUED
  61 00 08 00 d8 00 00 02 01 28 90 40 00     00:50:38.792  WRITE FPDMA QUEUED
  60 00 80 00 d0 00 00 15 04 0c f8 40 00     00:50:38.792  READ FPDMA QUEUED
  60 00 08 00 c8 00 00 0b 69 96 78 40 00     00:50:38.792  READ FPDMA QUEUED
  61 00 10 00 c0 00 00 02 01 28 08 40 00     00:50:38.792  WRITE FPDMA QUEUED

Error 20 [19] occurred at disk power-on lifetime: 13578 hours (565 days + 18 hours)
  When the command that caused the error occurred, the device was active or idle.

  After command completion occurred, registers were:
  ER -- ST COUNT  LBA_48  LH LM LL DV DC
  -- -- -- == -- == == == -- -- -- -- --
  40 -- 51 00 40 00 00 0b 69 96 7b 40 00  Error: UNC at LBA = 0x0b69967b = 191469179

  Commands leading to the command that caused the error were:
  CR FEATR COUNT  LBA_48  LH LM LL DV DC  Powered_Up_Time  Command/Feature_Name
  -- == -- == -- == == == -- -- -- -- --  ---------------  --------------------
  60 00 78 00 88 00 00 0c 01 3e 00 40 00     00:50:35.739  READ FPDMA QUEUED
  60 00 08 00 80 00 00 15 0d f5 b0 40 00     00:50:35.723  READ FPDMA QUEUED
  60 00 40 00 78 00 00 0b 69 96 78 40 00     00:50:35.720  READ FPDMA QUEUED
  60 00 48 00 70 00 00 10 a9 51 50 40 00     00:50:35.710  READ FPDMA QUEUED
  60 00 80 00 68 00 00 0b d7 f3 d0 40 00     00:50:35.695  READ FPDMA QUEUED

Error 19 [18] occurred at disk power-on lifetime: 13578 hours (565 days + 18 hours)
  When the command that caused the error occurred, the device was active or idle.

  After command completion occurred, registers were:
  ER -- ST COUNT  LBA_48  LH LM LL DV DC
  -- -- -- == -- == == == -- -- -- -- --
  40 -- 51 00 08 00 00 0b 69 96 7b 40 00  Error: UNC at LBA = 0x0b69967b = 191469179

  Commands leading to the command that caused the error were:
  CR FEATR COUNT  LBA_48  LH LM LL DV DC  Powered_Up_Time  Command/Feature_Name
  -- == -- == -- == == == -- -- -- -- --  ---------------  --------------------
  60 00 40 00 58 00 00 01 c4 cd 9a 40 00     00:50:31.729  READ FPDMA QUEUED
  60 00 08 00 50 00 00 1a ae e4 a8 40 00     00:50:31.707  READ FPDMA QUEUED
  60 00 80 00 48 00 00 14 f2 0b 70 40 00     00:50:31.671  READ FPDMA QUEUED
  60 00 08 00 40 00 00 14 ef ed 98 40 00     00:50:31.663  READ FPDMA QUEUED
  60 00 80 00 38 00 00 14 ee 32 b8 40 00     00:50:31.663  READ FPDMA QUEUED

Error 18 [17] occurred at disk power-on lifetime: 13578 hours (565 days + 18 hours)
  When the command that caused the error occurred, the device was active or idle.

  After command completion occurred, registers were:
  ER -- ST COUNT  LBA_48  LH LM LL DV DC
  -- -- -- == -- == == == -- -- -- -- --
  40 -- 51 00 08 00 00 0b 69 96 7b 40 00  Error: UNC at LBA = 0x0b69967b = 191469179

  Commands leading to the command that caused the error were:
  CR FEATR COUNT  LBA_48  LH LM LL DV DC  Powered_Up_Time  Command/Feature_Name
  -- == -- == -- == == == -- -- -- -- --  ---------------  --------------------
  60 00 08 00 80 00 00 0c 01 a5 88 40 00     00:50:28.474  READ FPDMA QUEUED
  60 00 08 00 78 00 00 05 42 ba 1a 40 00     00:50:28.462  READ FPDMA QUEUED
  61 00 08 00 70 00 00 02 01 27 f0 40 00     00:50:28.461  WRITE FPDMA QUEUED
  60 00 08 00 68 00 00 0b a5 21 fa 40 00     00:50:28.450  READ FPDMA QUEUED
  60 00 08 00 60 00 00 0b 69 96 78 40 00     00:50:28.450  READ FPDMA QUEUED

Error 17 [16] occurred at disk power-on lifetime: 13578 hours (565 days + 18 hours)
  When the command that caused the error occurred, the device was active or idle.

  After command completion occurred, registers were:
  ER -- ST COUNT  LBA_48  LH LM LL DV DC
  -- -- -- == -- == == == -- -- -- -- --
  40 -- 51 00 08 00 00 0b 69 96 7b 40 00  Error: UNC at LBA = 0x0b69967b = 191469179

  Commands leading to the command that caused the error were:
  CR FEATR COUNT  LBA_48  LH LM LL DV DC  Powered_Up_Time  Command/Feature_Name
  -- == -- == -- == == == -- -- -- -- --  ---------------  --------------------
  60 00 08 00 18 00 00 15 0d 7d e0 40 00     00:50:25.210  READ FPDMA QUEUED
  60 00 80 00 10 00 00 15 06 24 60 40 00     00:50:25.210  READ FPDMA QUEUED
  60 00 40 00 08 00 00 0b c8 9a da 40 00     00:50:25.210  READ FPDMA QUEUED
  60 00 20 00 f8 00 00 09 71 cd 32 40 00     00:50:25.210  READ FPDMA QUEUED
  60 00 08 00 f0 00 00 0b 69 96 78 40 00     00:50:25.210  READ FPDMA QUEUED

Error 16 [15] occurred at disk power-on lifetime: 13578 hours (565 days + 18 hours)
  When the command that caused the error occurred, the device was active or idle.

  After command completion occurred, registers were:
  ER -- ST COUNT  LBA_48  LH LM LL DV DC
  -- -- -- == -- == == == -- -- -- -- --
  40 -- 51 00 40 00 00 0b 69 96 7b 40 00  Error: UNC at LBA = 0x0b69967b = 191469179

  Commands leading to the command that caused the error were:
  CR FEATR COUNT  LBA_48  LH LM LL DV DC  Powered_Up_Time  Command/Feature_Name
  -- == -- == -- == == == -- -- -- -- --  ---------------  --------------------
  60 00 10 00 68 00 00 10 41 23 40 40 00     00:50:21.931  READ FPDMA QUEUED
  60 00 08 00 60 00 00 15 0d 6f d0 40 00     00:50:21.917  READ FPDMA QUEUED
  60 00 80 00 58 00 00 15 0c f6 78 40 00     00:50:21.917  READ FPDMA QUEUED
  60 00 20 00 50 00 00 09 72 3c 22 40 00     00:50:21.904  READ FPDMA QUEUED
  60 00 20 00 48 00 00 02 cf ae 7b 40 00     00:50:21.891  READ FPDMA QUEUED

SMART Extended Self-test Log Version: 1 (1 sectors)
No self-tests have been logged.  [To run self-tests, use: smartctl -t]

SMART Selective self-test log data structure revision number 1
 SPAN  MIN_LBA  MAX_LBA  CURRENT_TEST_STATUS
    1        0        0  Not_testing
    2        0        0  Not_testing
    3        0        0  Not_testing
    4        0        0  Not_testing
    5        0        0  Not_testing
Selective self-test flags (0x0):
  After scanning selected spans, do NOT read-scan remainder of disk.
If Selective self-test is pending on power-up, resume after 0 minute delay.

SCT Status Version:                  3
SCT Version (vendor specific):       258 (0x0102)
SCT Support Level:                   1
Device State:                        Active (0)
Current Temperature:                    44 Celsius
Power Cycle Min/Max Temperature:     27/44 Celsius
Lifetime    Min/Max Temperature:     26/65 Celsius
Under/Over Temperature Limit Count:   0/0
Vendor specific:
01 00 00 00 00 00 00 00 00 00 00 00 00 00 00 00
00 00 00 00 00 00 00 00 00 00 00 00 00 00 00 00

SCT Temperature History Version:     2
Temperature Sampling Period:         1 minute
Temperature Logging Interval:        1 minute
Min/Max recommended Temperature:      0/60 Celsius
Min/Max Temperature Limit:           -41/85 Celsius
Temperature History Size (Index):    128 (31)

Index    Estimated Time   Temperature Celsius
  32    2017-11-02 15:49    44  *************************
 ...    ..(  4 skipped).    ..  *************************
  37    2017-11-02 15:54    44  *************************
  38    2017-11-02 15:55    43  ************************
  39    2017-11-02 15:56    44  *************************
 ...    ..(  2 skipped).    ..  *************************
  42    2017-11-02 15:59    44  *************************
  43    2017-11-02 16:00    45  **************************
  44    2017-11-02 16:01    45  **************************
  45    2017-11-02 16:02    45  **************************
  46    2017-11-02 16:03    46  ***************************
 ...    ..(  2 skipped).    ..  ***************************
  49    2017-11-02 16:06    46  ***************************
  50    2017-11-02 16:07    47  ****************************
  51    2017-11-02 16:08    46  ***************************
  52    2017-11-02 16:09    46  ***************************
  53    2017-11-02 16:10    46  ***************************
  54    2017-11-02 16:11    47  ****************************
  55    2017-11-02 16:12    46  ***************************
  56    2017-11-02 16:13    47  ****************************
  57    2017-11-02 16:14    48  *****************************
  58    2017-11-02 16:15    47  ****************************
 ...    ..(  3 skipped).    ..  ****************************
  62    2017-11-02 16:19    47  ****************************
  63    2017-11-02 16:20    46  ***************************
 ...    ..(  4 skipped).    ..  ***************************
  68    2017-11-02 16:25    46  ***************************
  69    2017-11-02 16:26    45  **************************
 ...    ..(  6 skipped).    ..  **************************
  76    2017-11-02 16:33    45  **************************
  77    2017-11-02 16:34    44  *************************
  78    2017-11-02 16:35    45  **************************
  79    2017-11-02 16:36    44  *************************
  80    2017-11-02 16:37    45  **************************
  81    2017-11-02 16:38    44  *************************
  82    2017-11-02 16:39    45  **************************
 ...    ..(  9 skipped).    ..  **************************
  92    2017-11-02 16:49    45  **************************
  93    2017-11-02 16:50    46  ***************************
  94    2017-11-02 16:51    46  ***************************
  95    2017-11-02 16:52    45  **************************
  96    2017-11-02 16:53    46  ***************************
  97    2017-11-02 16:54    45  **************************
 ...    ..(  2 skipped).    ..  **************************
 100    2017-11-02 16:57    45  **************************
 101    2017-11-02 16:58    43  ************************
 102    2017-11-02 16:59    47  ****************************
 103    2017-11-02 17:00     ?  -
 104    2017-11-02 17:01    24  *****
 105    2017-11-02 17:02    26  *******
 106    2017-11-02 17:03     ?  -
 107    2017-11-02 17:04    27  ********
 108    2017-11-02 17:05     ?  -
 109    2017-11-02 17:06    27  ********
 110    2017-11-02 17:07    27  ********
 111    2017-11-02 17:08    27  ********
 112    2017-11-02 17:09    28  *********
 113    2017-11-02 17:10    28  *********
 114    2017-11-02 17:11    29  **********
 115    2017-11-02 17:12    29  **********
 116    2017-11-02 17:13    30  ***********
 117    2017-11-02 17:14    30  ***********
 118    2017-11-02 17:15     ?  -
 119    2017-11-02 17:16    31  ************
 120    2017-11-02 17:17    30  ***********
 121    2017-11-02 17:18    32  *************
 122    2017-11-02 17:19    33  **************
 123    2017-11-02 17:20    34  ***************
 124    2017-11-02 17:21    34  ***************
 125    2017-11-02 17:22    34  ***************
 126    2017-11-02 17:23    35  ****************
 127    2017-11-02 17:24    35  ****************
   0    2017-11-02 17:25    36  *****************
 ...    ..(  3 skipped).    ..  *****************
   4    2017-11-02 17:29    36  *****************
   5    2017-11-02 17:30    37  ******************
   6    2017-11-02 17:31    37  ******************
   7    2017-11-02 17:32    38  *******************
   8    2017-11-02 17:33    38  *******************
   9    2017-11-02 17:34    38  *******************
  10    2017-11-02 17:35    39  ********************
  11    2017-11-02 17:36    39  ********************
  12    2017-11-02 17:37    40  *********************
 ...    ..(  2 skipped).    ..  *********************
  15    2017-11-02 17:40    40  *********************
  16    2017-11-02 17:41    41  **********************
 ...    ..(  2 skipped).    ..  **********************
  19    2017-11-02 17:44    41  **********************
  20    2017-11-02 17:45    42  ***********************
  21    2017-11-02 17:46    41  **********************
  22    2017-11-02 17:47    42  ***********************
  23    2017-11-02 17:48    42  ***********************
  24    2017-11-02 17:49    43  ************************
  25    2017-11-02 17:50    42  ***********************
  26    2017-11-02 17:51    43  ************************
  27    2017-11-02 17:52    43  ************************
  28    2017-11-02 17:53    43  ************************
  29    2017-11-02 17:54    44  *************************
  30    2017-11-02 17:55     ?  -
  31    2017-11-02 17:56    44  *************************

SCT Error Recovery Control command not supported

Device Statistics (GP/SMART Log 0x04) not supported

SATA Phy Event Counters (GP Log 0x11)
ID      Size     Value  Description
0x0001  2            0  Command failed due to ICRC error
0x0002  2            0  R_ERR response for data FIS
0x0003  2            0  R_ERR response for device-to-host data FIS
0x0004  2            0  R_ERR response for host-to-device data FIS
0x0005  2            0  R_ERR response for non-data FIS
0x0006  2            0  R_ERR response for device-to-host non-data FIS
0x0007  2            0  R_ERR response for host-to-device non-data FIS
0x000a  2            1  Device-to-host register FISes sent due to a COMRESET
0x000b  2            0  CRC errors within host-to-device FIS
0x8000  4         2812  Vendor specific
