/dev/sda
=== START OF INFORMATION SECTION ===
Model Family:     Western Digital Scorpio Blue Serial ATA
Device Model:     WDC WD2500BEVS-22UST0
Serial Number:    --
LU WWN Device Id: 5 0014ee ...
Firmware Version: 01.01A01
User Capacity:    250 059 350 016 bytes [250 GB]
Sector Size:      512 bytes logical/physical
Device is:        In smartctl database [for details use: -P show]
ATA Version is:   ATA8-ACS (minor revision not indicated)
Local Time is:    Sat Dec  5 22:10:02 2015 MSK
SMART support is: Available - device has SMART capability.
SMART support is: Enabled
AAM feature is:   Disabled
APM level is:     128 (minimum power consumption without standby)
Rd look-ahead is: Enabled
Write cache is:   Enabled
ATA Security is:  Disabled, frozen [SEC2]
Wt Cache Reorder: Enabled

=== START OF READ SMART DATA SECTION ===
SMART overall-health self-assessment test result: PASSED

General SMART Values:
Offline data collection status:  (0x80)	Offline data collection activity
					was never started.
					Auto Offline Data Collection: Enabled.
Self-test execution status:      (   0)	The previous self-test routine completed
					without error or no self-test has ever 
					been run.
Total time to complete Offline 
data collection: 		( 9180) seconds.
Offline data collection
capabilities: 			 (0x7b) SMART execute Offline immediate.
					Auto Offline data collection on/off support.
					Suspend Offline collection upon new
					command.
					Offline surface scan supported.
					Self-test supported.
					Conveyance Self-test supported.
					Selective Self-test supported.
SMART capabilities:            (0x0003)	Saves SMART data before entering
					power-saving mode.
					Supports SMART auto save timer.
Error logging capability:        (0x01)	Error logging supported.
					General Purpose Logging supported.
Short self-test routine 
recommended polling time: 	 (   2) minutes.
Extended self-test routine
recommended polling time: 	 ( 110) minutes.
Conveyance self-test routine
recommended polling time: 	 (   5) minutes.
SCT capabilities: 	       (0x303f)	SCT Status supported.
					SCT Error Recovery Control supported.
					SCT Feature Control supported.
					SCT Data Table supported.

SMART Attributes Data Structure revision number: 16
Vendor Specific SMART Attributes with Thresholds:
ID# ATTRIBUTE_NAME          FLAGS    VALUE WORST THRESH FAIL RAW_VALUE
  1 Raw_Read_Error_Rate     POSR--   200   200   051    -    0
  3 Spin_Up_Time            PO----   187   186   021    -    1625
  4 Start_Stop_Count        -O--CK   097   097   000    -    3624
  5 Reallocated_Sector_Ct   PO--CK   200   200   140    -    0
  7 Seek_Error_Rate         POSR--   100   253   051    -    0
  9 Power_On_Hours          -O--CK   092   092   000    -    5928
 10 Spin_Retry_Count        PO--C-   100   100   051    -    0
 11 Calibration_Retry_Count -O--C-   100   100   051    -    0
 12 Power_Cycle_Count       -O--CK   097   097   000    -    3593
192 Power-Off_Retract_Count -O--CK   200   200   000    -    165
193 Load_Cycle_Count        -O--CK   189   189   000    -    33358
194 Temperature_Celsius     -O---K   108   084   000    -    39
196 Reallocated_Event_Count -O--CK   200   200   000    -    0
197 Current_Pending_Sector  -O--C-   200   200   000    -    0
198 Offline_Uncorrectable   ----C-   100   253   000    -    0
199 UDMA_CRC_Error_Count    -OSRCK   200   200   000    -    0
200 Multi_Zone_Error_Rate   P--R--   100   253   051    -    0
                            ||||||_ K auto-keep
                            |||||__ C event count
                            ||||___ R error rate
                            |||____ S speed/performance
                            ||_____ O updated online
                            |______ P prefailure warning

General Purpose Log Directory Version 1
SMART           Log Directory Version 1 [multi-sector log support]
Address    Access  R/W   Size  Description
0x00       GPL,SL  R/O      1  Log Directory
0x01           SL  R/O      1  Summary SMART error log
0x02           SL  R/O      5  Comprehensive SMART error log
0x03       GPL     R/O      6  Ext. Comprehensive SMART error log
0x06           SL  R/O      1  SMART self-test log
0x07       GPL     R/O      1  Extended self-test log
0x09           SL  R/W      1  Selective self-test log
0x10       GPL     R/O      1  NCQ Command Error log
0x11       GPL     R/O      1  SATA Phy Event Counters
0x80-0x9f  GPL,SL  R/W     16  Host vendor specific log
0xa0-0xa7  GPL,SL  VS      16  Device vendor specific log
0xa8-0xb7  GPL,SL  VS       1  Device vendor specific log
0xc0       GPL,SL  VS       1  Device vendor specific log
0xc1       GPL     VS      12  Device vendor specific log
0xe0       GPL,SL  R/W      1  SCT Command/Status
0xe1       GPL,SL  R/W      1  SCT Data Transfer

SMART Extended Comprehensive Error Log Version: 1 (6 sectors)
Device Error Count: 4
	CR     = Command Register
	FEATR  = Features Register
	COUNT  = Count (was: Sector Count) Register
	LBA_48 = Upper bytes of LBA High/Mid/Low Registers ]  ATA-8
	LH     = LBA High (was: Cylinder High) Register    ]   LBA
	LM     = LBA Mid (was: Cylinder Low) Register      ] Register
	LL     = LBA Low (was: Sector Number) Register     ]
	DV     = Device (was: Device/Head) Register
	DC     = Device Control Register
	ER     = Error register
	ST     = Status register
Powered_Up_Time is measured from power on, and printed as
DDd+hh:mm:SS.sss where DD=days, hh=hours, mm=minutes,
SS=sec, and sss=millisec. It "wraps" after 49.710 days.

Error 4 [3] occurred at disk power-on lifetime: 0 hours (0 days + 0 hours)
  When the command that caused the error occurred, the device was in an unknown state.

  After command completion occurred, registers were:
  ER -- ST COUNT  LBA_48  LH LM LL DV DC
  -- -- -- == -- == == == -- -- -- -- --
  40 -- 00 01 08 00 51 00 00 e0 01 00 00

  Commands leading to the command that caused the error were:
  CR FEATR COUNT  LBA_48  LH LM LL DV DC  Powered_Up_Time  Command/Feature_Name
  -- == -- == -- == == == -- -- -- -- --  ---------------  --------------------
  00 65 25 75 f1 00 00 00 00 00 00 00 0b     00:00:00.000  NOP [Reserved subcommand] [OBS-ACS-2]
  00 08 00 00 b0 75 65 0b f1 25 00 00 00     00:00:47.112  NOP [Abort queued commands]
  0b 63 25 75 f1 00 08 00 a8 00 00 00 0b     02:08:49.508  REQUEST SENSE DATA EXT
  00 08 00 00 98 75 63 0b f1 25 00 00 00     00:00:40.968  NOP [Abort queued commands]

Error 3 [2] occurred at disk power-on lifetime: 0 hours (0 days + 0 hours)
  When the command that caused the error occurred, the device was in an unknown state.

  After command completion occurred, registers were:
  ER -- ST COUNT  LBA_48  LH LM LL DV DC
  -- -- -- == -- == == == -- -- -- -- --
  40 -- 00 01 a0 00 51 00 00 e0 01 00 00

  Commands leading to the command that caused the error were:
  CR FEATR COUNT  LBA_48  LH LM LL DV DC  Powered_Up_Time  Command/Feature_Name
  -- == -- == -- == == == -- -- -- -- --  ---------------  --------------------
  00 e2 25 75 df 00 00 00 00 00 00 00 0b     00:00:00.000  NOP [Reserved subcommand] [OBS-ACS-2]
  00 20 00 00 a0 75 7e 0d df 35 00 00 00     00:00:16.544  NOP [Abort queued commands]
  0d 7d 35 75 df 00 20 00 40 00 00 00 0d     02:08:44.926  [RESERVED]
  00 20 00 00 60 75 7c 0b df 25 00 00 00     00:00:16.384  NOP [Abort queued commands]

Error 2 [1] occurred at disk power-on lifetime: 0 hours (0 days + 0 hours)
  When the command that caused the error occurred, the device was in an unknown state.

  After command completion occurred, registers were:
  ER -- ST COUNT  LBA_48  LH LM LL DV DC
  -- -- -- == -- == == == -- -- -- -- --
  40 -- 00 01 08 00 51 00 00 e0 01 00 00

  Commands leading to the command that caused the error were:
  CR FEATR COUNT  LBA_48  LH LM LL DV DC  Powered_Up_Time  Command/Feature_Name
  -- == -- == -- == == == -- -- -- -- --  ---------------  --------------------
  00 bd 25 0b 29 00 00 00 00 00 00 00 09     00:00:00.000  NOP [Reserved subcommand] [OBS-ACS-2]
  00 08 00 00 88 0b bc 09 29 25 00 00 00     00:00:36.872  NOP [Abort queued commands]
  09 bc 25 0b 29 00 08 00 80 00 00 00 09     00:12:11.580  [RESERVED]
  00 08 00 00 70 0b bc 09 29 25 00 00 00     00:00:30.728  NOP [Abort queued commands]

Error 1 [0] occurred at disk power-on lifetime: 0 hours (0 days + 0 hours)
  When the command that caused the error occurred, the device was in an unknown state.

  After command completion occurred, registers were:
  ER -- ST COUNT  LBA_48  LH LM LL DV DC
  -- -- -- == -- == == == -- -- -- -- --
  40 -- 00 01 00 00 51 00 00 e0 01 00 00

  Commands leading to the command that caused the error were:
  CR FEATR COUNT  LBA_48  LH LM LL DV DC  Powered_Up_Time  Command/Feature_Name
  -- == -- == -- == == == -- -- -- -- --  ---------------  --------------------
  00 db 25 0b 18 00 00 00 00 00 00 00 09     00:00:00.000  NOP [Reserved subcommand] [OBS-ACS-2]
  00 00 00 00 c0 0b d1 09 18 25 00 00 00     00:00:49.152  NOP [Abort queued commands]
  03 c2 25 0b 18 00 08 00 38 00 00 00 09     00:12:07.249  CFA REQUEST EXTENDED ERROR
  00 08 00 00 30 0b c2 03 18 25 00 00 00     00:00:40.992  NOP [Abort queued commands]

SMART Extended Self-test Log Version: 1 (1 sectors)
No self-tests have been logged.  [To run self-tests, use: smartctl -t]

SMART Selective self-test log data structure revision number 1
 SPAN  MIN_LBA  MAX_LBA  CURRENT_TEST_STATUS
    1        0        0  Not_testing
    2        0        0  Not_testing
    3        0        0  Not_testing
    4        0        0  Not_testing
    5        0        0  Not_testing
Selective self-test flags (0x0):
  After scanning selected spans, do NOT read-scan remainder of disk.
If Selective self-test is pending on power-up, resume after 0 minute delay.

SCT Status Version:                  2
SCT Version (vendor specific):       258 (0x0102)
SCT Support Level:                   1
Device State:                        Active (0)
Current Temperature:                    39 Celsius
Power Cycle Min/Max Temperature:     21/43 Celsius
Lifetime    Min/Max Temperature:     21/65 Celsius
Under/Over Temperature Limit Count:   0/0

SCT Temperature History Version:     2
Temperature Sampling Period:         1 minute
Temperature Logging Interval:        1 minute
Min/Max recommended Temperature:      5/60 Celsius
Min/Max Temperature Limit:            1/85 Celsius
Temperature History Size (Index):    128 (117)

Index    Estimated Time   Temperature Celsius
 118    2015-12-05 20:03    42  ***********************
 ...    ..(  4 skipped).    ..  ***********************
 123    2015-12-05 20:08    42  ***********************
 124    2015-12-05 20:09    43  ************************
 ...    ..(  9 skipped).    ..  ************************
   6    2015-12-05 20:19    43  ************************
   7    2015-12-05 20:20    42  ***********************
 ...    ..(  2 skipped).    ..  ***********************
  10    2015-12-05 20:23    42  ***********************
  11    2015-12-05 20:24    41  **********************
  12    2015-12-05 20:25    41  **********************
  13    2015-12-05 20:26    40  *********************
 ...    ..(  4 skipped).    ..  *********************
  18    2015-12-05 20:31    40  *********************
  19    2015-12-05 20:32    39  ********************
 ...    ..(  2 skipped).    ..  ********************
  22    2015-12-05 20:35    39  ********************
  23    2015-12-05 20:36    38  *******************
  24    2015-12-05 20:37    39  ********************
  25    2015-12-05 20:38    38  *******************
 ...    ..(  2 skipped).    ..  *******************
  28    2015-12-05 20:41    38  *******************
  29    2015-12-05 20:42    39  ********************
 ...    ..(  2 skipped).    ..  ********************
  32    2015-12-05 20:45    39  ********************
  33    2015-12-05 20:46    38  *******************
  34    2015-12-05 20:47    39  ********************
  35    2015-12-05 20:48    38  *******************
 ...    ..(  6 skipped).    ..  *******************
  42    2015-12-05 20:55    38  *******************
  43    2015-12-05 20:56    37  ******************
  44    2015-12-05 20:57    38  *******************
 ...    ..(  2 skipped).    ..  *******************
  47    2015-12-05 21:00    38  *******************
  48    2015-12-05 21:01    37  ******************
 ...    ..( 15 skipped).    ..  ******************
  64    2015-12-05 21:17    37  ******************
  65    2015-12-05 21:18    36  *****************
  66    2015-12-05 21:19    36  *****************
  67    2015-12-05 21:20    36  *****************
  68    2015-12-05 21:21    37  ******************
  69    2015-12-05 21:22    37  ******************
  70    2015-12-05 21:23    36  *****************
  71    2015-12-05 21:24    37  ******************
  72    2015-12-05 21:25    36  *****************
  73    2015-12-05 21:26    37  ******************
  74    2015-12-05 21:27    37  ******************
  75    2015-12-05 21:28    36  *****************
  76    2015-12-05 21:29    37  ******************
 ...    ..(  4 skipped).    ..  ******************
  81    2015-12-05 21:34    37  ******************
  82    2015-12-05 21:35    36  *****************
  83    2015-12-05 21:36    37  ******************
 ...    ..( 21 skipped).    ..  ******************
 105    2015-12-05 21:58    37  ******************
 106    2015-12-05 21:59    38  *******************
 ...    ..(  8 skipped).    ..  *******************
 115    2015-12-05 22:08    38  *******************
 116    2015-12-05 22:09    39  ********************
 117    2015-12-05 22:10    41  **********************

SCT Error Recovery Control:
           Read: Disabled
          Write: Disabled

Device Statistics (GP Log 0x04) not supported

SATA Phy Event Counters (GP Log 0x11)
ID      Size     Value  Description
0x0001  2            0  Command failed due to ICRC error
0x0002  2            0  R_ERR response for data FIS
0x0003  2            0  R_ERR response for device-to-host data FIS
0x0004  2            0  R_ERR response for host-to-device data FIS
0x0005  2            0  R_ERR response for non-data FIS
0x0006  2            0  R_ERR response for device-to-host non-data FIS
0x0007  2            0  R_ERR response for host-to-device non-data FIS
0x000a  2            2  Device-to-host register FISes sent due to a COMRESET
0x8000  4         9886  Vendor specific