/dev/sda
=== START OF INFORMATION SECTION ===
Model Family:     Seagate Laptop HDD
Device Model:     ST500LT012-1DG142
Serial Number:    --
LU WWN Device Id: 5 000c50 ...
Firmware Version: 0007LIM1
User Capacity:    500,107,862,016 bytes [500 GB]
Sector Sizes:     512 bytes logical, 4096 bytes physical
Rotation Rate:    5400 rpm
Form Factor:      2.5 inches
Device is:        In smartctl database [for details use: -P show]
ATA Version is:   ATA8-ACS T13/1699-D revision 4
SATA Version is:  SATA 3.0, 6.0 Gb/s (current: 6.0 Gb/s)
Local Time is:    Thu Apr 12 11:56:58 2018 UTC
SMART support is: Available - device has SMART capability.
SMART support is: Enabled
AAM feature is:   Unavailable
APM level is:     254 (maximum performance)
Rd look-ahead is: Enabled
Write cache is:   Enabled
DSN feature is:   Unavailable
ATA Security is:  Disabled, frozen [SEC2]
Wt Cache Reorder: Enabled

=== START OF READ SMART DATA SECTION ===
SMART overall-health self-assessment test result: PASSED

General SMART Values:
Offline data collection status:  (0x82)	Offline data collection activity
					was completed without error.
					Auto Offline Data Collection: Enabled.
Self-test execution status:      (   0)	The previous self-test routine completed
					without error or no self-test has ever 
					been run.
Total time to complete Offline 
data collection: 		(    0) seconds.
Offline data collection
capabilities: 			 (0x7b) SMART execute Offline immediate.
					Auto Offline data collection on/off support.
					Suspend Offline collection upon new
					command.
					Offline surface scan supported.
					Self-test supported.
					Conveyance Self-test supported.
					Selective Self-test supported.
SMART capabilities:            (0x0003)	Saves SMART data before entering
					power-saving mode.
					Supports SMART auto save timer.
Error logging capability:        (0x01)	Error logging supported.
					General Purpose Logging supported.
Short self-test routine 
recommended polling time: 	 (   1) minutes.
Extended self-test routine
recommended polling time: 	 (  95) minutes.
Conveyance self-test routine
recommended polling time: 	 (   2) minutes.
SCT capabilities: 	       (0x1031)	SCT Status supported.
					SCT Feature Control supported.
					SCT Data Table supported.

SMART Attributes Data Structure revision number: 10
Vendor Specific SMART Attributes with Thresholds:
ID# ATTRIBUTE_NAME          FLAGS    VALUE WORST THRESH FAIL RAW_VALUE
  1 Raw_Read_Error_Rate     POSR--   102   100   034    -    4823824
  3 Spin_Up_Time            PO----   099   099   000    -    0
  4 Start_Stop_Count        -O--CK   100   100   020    -    23
  5 Reallocated_Sector_Ct   PO--CK   100   100   036    -    0
  7 Seek_Error_Rate         POSR--   100   253   030    -    721041
  9 Power_On_Hours          -O--CK   100   100   000    -    43 (120 66 0)
 10 Spin_Retry_Count        PO--C-   100   100   097    -    0
 12 Power_Cycle_Count       -O--CK   100   100   020    -    23
184 End-to-End_Error        -O--CK   100   100   099    -    0
187 Reported_Uncorrect      -O--CK   100   100   000    -    0
188 Command_Timeout         -O--CK   100   100   000    -    0
189 High_Fly_Writes         -O-RCK   100   100   000    -    0
190 Airflow_Temperature_Cel -O---K   061   056   045    -    39 (Min/Max 23/40)
191 G-Sense_Error_Rate      -O--CK   100   100   000    -    4
192 Power-Off_Retract_Count -O--CK   100   100   000    -    7
193 Load_Cycle_Count        -O--CK   100   100   000    -    125
194 Temperature_Celsius     -O---K   039   044   000    -    39 (0 22 0 0 0)
196 Reallocated_Event_Count POSR--   100   100   030    -    41 (25955 0)
197 Current_Pending_Sector  -O--C-   100   100   000    -    0
198 Offline_Uncorrectable   ----C-   100   100   000    -    0
199 UDMA_CRC_Error_Count    -OSRCK   200   200   000    -    0
254 Free_Fall_Sensor        -O--CK   100   100   000    -    0
                            ||||||_ K auto-keep
                            |||||__ C event count
                            ||||___ R error rate
                            |||____ S speed/performance
                            ||_____ O updated online
                            |______ P prefailure warning

General Purpose Log Directory Version 1
SMART           Log Directory Version 1 [multi-sector log support]
Address    Access  R/W   Size  Description
0x00       GPL,SL  R/O      1  Log Directory
0x01           SL  R/O      1  Summary SMART error log
0x02           SL  R/O      5  Comprehensive SMART error log
0x03       GPL     R/O      5  Ext. Comprehensive SMART error log
0x06           SL  R/O      1  SMART self-test log
0x07       GPL     R/O      1  Extended self-test log
0x09           SL  R/W      1  Selective self-test log
0x10       GPL     R/O      1  NCQ Command Error log
0x11       GPL     R/O      1  SATA Phy Event Counters log
0x21       GPL     R/O      1  Write stream error log
0x22       GPL     R/O      1  Read stream error log
0x80-0x9f  GPL,SL  R/W     16  Host vendor specific log
0xa1       GPL,SL  VS      20  Device vendor specific log
0xa2       GPL     VS    2248  Device vendor specific log
0xa8       GPL,SL  VS      65  Device vendor specific log
0xa9       GPL,SL  VS       1  Device vendor specific log
0xab       GPL     VS       1  Device vendor specific log
0xb0       GPL     VS    2864  Device vendor specific log
0xbd-0xbf  GPL     VS   65535  Device vendor specific log
0xc0       GPL,SL  VS       1  Device vendor specific log
0xc1       GPL,SL  VS      10  Device vendor specific log
0xc3       GPL,SL  VS       8  Device vendor specific log
0xc4       GPL,SL  VS      18  Device vendor specific log
0xe0       GPL,SL  R/W      1  SCT Command/Status
0xe1       GPL,SL  R/W      1  SCT Data Transfer

SMART Extended Comprehensive Error Log Version: 1 (5 sectors)
No Errors Logged

SMART Extended Self-test Log Version: 1 (1 sectors)
Num  Test_Description    Status                  Remaining  LifeTime(hours)  LBA_of_first_error
# 1  Vendor (0x50)       Completed without error       00%         2         -
# 2  Vendor (0x50)       Completed without error       00%         2         -
# 3  Vendor (0x50)       Completed without error       00%         2         -
# 4  Vendor (0x50)       Completed without error       00%         2         -
# 5  Vendor (0x50)       Completed without error       00%         2         -
# 6  Vendor (0x50)       Completed without error       00%         1         -
# 7  Vendor (0x50)       Completed without error       00%         1         -
# 8  Vendor (0x50)       Completed without error       00%         1         -
# 9  Vendor (0x50)       Completed without error       00%         1         -
#10  Vendor (0x50)       Completed without error       00%         1         -

SMART Selective self-test log data structure revision number 1
 SPAN  MIN_LBA  MAX_LBA  CURRENT_TEST_STATUS
    1        0        0  Not_testing
    2        0        0  Not_testing
    3        0        0  Not_testing
    4        0        0  Not_testing
    5        0        0  Not_testing
Selective self-test flags (0x0):
  After scanning selected spans, do NOT read-scan remainder of disk.
If Selective self-test is pending on power-up, resume after 0 minute delay.

SCT Status Version:                  3
SCT Version (vendor specific):       522 (0x020a)
SCT Support Level:                   1
Device State:                        Active (0)
Current Temperature:                    39 Celsius
Power Cycle Min/Max Temperature:     23/40 Celsius
Lifetime    Min/Max Temperature:     22/44 Celsius
Under/Over Temperature Limit Count:   0/13
Vendor specific:
00 00 00 00 00 00 00 00 00 00 02 00 00 00 00 00
00 00 00 00 00 00 00 00 00 00 00 00 00 00 00 00

SCT Temperature History Version:     2
Temperature Sampling Period:         1 minute
Temperature Logging Interval:        11 minutes
Min/Max recommended Temperature:      0/ 0 Celsius
Min/Max Temperature Limit:            0/ 0 Celsius
Temperature History Size (Index):    128 (15)

Index    Estimated Time   Temperature Celsius
  16    2018-04-11 12:38    35  ****************
 ...    ..( 11 skipped).    ..  ****************
  28    2018-04-11 14:50    35  ****************
  29    2018-04-11 15:01    34  ***************
  30    2018-04-11 15:12    35  ****************
  31    2018-04-11 15:23    34  ***************
 ...    ..( 34 skipped).    ..  ***************
  66    2018-04-11 21:48    34  ***************
  67    2018-04-11 21:59    33  **************
 ...    ..(  6 skipped).    ..  **************
  74    2018-04-11 23:16    33  **************
  75    2018-04-11 23:27    34  ***************
 ...    ..(  4 skipped).    ..  ***************
  80    2018-04-12 00:22    34  ***************
  81    2018-04-12 00:33     ?  -
  82    2018-04-12 00:44    34  ***************
  83    2018-04-12 00:55    36  *****************
  84    2018-04-12 01:06     ?  -
  85    2018-04-12 01:17    23  ****
  86    2018-04-12 01:28    30  ***********
  87    2018-04-12 01:39    32  *************
  88    2018-04-12 01:50    33  **************
  89    2018-04-12 02:01    34  ***************
  90    2018-04-12 02:12    35  ****************
  91    2018-04-12 02:23    36  *****************
  92    2018-04-12 02:34    36  *****************
  93    2018-04-12 02:45    36  *****************
  94    2018-04-12 02:56    35  ****************
 ...    ..(  8 skipped).    ..  ****************
 103    2018-04-12 04:35    35  ****************
 104    2018-04-12 04:46    36  *****************
 105    2018-04-12 04:57    36  *****************
 106    2018-04-12 05:08    37  ******************
 107    2018-04-12 05:19    37  ******************
 108    2018-04-12 05:30    38  *******************
 ...    ..(  4 skipped).    ..  *******************
 113    2018-04-12 06:25    38  *******************
 114    2018-04-12 06:36    39  ********************
 115    2018-04-12 06:47    39  ********************
 116    2018-04-12 06:58    40  *********************
 117    2018-04-12 07:09    40  *********************
 118    2018-04-12 07:20    40  *********************
 119    2018-04-12 07:31    39  ********************
 120    2018-04-12 07:42    40  *********************
 121    2018-04-12 07:53    39  ********************
 122    2018-04-12 08:04    39  ********************
 123    2018-04-12 08:15    38  *******************
 124    2018-04-12 08:26    40  *********************
 125    2018-04-12 08:37    39  ********************
 126    2018-04-12 08:48    39  ********************
 127    2018-04-12 08:59    38  *******************
   0    2018-04-12 09:10    38  *******************
   1    2018-04-12 09:21    38  *******************
   2    2018-04-12 09:32     ?  -
   3    2018-04-12 09:43    23  ****
   4    2018-04-12 09:54    31  ************
   5    2018-04-12 10:05    34  ***************
   6    2018-04-12 10:16    36  *****************
   7    2018-04-12 10:27    37  ******************
   8    2018-04-12 10:38    38  *******************
 ...    ..(  4 skipped).    ..  *******************
  13    2018-04-12 11:33    38  *******************
  14    2018-04-12 11:44    39  ********************
  15    2018-04-12 11:55    40  *********************

SCT Error Recovery Control command not supported

Device Statistics (GP/SMART Log 0x04) not supported

Pending Defects log (GP Log 0x0c) not supported

SATA Phy Event Counters (GP Log 0x11)
ID      Size     Value  Description
0x000a  2            4  Device-to-host register FISes sent due to a COMRESET
0x0001  2            0  Command failed due to ICRC error
0x0003  2            0  R_ERR response for device-to-host data FIS
0x0004  2            0  R_ERR response for host-to-device data FIS
0x0006  2            0  R_ERR response for device-to-host non-data FIS
0x0007  2            0  R_ERR response for host-to-device non-data FIS
