/dev/sda
=== START OF INFORMATION SECTION ===
Model Family:     Samsung based SSDs
Device Model:     SAMSUNG MZNTY256HDHP-000L7
Serial Number:    --
LU WWN Device Id: 5 002538 ...
Firmware Version: MAT24L6Q
User Capacity:    256,060,514,304 bytes [256 GB]
Sector Size:      512 bytes logical/physical
Rotation Rate:    Solid State Device
Form Factor:      M.2
Device is:        In smartctl database [for details use: -P show]
ATA Version is:   ACS-2, ATA8-ACS T13/1699-D revision 4c
SATA Version is:  SATA 3.1, 6.0 Gb/s (current: 6.0 Gb/s)
Local Time is:    Tue Nov 12 11:22:13 2019 CET
SMART support is: Available - device has SMART capability.
SMART support is: Enabled
AAM feature is:   Unavailable
APM feature is:   Unavailable
Rd look-ahead is: Enabled
Write cache is:   Enabled
DSN feature is:   Unavailable
ATA Security is:  Unavailable
Wt Cache Reorder: Enabled

=== START OF READ SMART DATA SECTION ===
SMART overall-health self-assessment test result: PASSED

General SMART Values:
Offline data collection status:  (0x00)	Offline data collection activity
					was never started.
					Auto Offline Data Collection: Disabled.
Self-test execution status:      (   0)	The previous self-test routine completed
					without error or no self-test has ever 
					been run.
Total time to complete Offline 
data collection: 		(    0) seconds.
Offline data collection
capabilities: 			 (0x53) SMART execute Offline immediate.
					Auto Offline data collection on/off support.
					Suspend Offline collection upon new
					command.
					No Offline surface scan supported.
					Self-test supported.
					No Conveyance Self-test supported.
					Selective Self-test supported.
SMART capabilities:            (0x0003)	Saves SMART data before entering
					power-saving mode.
					Supports SMART auto save timer.
Error logging capability:        (0x01)	Error logging supported.
					General Purpose Logging supported.
Short self-test routine 
recommended polling time: 	 (   2) minutes.
Extended self-test routine
recommended polling time: 	 (  85) minutes.
SCT capabilities: 	       (0x003d)	SCT Status supported.
					SCT Error Recovery Control supported.
					SCT Feature Control supported.
					SCT Data Table supported.

SMART Attributes Data Structure revision number: 1
Vendor Specific SMART Attributes with Thresholds:
ID# ATTRIBUTE_NAME          FLAGS    VALUE WORST THRESH FAIL RAW_VALUE
  5 Reallocated_Sector_Ct   PO--CK   100   100   010    -    0
  9 Power_On_Hours          -O--CK   099   099   000    -    4436
 12 Power_Cycle_Count       -O--CK   093   093   000    -    6534
170 Unused_Rsvd_Blk_Ct_Chip -O--CK   100   100   010    -    0
171 Program_Fail_Count_Chip -O--CK   100   100   010    -    0
172 Erase_Fail_Count_Chip   -O--CK   100   100   010    -    0
173 Wear_Leveling_Count     PO--CK   092   092   005    -    66
174 Unexpect_Power_Loss_Ct  -O--CK   099   099   000    -    288
178 Used_Rsvd_Blk_Cnt_Chip  PO--C-   100   100   010    -    0
180 Unused_Rsvd_Blk_Cnt_Tot PO--C-   100   100   010    -    1845
184 End-to-End_Error        PO--CK   100   100   097    -    0
187 Uncorrectable_Error_Cnt -O--CK   100   100   000    -    0
194 Temperature_Celsius     -O--CK   067   043   000    -    33 (Min/Max 11/57)
199 CRC_Error_Count         -OSRCK   100   100   000    -    0
233 Media_Wearout_Indicator PO--C-   091   091   001    -    15393094
241 Total_LBAs_Written      -O--CK   099   099   000    -    10769
242 Total_LBAs_Read         -O--CK   099   099   000    -    6594
249 Unknown_Samsung_Attr    -O--CK   099   099   000    -    17120
                            ||||||_ K auto-keep
                            |||||__ C event count
                            ||||___ R error rate
                            |||____ S speed/performance
                            ||_____ O updated online
                            |______ P prefailure warning

General Purpose Log Directory Version 1
SMART           Log Directory Version 1 [multi-sector log support]
Address    Access  R/W   Size  Description
0x00       GPL,SL  R/O      1  Log Directory
0x01           SL  R/O      1  Summary SMART error log
0x02           SL  R/O      1  Comprehensive SMART error log
0x03       GPL     R/O      1  Ext. Comprehensive SMART error log
0x06           SL  R/O      1  SMART self-test log
0x07       GPL     R/O      1  Extended self-test log
0x09           SL  R/W      1  Selective self-test log
0x10       GPL     R/O      1  NCQ Command Error log
0x11       GPL     R/O      1  SATA Phy Event Counters log
0x13       GPL     R/O      1  SATA NCQ Send and Receive log
0x30       GPL,SL  R/O      9  IDENTIFY DEVICE data log
0x80-0x9f  GPL,SL  R/W     16  Host vendor specific log
0xa5           SL  VS      16  Device vendor specific log
0xce           SL  VS      16  Device vendor specific log
0xdf       GPL,SL  VS       1  Device vendor specific log
0xe0       GPL,SL  R/W      1  SCT Command/Status
0xe1       GPL,SL  R/W      1  SCT Data Transfer

SMART Extended Comprehensive Error Log Version: 1 (1 sectors)
No Errors Logged

SMART Extended Self-test Log Version: 1 (1 sectors)
Num  Test_Description    Status                  Remaining  LifeTime(hours)  LBA_of_first_error
# 1  Short offline       Completed without error       00%        25         -

SMART Selective self-test log data structure revision number 1
 SPAN  MIN_LBA  MAX_LBA  CURRENT_TEST_STATUS
    1        0        0  Not_testing
    2        0        0  Not_testing
    3        0        0  Not_testing
    4        0        0  Not_testing
    5        0        0  Not_testing
  255        0    65535  Read_scanning was never started
Selective self-test flags (0x0):
  After scanning selected spans, do NOT read-scan remainder of disk.
If Selective self-test is pending on power-up, resume after 0 minute delay.

SCT Status Version:                  3
SCT Version (vendor specific):       256 (0x0100)
Device State:                        Active (0)
Current Temperature:                    33 Celsius
Power Cycle Min/Max Temperature:     31/33 Celsius
Lifetime    Min/Max Temperature:     19/52 Celsius
Under/Over Temperature Limit Count:   0/0

SCT Temperature History Version:     2
Temperature Sampling Period:         1 minute
Temperature Logging Interval:        10 minutes
Min/Max recommended Temperature:      0/70 Celsius
Min/Max Temperature Limit:            0/70 Celsius
Temperature History Size (Index):    128 (53)

Index    Estimated Time   Temperature Celsius
  54    2019-11-11 14:10     ?  -
 ...    ..(  5 skipped).    ..  -
  60    2019-11-11 15:10     ?  -
  61    2019-11-11 15:20    29  **********
  62    2019-11-11 15:30    30  ***********
  63    2019-11-11 15:40    29  **********
  64    2019-11-11 15:50    30  ***********
 ...    ..(  2 skipped).    ..  ***********
  67    2019-11-11 16:20    30  ***********
  68    2019-11-11 16:30    31  ************
  69    2019-11-11 16:40     ?  -
  70    2019-11-11 16:50     ?  -
  71    2019-11-11 17:00    27  ********
  72    2019-11-11 17:10     ?  -
  73    2019-11-11 17:20    28  *********
  74    2019-11-11 17:30    30  ***********
 ...    ..(  6 skipped).    ..  ***********
  81    2019-11-11 18:40    30  ***********
  82    2019-11-11 18:50    29  **********
  83    2019-11-11 19:00    33  **************
  84    2019-11-11 19:10    33  **************
  85    2019-11-11 19:20    34  ***************
  86    2019-11-11 19:30    35  ****************
  87    2019-11-11 19:40    34  ***************
 ...    ..(  6 skipped).    ..  ***************
  94    2019-11-11 20:50    34  ***************
  95    2019-11-11 21:00    33  **************
 ...    ..(  4 skipped).    ..  **************
 100    2019-11-11 21:50    33  **************
 101    2019-11-11 22:00    32  *************
 ...    ..(  3 skipped).    ..  *************
 105    2019-11-11 22:40    32  *************
 106    2019-11-11 22:50     ?  -
 ...    ..(  3 skipped).    ..  -
 110    2019-11-11 23:30     ?  -
 111    2019-11-11 23:40    30  ***********
 112    2019-11-11 23:50    31  ************
 113    2019-11-12 00:00    31  ************
 114    2019-11-12 00:10    31  ************
 115    2019-11-12 00:20    32  *************
 116    2019-11-12 00:30    32  *************
 117    2019-11-12 00:40    33  **************
 118    2019-11-12 00:50    33  **************
 119    2019-11-12 01:00    33  **************
 120    2019-11-12 01:10    31  ************
 121    2019-11-12 01:20    30  ***********
 122    2019-11-12 01:30    30  ***********
 123    2019-11-12 01:40     ?  -
 124    2019-11-12 01:50    29  **********
 125    2019-11-12 02:00    29  **********
 126    2019-11-12 02:10    32  *************
 127    2019-11-12 02:20    32  *************
   0    2019-11-12 02:30    32  *************
   1    2019-11-12 02:40    33  **************
   2    2019-11-12 02:50    34  ***************
   3    2019-11-12 03:00    34  ***************
   4    2019-11-12 03:10    33  **************
   5    2019-11-12 03:20    32  *************
   6    2019-11-12 03:30    31  ************
   7    2019-11-12 03:40    32  *************
   8    2019-11-12 03:50    33  **************
   9    2019-11-12 04:00    33  **************
  10    2019-11-12 04:10    35  ****************
  11    2019-11-12 04:20    34  ***************
  12    2019-11-12 04:30    35  ****************
  13    2019-11-12 04:40    35  ****************
  14    2019-11-12 04:50    35  ****************
  15    2019-11-12 05:00    34  ***************
  16    2019-11-12 05:10    33  **************
  17    2019-11-12 05:20    32  *************
  18    2019-11-12 05:30    32  *************
  19    2019-11-12 05:40    32  *************
  20    2019-11-12 05:50     ?  -
  21    2019-11-12 06:00    31  ************
  22    2019-11-12 06:10    33  **************
  23    2019-11-12 06:20    33  **************
  24    2019-11-12 06:30    34  ***************
  25    2019-11-12 06:40    33  **************
  26    2019-11-12 06:50    34  ***************
  27    2019-11-12 07:00    33  **************
  28    2019-11-12 07:10     ?  -
  29    2019-11-12 07:20    25  ******
  30    2019-11-12 07:30     ?  -
  31    2019-11-12 07:40    28  *********
  32    2019-11-12 07:50    29  **********
  33    2019-11-12 08:00    32  *************
  34    2019-11-12 08:10    31  ************
  35    2019-11-12 08:20     ?  -
  36    2019-11-12 08:30     ?  -
  37    2019-11-12 08:40    29  **********
  38    2019-11-12 08:50    31  ************
  39    2019-11-12 09:00    32  *************
  40    2019-11-12 09:10    31  ************
  41    2019-11-12 09:20    32  *************
  42    2019-11-12 09:30     ?  -
 ...    ..(  4 skipped).    ..  -
  47    2019-11-12 10:20     ?  -
  48    2019-11-12 10:30    29  **********
  49    2019-11-12 10:40    31  ************
  50    2019-11-12 10:50    31  ************
  51    2019-11-12 11:00     ?  -
  52    2019-11-12 11:10    33  **************
  53    2019-11-12 11:20    33  **************

SCT Error Recovery Control:
           Read: Disabled
          Write: Disabled

Device Statistics (GP/SMART Log 0x04) not supported

Pending Defects log (GP Log 0x0c) not supported

SATA Phy Event Counters (GP Log 0x11)
ID      Size     Value  Description
0x0001  2            0  Command failed due to ICRC error
0x0002  2            0  R_ERR response for data FIS
0x0003  2            0  R_ERR response for device-to-host data FIS
0x0004  2            0  R_ERR response for host-to-device data FIS
0x0005  2            0  R_ERR response for non-data FIS
0x0006  2            0  R_ERR response for device-to-host non-data FIS
0x0007  2            0  R_ERR response for host-to-device non-data FIS
0x0008  2            0  Device-to-host non-data FIS retries
0x0009  2         1024  Transition from drive PhyRdy to drive PhyNRdy
0x000a  2            1  Device-to-host register FISes sent due to a COMRESET
0x000b  2            0  CRC errors within host-to-device FIS
0x000d  2            0  Non-CRC errors within host-to-device FIS
0x000f  2            0  R_ERR response for host-to-device data FIS, CRC
0x0010  2            0  R_ERR response for host-to-device data FIS, non-CRC
0x0012  2            0  R_ERR response for host-to-device non-data FIS, CRC
0x0013  2            0  R_ERR response for host-to-device non-data FIS, non-CRC
