/dev/sda
=== START OF INFORMATION SECTION ===
Model Family:     Seagate Laptop Thin HDD
Device Model:     ST500LT012-1DG142
Serial Number:    --
LU WWN Device Id: 5 000c50 ...
Firmware Version: 0001SDM1
User Capacity:    500 107 862 016 bytes [500 GB]
Sector Sizes:     512 bytes logical, 4096 bytes physical
Rotation Rate:    5400 rpm
Form Factor:      2.5 inches
Device is:        In smartctl database [for details use: -P show]
ATA Version is:   ATA8-ACS T13/1699-D revision 4
SATA Version is:  SATA 3.0, 6.0 Gb/s (current: 3.0 Gb/s)
Local Time is:    Mon Oct 17 22:03:54 2016 SAMT
SMART support is: Available - device has SMART capability.
SMART support is: Enabled
AAM feature is:   Unavailable
APM level is:     128 (minimum power consumption without standby)
Rd look-ahead is: Enabled
Write cache is:   Enabled
ATA Security is:  Disabled, frozen [SEC2]
Wt Cache Reorder: Enabled

=== START OF READ SMART DATA SECTION ===
SMART overall-health self-assessment test result: PASSED

General SMART Values:
Offline data collection status:  (0x00)	Offline data collection activity
					was never started.
					Auto Offline Data Collection: Disabled.
Self-test execution status:      (   0)	The previous self-test routine completed
					without error or no self-test has ever 
					been run.
Total time to complete Offline 
data collection: 		(    0) seconds.
Offline data collection
capabilities: 			 (0x73) SMART execute Offline immediate.
					Auto Offline data collection on/off support.
					Suspend Offline collection upon new
					command.
					No Offline surface scan supported.
					Self-test supported.
					Conveyance Self-test supported.
					Selective Self-test supported.
SMART capabilities:            (0x0003)	Saves SMART data before entering
					power-saving mode.
					Supports SMART auto save timer.
Error logging capability:        (0x01)	Error logging supported.
					General Purpose Logging supported.
Short self-test routine 
recommended polling time: 	 (   1) minutes.
Extended self-test routine
recommended polling time: 	 ( 103) minutes.
Conveyance self-test routine
recommended polling time: 	 (   2) minutes.
SCT capabilities: 	       (0x1035)	SCT Status supported.
					SCT Feature Control supported.
					SCT Data Table supported.

SMART Attributes Data Structure revision number: 10
Vendor Specific SMART Attributes with Thresholds:
ID# ATTRIBUTE_NAME          FLAGS    VALUE WORST THRESH FAIL RAW_VALUE
  1 Raw_Read_Error_Rate     POSR--   108   099   006    -    20289904
  3 Spin_Up_Time            PO----   099   099   000    -    0
  4 Start_Stop_Count        -O--CK   100   100   020    -    841
  5 Reallocated_Sector_Ct   PO--CK   100   100   036    -    0
  7 Seek_Error_Rate         POSR--   074   060   030    -    25233896
  9 Power_On_Hours          -O--CK   099   099   000    -    926 (135 11 0)
 10 Spin_Retry_Count        PO--C-   100   100   097    -    0
 12 Power_Cycle_Count       -O--CK   100   100   020    -    652
184 End-to-End_Error        -O--CK   100   100   099    -    0
187 Reported_Uncorrect      -O--CK   100   100   000    -    0
188 Command_Timeout         -O--CK   100   100   000    -    7
189 High_Fly_Writes         -O-RCK   100   100   000    -    0
190 Airflow_Temperature_Cel -O---K   060   053   045    -    40 (Min/Max 38/41)
191 G-Sense_Error_Rate      -O--CK   100   100   000    -    14
192 Power-Off_Retract_Count -O--CK   100   100   000    -    37
193 Load_Cycle_Count        -O--CK   092   092   000    -    16617
194 Temperature_Celsius     -O---K   040   047   000    -    40 (0 16 0 0 0)
197 Current_Pending_Sector  -O--C-   100   100   000    -    0
198 Offline_Uncorrectable   ----C-   100   100   000    -    0
199 UDMA_CRC_Error_Count    -OSRCK   200   200   000    -    0
240 Head_Flying_Hours       ------   100   100   000    -    841 (223 163 0)
241 Total_LBAs_Written      ------   100   253   000    -    3902746169
242 Total_LBAs_Read         ------   100   253   000    -    5776738879
254 Free_Fall_Sensor        -O--CK   100   100   000    -    0
                            ||||||_ K auto-keep
                            |||||__ C event count
                            ||||___ R error rate
                            |||____ S speed/performance
                            ||_____ O updated online
                            |______ P prefailure warning

General Purpose Log Directory Version 1
SMART           Log Directory Version 1 [multi-sector log support]
Address    Access  R/W   Size  Description
0x00       GPL,SL  R/O      1  Log Directory
0x01           SL  R/O      1  Summary SMART error log
0x02           SL  R/O      5  Comprehensive SMART error log
0x03       GPL     R/O      5  Ext. Comprehensive SMART error log
0x06           SL  R/O      1  SMART self-test log
0x07       GPL     R/O      1  Extended self-test log
0x09           SL  R/W      1  Selective self-test log
0x10       GPL     R/O      1  SATA NCQ Queued Error log
0x11       GPL     R/O      1  SATA Phy Event Counters log
0x21       GPL     R/O      1  Write stream error log
0x22       GPL     R/O      1  Read stream error log
0x80-0x9f  GPL,SL  R/W     16  Host vendor specific log
0xa1       GPL,SL  VS      20  Device vendor specific log
0xa2       GPL     VS    2248  Device vendor specific log
0xa8       GPL,SL  VS      65  Device vendor specific log
0xa9       GPL,SL  VS       1  Device vendor specific log
0xab       GPL     VS       1  Device vendor specific log
0xb0       GPL     VS    2864  Device vendor specific log
0xbd-0xbf  GPL     VS   65535  Device vendor specific log
0xc0       GPL,SL  VS       1  Device vendor specific log
0xc1       GPL,SL  VS      10  Device vendor specific log
0xc3       GPL,SL  VS       8  Device vendor specific log
0xc4       GPL,SL  VS      18  Device vendor specific log
0xe0       GPL,SL  R/W      1  SCT Command/Status
0xe1       GPL,SL  R/W      1  SCT Data Transfer

SMART Extended Comprehensive Error Log Version: 1 (5 sectors)
No Errors Logged

SMART Extended Self-test Log Version: 1 (1 sectors)
No self-tests have been logged.  [To run self-tests, use: smartctl -t]

SMART Selective self-test log data structure revision number 1
 SPAN  MIN_LBA  MAX_LBA  CURRENT_TEST_STATUS
    1        0        0  Not_testing
    2        0        0  Not_testing
    3        0        0  Not_testing
    4        0        0  Not_testing
    5        0        0  Not_testing
Selective self-test flags (0x0):
  After scanning selected spans, do NOT read-scan remainder of disk.
If Selective self-test is pending on power-up, resume after 0 minute delay.

SCT Status Version:                  3
SCT Version (vendor specific):       522 (0x020a)
SCT Support Level:                   1
Device State:                        Active (0)
Current Temperature:                    40 Celsius
Power Cycle Min/Max Temperature:     38/42 Celsius
Lifetime    Min/Max Temperature:     16/47 Celsius
Lifetime    Average Temperature:        37 Celsius
Under/Over Temperature Limit Count:   0/0

SCT Temperature History Version:     2
Temperature Sampling Period:         1 minute
Temperature Logging Interval:        30 minutes
Min/Max recommended Temperature:     14/55 Celsius
Min/Max Temperature Limit:           10/60 Celsius
Temperature History Size (Index):    128 (124)

Index    Estimated Time   Temperature Celsius
 125    2016-10-15 06:30    35  ****************
 126    2016-10-15 07:00     ?  -
 127    2016-10-15 07:30    32  *************
   0    2016-10-15 08:00    37  ******************
   1    2016-10-15 08:30    35  ****************
   2    2016-10-15 09:00    35  ****************
   3    2016-10-15 09:30    36  *****************
   4    2016-10-15 10:00    37  ******************
   5    2016-10-15 10:30    38  *******************
   6    2016-10-15 11:00     ?  -
   7    2016-10-15 11:30    26  *******
   8    2016-10-15 12:00    35  ****************
   9    2016-10-15 12:30    36  *****************
  10    2016-10-15 13:00    38  *******************
  11    2016-10-15 13:30    40  *********************
  12    2016-10-15 14:00    36  *****************
  13    2016-10-15 14:30     ?  -
  14    2016-10-15 15:00    25  ******
  15    2016-10-15 15:30     ?  -
  16    2016-10-15 16:00    25  ******
  17    2016-10-15 16:30    34  ***************
  18    2016-10-15 17:00    38  *******************
  19    2016-10-15 17:30    37  ******************
  20    2016-10-15 18:00     ?  -
  21    2016-10-15 18:30    24  *****
  22    2016-10-15 19:00    34  ***************
  23    2016-10-15 19:30    37  ******************
  24    2016-10-15 20:00    38  *******************
  25    2016-10-15 20:30    39  ********************
  26    2016-10-15 21:00    39  ********************
  27    2016-10-15 21:30    37  ******************
  28    2016-10-15 22:00    38  *******************
  29    2016-10-15 22:30    39  ********************
  30    2016-10-15 23:00    42  ***********************
  31    2016-10-15 23:30     ?  -
  32    2016-10-16 00:00    26  *******
  33    2016-10-16 00:30    32  *************
  34    2016-10-16 01:00     ?  -
  35    2016-10-16 01:30    27  ********
  36    2016-10-16 02:00    35  ****************
  37    2016-10-16 02:30     ?  -
  38    2016-10-16 03:00    29  **********
  39    2016-10-16 03:30     ?  -
  40    2016-10-16 04:00    26  *******
  41    2016-10-16 04:30     ?  -
  42    2016-10-16 05:00    21  **
  43    2016-10-16 05:30     ?  -
  44    2016-10-16 06:00    21  **
  45    2016-10-16 06:30    35  ****************
  46    2016-10-16 07:00     ?  -
  47    2016-10-16 07:30    26  *******
  48    2016-10-16 08:00    36  *****************
  49    2016-10-16 08:30     ?  -
  50    2016-10-16 09:00    26  *******
  51    2016-10-16 09:30    37  ******************
  52    2016-10-16 10:00     ?  -
  53    2016-10-16 10:30    28  *********
  54    2016-10-16 11:00     ?  -
  55    2016-10-16 11:30    27  ********
  56    2016-10-16 12:00    36  *****************
  57    2016-10-16 12:30    36  *****************
  58    2016-10-16 13:00    39  ********************
  59    2016-10-16 13:30    37  ******************
  60    2016-10-16 14:00    38  *******************
  61    2016-10-16 14:30    36  *****************
  62    2016-10-16 15:00     ?  -
  63    2016-10-16 15:30    27  ********
  64    2016-10-16 16:00     ?  -
  65    2016-10-16 16:30    25  ******
  66    2016-10-16 17:00     ?  -
  67    2016-10-16 17:30    26  *******
  68    2016-10-16 18:00    35  ****************
  69    2016-10-16 18:30     ?  -
  70    2016-10-16 19:00    26  *******
  71    2016-10-16 19:30     ?  -
  72    2016-10-16 20:00    26  *******
  73    2016-10-16 20:30     ?  -
  74    2016-10-16 21:00    32  *************
  75    2016-10-16 21:30     ?  -
  76    2016-10-16 22:00    26  *******
  77    2016-10-16 22:30    39  ********************
  78    2016-10-16 23:00    41  **********************
  79    2016-10-16 23:30     ?  -
  80    2016-10-17 00:00    27  ********
  81    2016-10-17 00:30     ?  -
  82    2016-10-17 01:00    27  ********
  83    2016-10-17 01:30     ?  -
  84    2016-10-17 02:00    20  *
  85    2016-10-17 02:30     ?  -
  86    2016-10-17 03:00    23  ****
  87    2016-10-17 03:30    27  ********
  88    2016-10-17 04:00    26  *******
 ...    ..(  4 skipped).    ..  *******
  93    2016-10-17 06:30    26  *******
  94    2016-10-17 07:00     ?  -
  95    2016-10-17 07:30    18  -
  96    2016-10-17 08:00     ?  -
  97    2016-10-17 08:30    25  ******
  98    2016-10-17 09:00     ?  -
  99    2016-10-17 09:30    25  ******
 100    2016-10-17 10:00     ?  -
 101    2016-10-17 10:30    23  ****
 102    2016-10-17 11:00     ?  -
 103    2016-10-17 11:30    16  -
 104    2016-10-17 12:00     ?  -
 105    2016-10-17 12:30    16  -
 106    2016-10-17 13:00    25  ******
 107    2016-10-17 13:30    26  *******
 108    2016-10-17 14:00    27  ********
 109    2016-10-17 14:30    26  *******
 110    2016-10-17 15:00    26  *******
 111    2016-10-17 15:30    26  *******
 112    2016-10-17 16:00    27  ********
 113    2016-10-17 16:30     ?  -
 114    2016-10-17 17:00    28  *********
 115    2016-10-17 17:30     ?  -
 116    2016-10-17 18:00    25  ******
 117    2016-10-17 18:30     ?  -
 118    2016-10-17 19:00    31  ************
 119    2016-10-17 19:30     ?  -
 120    2016-10-17 20:00    27  ********
 121    2016-10-17 20:30    39  ********************
 122    2016-10-17 21:00     ?  -
 123    2016-10-17 21:30    40  *********************
 124    2016-10-17 22:00    39  ********************

SCT Error Recovery Control command not supported

Device Statistics (GP/SMART Log 0x04) not supported

SATA Phy Event Counters (GP Log 0x11)
ID      Size     Value  Description
0x000a  2           11  Device-to-host register FISes sent due to a COMRESET
0x0001  2            0  Command failed due to ICRC error
0x0003  2            0  R_ERR response for device-to-host data FIS
0x0004  2            0  R_ERR response for host-to-device data FIS
0x0006  2            0  R_ERR response for device-to-host non-data FIS
0x0007  2            0  R_ERR response for host-to-device non-data FIS