/dev/sda
=== START OF INFORMATION SECTION ===
Model Family:     Crucial/Micron BX/MX1/2/3/500, M5/600, 1100 SSDs
Device Model:     CT500MX500SSD1
Serial Number:    --
LU WWN Device Id: 5 00a075 ...
Firmware Version: M3CR023
User Capacity:    500,107,862,016 bytes [500 GB]
Sector Sizes:     512 bytes logical, 4096 bytes physical
Rotation Rate:    Solid State Device
Form Factor:      2.5 inches
Device is:        In smartctl database [for details use: -P show]
ATA Version is:   ACS-3 T13/2161-D revision 5
SATA Version is:  SATA 3.3, 6.0 Gb/s (current: 6.0 Gb/s)
Local Time is:    Wed Nov  6 11:26:19 2019 AEDT
SMART support is: Available - device has SMART capability.
SMART support is: Enabled
AAM feature is:   Unavailable
APM level is:     254 (maximum performance)
Rd look-ahead is: Enabled
Write cache is:   Enabled
DSN feature is:   Unavailable
ATA Security is:  Disabled, frozen [SEC2]
Wt Cache Reorder: Unknown

=== START OF READ SMART DATA SECTION ===
SMART overall-health self-assessment test result: PASSED

General SMART Values:
Offline data collection status:  (0x82)	Offline data collection activity
					was completed without error.
					Auto Offline Data Collection: Enabled.
Self-test execution status:      (   0)	The previous self-test routine completed
					without error or no self-test has ever 
					been run.
Total time to complete Offline 
data collection: 		(    0) seconds.
Offline data collection
capabilities: 			 (0x7b) SMART execute Offline immediate.
					Auto Offline data collection on/off support.
					Suspend Offline collection upon new
					command.
					Offline surface scan supported.
					Self-test supported.
					Conveyance Self-test supported.
					Selective Self-test supported.
SMART capabilities:            (0x0003)	Saves SMART data before entering
					power-saving mode.
					Supports SMART auto save timer.
Error logging capability:        (0x01)	Error logging supported.
					General Purpose Logging supported.
Short self-test routine 
recommended polling time: 	 (   2) minutes.
Extended self-test routine
recommended polling time: 	 (  30) minutes.
Conveyance self-test routine
recommended polling time: 	 (   2) minutes.
SCT capabilities: 	       (0x0031)	SCT Status supported.
					SCT Feature Control supported.
					SCT Data Table supported.

SMART Attributes Data Structure revision number: 16
Vendor Specific SMART Attributes with Thresholds:
ID# ATTRIBUTE_NAME          FLAGS    VALUE WORST THRESH FAIL RAW_VALUE
  1 Raw_Read_Error_Rate     POSR-K   100   100   000    -    0
  5 Reallocate_NAND_Blk_Cnt -O--CK   100   100   010    -    0
  9 Power_On_Hours          -O--CK   100   100   000    -    1397
 12 Power_Cycle_Count       -O--CK   100   100   000    -    13
171 Program_Fail_Count      -O--CK   100   100   000    -    0
172 Erase_Fail_Count        -O--CK   100   100   000    -    0
173 Ave_Block-Erase_Count   -O--CK   097   097   000    -    53
174 Unexpect_Power_Loss_Ct  -O--CK   100   100   000    -    2
180 Unused_Reserve_NAND_Blk PO--CK   000   000   000    -    45
183 SATA_Interfac_Downshift -O--CK   100   100   000    -    0
184 Error_Correction_Count  -O--CK   100   100   000    -    0
187 Reported_Uncorrect      -O--CK   100   100   000    -    0
194 Temperature_Celsius     -O---K   056   041   000    -    44 (Min/Max 0/59)
196 Reallocated_Event_Count -O--CK   100   100   000    -    0
197 Current_Pending_Sector  -O--CK   100   100   000    -    0
198 Offline_Uncorrectable   ----CK   100   100   000    -    0
199 UDMA_CRC_Error_Count    -O--CK   100   100   000    -    0
202 Percent_Lifetime_Remain ----CK   097   097   001    -    3
206 Write_Error_Rate        -OSR--   100   100   000    -    0
210 Success_RAIN_Recov_Cnt  -O--CK   100   100   000    -    0
246 Total_Host_Sector_Write -O--CK   100   100   000    -    5247471729
247 Host_Program_Page_Count -O--CK   100   100   000    -    90060089
248 FTL_Program_Page_Count  -O--CK   100   100   000    -    694351554
                            ||||||_ K auto-keep
                            |||||__ C event count
                            ||||___ R error rate
                            |||____ S speed/performance
                            ||_____ O updated online
                            |______ P prefailure warning

General Purpose Log Directory Version 1
SMART           Log Directory Version 1 [multi-sector log support]
Address    Access  R/W   Size  Description
0x00       GPL,SL  R/O      1  Log Directory
0x01           SL  R/O      1  Summary SMART error log
0x02           SL  R/O      1  Comprehensive SMART error log
0x03       GPL     R/O      1  Ext. Comprehensive SMART error log
0x04       GPL,SL  R/O      8  Device Statistics log
0x06           SL  R/O      1  SMART self-test log
0x07       GPL     R/O      1  Extended self-test log
0x09           SL  R/W      1  Selective self-test log
0x10       GPL     R/O      1  NCQ Command Error log
0x11       GPL     R/O      1  SATA Phy Event Counters log
0x24       GPL     R/O     88  Current Device Internal Status Data log
0x25       GPL     R/O     64  Saved Device Internal Status Data log
0x30       GPL,SL  R/O      9  IDENTIFY DEVICE data log
0x80-0x9f  GPL,SL  R/W     16  Host vendor specific log
0xe0       GPL,SL  R/W      1  SCT Command/Status
0xe1       GPL,SL  R/W      1  SCT Data Transfer

SMART Extended Comprehensive Error Log Version: 1 (1 sectors)
No Errors Logged

SMART Extended Self-test Log Version: 1 (1 sectors)
Num  Test_Description    Status                  Remaining  LifeTime(hours)  LBA_of_first_error
# 1  Extended offline    Completed without error       00%       545         -
# 2  Extended offline    Completed without error       00%       246         -
# 3  Short offline       Completed without error       00%        87         -
# 4  Extended offline    Completed without error       00%        75         -
# 5  Short offline       Completed without error       00%        75         -

SMART Selective self-test log data structure revision number 1
 SPAN  MIN_LBA  MAX_LBA  CURRENT_TEST_STATUS
    1        0        0  Not_testing
    2        0        0  Not_testing
    3        0        0  Not_testing
    4        0        0  Not_testing
    5        0        0  Not_testing
Selective self-test flags (0x0):
  After scanning selected spans, do NOT read-scan remainder of disk.
If Selective self-test is pending on power-up, resume after 0 minute delay.

SCT Status Version:                  3
SCT Version (vendor specific):       1 (0x0001)
Device State:                        Active (0)
Current Temperature:                    44 Celsius
Power Cycle Min/Max Temperature:     31/47 Celsius
Lifetime    Min/Max Temperature:      0/59 Celsius
Under/Over Temperature Limit Count:   0/0

SCT Temperature History Version:     2
Temperature Sampling Period:         1 minute
Temperature Logging Interval:        1 minute
Min/Max recommended Temperature:      0/100 Celsius
Min/Max Temperature Limit:            0/100 Celsius
Temperature History Size (Index):    128 (101)

Index    Estimated Time   Temperature Celsius
 102    2019-11-06 09:19    42  ***********************
 ...    ..(  2 skipped).    ..  ***********************
 105    2019-11-06 09:22    42  ***********************
 106    2019-11-06 09:23    40  *********************
 107    2019-11-06 09:24    42  ***********************
 ...    ..(  3 skipped).    ..  ***********************
 111    2019-11-06 09:28    42  ***********************
 112    2019-11-06 09:29    40  *********************
 113    2019-11-06 09:30    42  ***********************
 114    2019-11-06 09:31    40  *********************
 115    2019-11-06 09:32    42  ***********************
 116    2019-11-06 09:33     ?  -
 117    2019-11-06 09:34     ?  -
 118    2019-11-06 09:35    40  *********************
 119    2019-11-06 09:36    37  ******************
 120    2019-11-06 09:37    42  ***********************
 121    2019-11-06 09:38    39  ********************
 122    2019-11-06 09:39    39  ********************
 123    2019-11-06 09:40    40  *********************
 124    2019-11-06 09:41    39  ********************
 ...    ..(  2 skipped).    ..  ********************
 127    2019-11-06 09:44    39  ********************
   0    2019-11-06 09:45    40  *********************
   1    2019-11-06 09:46    39  ********************
   2    2019-11-06 09:47    39  ********************
   3    2019-11-06 09:48    40  *********************
   4    2019-11-06 09:49    44  *************************
   5    2019-11-06 09:50    44  *************************
   6    2019-11-06 09:51    40  *********************
   7    2019-11-06 09:52    42  ***********************
   8    2019-11-06 09:53    44  *************************
   9    2019-11-06 09:54    45  **************************
  10    2019-11-06 09:55    42  ***********************
  11    2019-11-06 09:56    40  *********************
  12    2019-11-06 09:57    42  ***********************
  13    2019-11-06 09:58    40  *********************
  14    2019-11-06 09:59    42  ***********************
  15    2019-11-06 10:00    40  *********************
  16    2019-11-06 10:01    42  ***********************
  17    2019-11-06 10:02    40  *********************
  18    2019-11-06 10:03    40  *********************
  19    2019-11-06 10:04    40  *********************
  20    2019-11-06 10:05    42  ***********************
  21    2019-11-06 10:06    42  ***********************
  22    2019-11-06 10:07    40  *********************
  23    2019-11-06 10:08    42  ***********************
 ...    ..(  2 skipped).    ..  ***********************
  26    2019-11-06 10:11    42  ***********************
  27    2019-11-06 10:12    40  *********************
  28    2019-11-06 10:13    42  ***********************
  29    2019-11-06 10:14    42  ***********************
  30    2019-11-06 10:15    42  ***********************
  31    2019-11-06 10:16    40  *********************
  32    2019-11-06 10:17    40  *********************
  33    2019-11-06 10:18    42  ***********************
  34    2019-11-06 10:19    42  ***********************
  35    2019-11-06 10:20    44  *************************
  36    2019-11-06 10:21    42  ***********************
 ...    ..(  2 skipped).    ..  ***********************
  39    2019-11-06 10:24    42  ***********************
  40    2019-11-06 10:25    45  **************************
  41    2019-11-06 10:26    42  ***********************
 ...    ..(  6 skipped).    ..  ***********************
  48    2019-11-06 10:33    42  ***********************
  49    2019-11-06 10:34    40  *********************
  50    2019-11-06 10:35    42  ***********************
 ...    ..(  4 skipped).    ..  ***********************
  55    2019-11-06 10:40    42  ***********************
  56    2019-11-06 10:41    40  *********************
  57    2019-11-06 10:42    40  *********************
  58    2019-11-06 10:43    42  ***********************
  59    2019-11-06 10:44    40  *********************
  60    2019-11-06 10:45    44  *************************
  61    2019-11-06 10:46    42  ***********************
 ...    ..(  8 skipped).    ..  ***********************
  70    2019-11-06 10:55    42  ***********************
  71    2019-11-06 10:56    44  *************************
  72    2019-11-06 10:57    42  ***********************
  73    2019-11-06 10:58    42  ***********************
  74    2019-11-06 10:59    45  **************************
  75    2019-11-06 11:00    42  ***********************
 ...    ..(  7 skipped).    ..  ***********************
  83    2019-11-06 11:08    42  ***********************
  84    2019-11-06 11:09    44  *************************
  85    2019-11-06 11:10    42  ***********************
  86    2019-11-06 11:11    42  ***********************
  87    2019-11-06 11:12    44  *************************
  88    2019-11-06 11:13    44  *************************
  89    2019-11-06 11:14    42  ***********************
 ...    ..(  2 skipped).    ..  ***********************
  92    2019-11-06 11:17    42  ***********************
  93    2019-11-06 11:18    44  *************************
  94    2019-11-06 11:19    44  *************************
  95    2019-11-06 11:20    44  *************************
  96    2019-11-06 11:21    42  ***********************
  97    2019-11-06 11:22    42  ***********************
  98    2019-11-06 11:23    45  **************************
 ...    ..(  2 skipped).    ..  **************************
 101    2019-11-06 11:26    45  **************************

SCT Error Recovery Control command not supported

Device Statistics (GP Log 0x04)
Page  Offset Size        Value Flags Description
0x01  =====  =               =  ===  == General Statistics (rev 1) ==
0x01  0x008  4              13  ---  Lifetime Power-On Resets
0x01  0x010  4            1397  ---  Power-on Hours
0x01  0x018  6       952504433  ---  Logical Sectors Written
0x01  0x020  6       154244794  ---  Number of Write Commands
0x01  0x028  6      3582083961  ---  Logical Sectors Read
0x01  0x030  6        56116875  ---  Number of Read Commands
0x01  0x038  6      4294967296  ---  Date and Time TimeStamp
0x04  =====  =               =  ===  == General Errors Statistics (rev 1) ==
0x04  0x008  4               0  ---  Number of Reported Uncorrectable Errors
0x04  0x010  4               2  ---  Resets Between Cmd Acceptance and Completion
0x05  =====  =               =  ===  == Temperature Statistics (rev 1) ==
0x05  0x008  1              44  ---  Current Temperature
0x05  0x010  1              43  ---  Average Short Term Temperature
0x05  0x018  1              43  ---  Average Long Term Temperature
0x05  0x020  1              59  ---  Highest Temperature
0x05  0x028  1               0  ---  Lowest Temperature
0x05  0x030  1              44  ---  Highest Average Short Term Temperature
0x05  0x038  1              43  ---  Lowest Average Short Term Temperature
0x05  0x040  1              50  ---  Highest Average Long Term Temperature
0x05  0x048  1              43  ---  Lowest Average Long Term Temperature
0x05  0x050  4              46  ---  Time in Over-Temperature
0x05  0x058  1              70  ---  Specified Maximum Operating Temperature
0x05  0x060  4               0  ---  Time in Under-Temperature
0x05  0x068  1               0  ---  Specified Minimum Operating Temperature
0x06  =====  =               =  ===  == Transport Statistics (rev 1) ==
0x06  0x008  4             124  ---  Number of Hardware Resets
0x06  0x010  4              11  ---  Number of ASR Events
0x06  0x018  4               0  ---  Number of Interface CRC Errors
0x07  =====  =               =  ===  == Solid State Device Statistics (rev 1) ==
0x07  0x008  1               3  ---  Percentage Used Endurance Indicator
                                |||_ C monitored condition met
                                ||__ D supports DSN
                                |___ N normalized value

Pending Defects log (GP Log 0x0c) not supported

SATA Phy Event Counters (GP Log 0x11)
ID      Size     Value  Description
0x0001  2            0  Command failed due to ICRC error
0x0002  2            0  R_ERR response for data FIS
0x0003  2            0  R_ERR response for device-to-host data FIS
0x0004  2            0  R_ERR response for host-to-device data FIS
0x0005  2            0  R_ERR response for non-data FIS
0x0006  2            0  R_ERR response for device-to-host non-data FIS
0x0007  2            0  R_ERR response for host-to-device non-data FIS
0x0008  2            0  Device-to-host non-data FIS retries
0x0009  2            0  Transition from drive PhyRdy to drive PhyNRdy
0x000a  2            4  Device-to-host register FISes sent due to a COMRESET
0x000b  2            0  CRC errors within host-to-device FIS
0x000d  2            0  Non-CRC errors within host-to-device FIS
0x000f  2            0  R_ERR response for host-to-device data FIS, CRC
0x0010  2            0  R_ERR response for host-to-device data FIS, non-CRC
0x0012  2            0  R_ERR response for host-to-device non-data FIS, CRC
0x0013  2            0  R_ERR response for host-to-device non-data FIS, non-CRC


/dev/sdb
=== START OF INFORMATION SECTION ===
Model Family:     Hitachi Travelstar 5K500.B
Device Model:     Hitachi HTS545050B9A300
Serial Number:    --
LU WWN Device Id: 5 000cca ...
Firmware Version: PB4OC64G
User Capacity:    500,107,862,016 bytes [500 GB]
Sector Size:      512 bytes logical/physical
Rotation Rate:    5400 rpm
Form Factor:      2.5 inches
Device is:        In smartctl database [for details use: -P show]
ATA Version is:   ATA8-ACS T13/1699-D revision 6
SATA Version is:  SATA 2.6, 3.0 Gb/s
Local Time is:    Wed Nov  6 11:26:19 2019 AEDT
SMART support is: Available - device has SMART capability.
SMART support is: Enabled
AAM feature is:   Disabled
APM level is:     128 (minimum power consumption without standby)
Rd look-ahead is: Enabled
Write cache is:   Enabled
DSN feature is:   Unavailable
ATA Security is:  Disabled, frozen [SEC2]
Wt Cache Reorder: Enabled

=== START OF READ SMART DATA SECTION ===
SMART overall-health self-assessment test result: PASSED

General SMART Values:
Offline data collection status:  (0x00)	Offline data collection activity
					was never started.
					Auto Offline Data Collection: Disabled.
Self-test execution status:      (   0)	The previous self-test routine completed
					without error or no self-test has ever 
					been run.
Total time to complete Offline 
data collection: 		(  645) seconds.
Offline data collection
capabilities: 			 (0x5b) SMART execute Offline immediate.
					Auto Offline data collection on/off support.
					Suspend Offline collection upon new
					command.
					Offline surface scan supported.
					Self-test supported.
					No Conveyance Self-test supported.
					Selective Self-test supported.
SMART capabilities:            (0x0003)	Saves SMART data before entering
					power-saving mode.
					Supports SMART auto save timer.
Error logging capability:        (0x01)	Error logging supported.
					General Purpose Logging supported.
Short self-test routine 
recommended polling time: 	 (   2) minutes.
Extended self-test routine
recommended polling time: 	 ( 158) minutes.
SCT capabilities: 	       (0x003d)	SCT Status supported.
					SCT Error Recovery Control supported.
					SCT Feature Control supported.
					SCT Data Table supported.

SMART Attributes Data Structure revision number: 16
Vendor Specific SMART Attributes with Thresholds:
ID# ATTRIBUTE_NAME          FLAGS    VALUE WORST THRESH FAIL RAW_VALUE
  1 Raw_Read_Error_Rate     PO-R--   100   100   062    -    0
  2 Throughput_Performance  P-S---   100   100   040    -    0
  3 Spin_Up_Time            POS---   130   130   033    -    2
  4 Start_Stop_Count        -O--C-   100   100   000    -    80
  5 Reallocated_Sector_Ct   PO--CK   100   100   005    -    0
  7 Seek_Error_Rate         PO-R--   100   100   067    -    0
  8 Seek_Time_Performance   P-S---   100   100   040    -    0
  9 Power_On_Hours          -O--C-   001   001   000    -    59857
 10 Spin_Retry_Count        PO--C-   100   100   060    -    0
 12 Power_Cycle_Count       -O--CK   100   100   000    -    80
191 G-Sense_Error_Rate      -O-R--   100   100   000    -    0
192 Power-Off_Retract_Count -O--CK   100   100   000    -    9
193 Load_Cycle_Count        -O--C-   001   001   000    -    5053946
194 Temperature_Celsius     -O----   152   152   000    -    36 (Min/Max 16/44)
196 Reallocated_Event_Count -O--CK   100   100   000    -    0
197 Current_Pending_Sector  -O---K   100   100   000    -    0
198 Offline_Uncorrectable   ---R--   100   100   000    -    0
199 UDMA_CRC_Error_Count    -O-R--   200   200   000    -    0
223 Load_Retry_Count        -O-R--   100   100   000    -    0
                            ||||||_ K auto-keep
                            |||||__ C event count
                            ||||___ R error rate
                            |||____ S speed/performance
                            ||_____ O updated online
                            |______ P prefailure warning

General Purpose Log Directory Version 1
SMART           Log Directory Version 1 [multi-sector log support]
Address    Access  R/W   Size  Description
0x00       GPL,SL  R/O      1  Log Directory
0x01           SL  R/O      1  Summary SMART error log
0x02           SL  R/O      1  Comprehensive SMART error log
0x03       GPL     R/O      1  Ext. Comprehensive SMART error log
0x06           SL  R/O      1  SMART self-test log
0x07       GPL     R/O      1  Extended self-test log
0x09           SL  R/W      1  Selective self-test log
0x10       GPL     R/O      1  NCQ Command Error log
0x11       GPL     R/O      1  SATA Phy Event Counters log
0x80-0x9f  GPL,SL  R/W     16  Host vendor specific log
0xe0       GPL,SL  R/W      1  SCT Command/Status
0xe1       GPL,SL  R/W      1  SCT Data Transfer

SMART Extended Comprehensive Error Log Version: 1 (1 sectors)
No Errors Logged

SMART Extended Self-test Log Version: 1 (1 sectors)
Num  Test_Description    Status                  Remaining  LifeTime(hours)  LBA_of_first_error
# 1  Extended offline    Completed without error       00%     57803         -
# 2  Extended offline    Completed without error       00%     38194         -

SMART Selective self-test log data structure revision number 1
 SPAN  MIN_LBA  MAX_LBA  CURRENT_TEST_STATUS
    1        0        0  Not_testing
    2        0        0  Not_testing
    3        0        0  Not_testing
    4        0        0  Not_testing
    5        0        0  Not_testing
Selective self-test flags (0x0):
  After scanning selected spans, do NOT read-scan remainder of disk.
If Selective self-test is pending on power-up, resume after 0 minute delay.

SCT Status Version:                  3
SCT Version (vendor specific):       256 (0x0100)
Device State:                        Active (0)
Current Temperature:                    36 Celsius
Power Cycle Min/Max Temperature:     30/36 Celsius
Lifetime    Min/Max Temperature:     16/44 Celsius
Specified Max Operating Temperature:    25 Celsius
Under/Over Temperature Limit Count:   0/0

SCT Temperature History Version:     2
Temperature Sampling Period:         1 minute
Temperature Logging Interval:        1 minute
Min/Max recommended Temperature:      5/60 Celsius
Min/Max Temperature Limit:           -40/65 Celsius
Temperature History Size (Index):    478 (224)

Index    Estimated Time   Temperature Celsius
 225    2019-11-06 03:29    35  ****************
 ...    ..(183 skipped).    ..  ****************
 409    2019-11-06 06:33    35  ****************
 410    2019-11-06 06:34    34  ***************
 ...    ..(  3 skipped).    ..  ***************
 414    2019-11-06 06:38    34  ***************
 415    2019-11-06 06:39    35  ****************
 416    2019-11-06 06:40    34  ***************
 ...    ..(121 skipped).    ..  ***************
  60    2019-11-06 08:42    34  ***************
  61    2019-11-06 08:43    35  ****************
 ...    ..( 57 skipped).    ..  ****************
 119    2019-11-06 09:41    35  ****************
 120    2019-11-06 09:42    30  ***********
 121    2019-11-06 09:43    30  ***********
 122    2019-11-06 09:44    30  ***********
 123    2019-11-06 09:45    31  ************
 ...    ..(  4 skipped).    ..  ************
 128    2019-11-06 09:50    31  ************
 129    2019-11-06 09:51    32  *************
 ...    ..(  6 skipped).    ..  *************
 136    2019-11-06 09:58    32  *************
 137    2019-11-06 09:59    33  **************
 ...    ..(  9 skipped).    ..  **************
 147    2019-11-06 10:09    33  **************
 148    2019-11-06 10:10    34  ***************
 ...    ..(  9 skipped).    ..  ***************
 158    2019-11-06 10:20    34  ***************
 159    2019-11-06 10:21    35  ****************
 ...    ..( 51 skipped).    ..  ****************
 211    2019-11-06 11:13    35  ****************
 212    2019-11-06 11:14    36  *****************
 ...    ..( 11 skipped).    ..  *****************
 224    2019-11-06 11:26    36  *****************

SCT Error Recovery Control:
           Read: Disabled
          Write: Disabled

Device Statistics (GP/SMART Log 0x04) not supported

Pending Defects log (GP Log 0x0c) not supported

SATA Phy Event Counters (GP Log 0x11)
ID      Size     Value  Description
0x0001  2            0  Command failed due to ICRC error
0x0002  2            0  R_ERR response for data FIS
0x0005  2            0  R_ERR response for non-data FIS
0x0009  2            3  Transition from drive PhyRdy to drive PhyNRdy
0x000a  2            2  Device-to-host register FISes sent due to a COMRESET
0x000b  2            0  CRC errors within host-to-device FIS
0x000d  2            0  Non-CRC errors within host-to-device FIS

